default.csv
M,K,N,BLOCK_M,BLOCK_K,BLOCK_N,NUM_STAGES,NUM_WARPS,GROUP_M,do_bench_time
SAME
--------------------
768,512,768,32,16,32,1,2,8,0.035711999982595444
768,512,768,32,128,32,2,4,8,0.025312000885605812
768,512,768,32,32,64,5,8,8,0.025439999997615814
768,512,768,64,32,32,5,8,8,0.025407999753952026
768,512,768,64,128,32,5,4,8,0.025248000398278236
768,512,768,64,16,64,2,4,8,0.03500799834728241
768,512,768,64,32,64,2,4,8,0.027488000690937042
768,512,768,64,64,64,3,8,8,0.02550400048494339
768,512,768,64,128,64,5,4,8,0.024447999894618988
768,512,768,64,32,128,3,4,8,0.024351999163627625
768,512,768,64,32,128,4,8,8,0.024383999407291412
768,512,768,64,64,128,3,4,8,0.024607999250292778
768,512,768,64,128,128,4,4,8,0.023615999147295952
768,512,768,128,32,64,3,4,8,0.024191999807953835
768,512,768,128,32,64,4,8,8,0.023552000522613525
768,512,768,128,32,128,2,8,8,0.027712000533938408
768,512,768,128,32,128,3,4,8,0.024831999093294144
768,512,768,128,64,128,3,4,8,0.024639999493956566
768,512,768,128,64,128,5,8,8,0.024447999894618988
SAME
--------------------
1024,4096,128,32,16,32,1,2,8,0.12601600587368011
1024,4096,128,32,128,32,2,4,8,0.04793599992990494
1024,4096,128,32,32,64,5,8,8,0.04412800073623657
1024,4096,128,64,32,32,5,8,8,0.04464000090956688
1024,4096,128,64,128,32,5,4,8,0.02860799990594387
1024,4096,128,64,16,64,2,4,8,0.14553600549697876
1024,4096,128,64,32,64,2,4,8,0.09804800152778625
1024,4096,128,64,64,64,3,8,8,0.043616000562906265
1024,4096,128,64,128,64,5,4,8,0.027583999559283257
1024,4096,128,64,32,128,3,4,8,0.06464000046253204
1024,4096,128,64,32,128,4,8,8,0.05110400170087814
1024,4096,128,64,64,128,3,4,8,0.04335999861359596
1024,4096,128,64,128,128,4,4,8,0.03033600002527237
1024,4096,128,128,32,64,3,4,8,0.06675200164318085
1024,4096,128,128,32,64,4,8,8,0.05260799825191498
1024,4096,128,128,32,128,2,8,8,0.1061440035700798
1024,4096,128,128,32,128,3,4,8,0.0687360018491745
1024,4096,128,128,64,128,3,4,8,0.04575999826192856
1024,4096,128,128,64,128,5,8,8,0.03862399980425835
SAME
--------------------
50265,1024,1024,32,16,32,1,2,8,1.3022079467773438
50265,1024,1024,32,128,32,2,4,8,0.7451840043067932
50265,1024,1024,32,32,64,5,8,8,0.895039975643158
50265,1024,1024,64,32,32,5,8,8,0.779807984828949
50265,1024,1024,64,128,32,5,4,8,0.5797439813613892
50265,1024,1024,64,16,64,2,4,8,0.4419519901275635
50265,1024,1024,64,32,64,2,4,8,0.32556799054145813
50265,1024,1024,64,64,64,3,8,8,0.3256959915161133
50265,1024,1024,64,128,64,5,4,8,0.35791999101638794
50265,1024,1024,64,32,128,3,4,8,0.2417600005865097
50265,1024,1024,64,32,128,4,8,8,0.2624959945678711
50265,1024,1024,64,64,128,3,4,8,0.23254400491714478
50265,1024,1024,64,128,128,4,4,8,0.28307199478149414
50265,1024,1024,128,32,64,3,4,8,0.26815998554229736
50265,1024,1024,128,32,64,4,8,8,0.2715519964694977
50265,1024,1024,128,32,128,2,8,8,0.3007679879665375
50265,1024,1024,128,32,128,3,4,8,0.2136320024728775
50265,1024,1024,128,64,128,3,4,8,0.21667200326919556
50265,1024,1024,128,64,128,5,8,8,0.21065600216388702
SAME
--------------------
256,1024,1024,32,16,32,1,2,8,0.05196800082921982
256,1024,1024,32,128,32,2,4,8,0.025728000327944756
256,1024,1024,32,32,64,5,8,8,0.022911999374628067
256,1024,1024,64,32,32,5,8,8,0.02489599958062172
256,1024,1024,64,128,32,5,4,8,0.024032000452280045
256,1024,1024,64,16,64,2,4,8,0.05305600166320801
256,1024,1024,64,32,64,2,4,8,0.03619199991226196
256,1024,1024,64,64,64,3,8,8,0.02505600079894066
256,1024,1024,64,128,64,5,4,8,0.023264000192284584
256,1024,1024,64,32,128,3,4,8,0.027936000376939774
256,1024,1024,64,32,128,4,8,8,0.02486399933695793
256,1024,1024,64,64,128,3,4,8,0.025536000728607178
256,1024,1024,64,128,128,4,4,8,0.02470399998128414
256,1024,1024,128,32,64,3,4,8,0.031039999797940254
256,1024,1024,128,32,64,4,8,8,0.02470399998128414
256,1024,1024,128,32,128,2,8,8,0.04118400067090988
256,1024,1024,128,32,128,3,4,8,0.03286400064826012
256,1024,1024,128,64,128,3,4,8,0.028736000880599022
256,1024,1024,128,64,128,5,8,8,0.024800000712275505
SAME
--------------------
4096,2048,1024,32,16,32,1,2,8,0.22233599424362183
4096,2048,1024,32,128,32,2,4,8,0.12361600250005722
4096,2048,1024,32,32,64,5,8,8,0.14857600629329681
4096,2048,1024,64,32,32,5,8,8,0.1287039965391159
4096,2048,1024,64,128,32,5,4,8,0.10393600165843964
4096,2048,1024,64,16,64,2,4,8,0.10396800190210342
4096,2048,1024,64,32,64,2,4,8,0.07023999840021133
4096,2048,1024,64,64,64,3,8,8,0.05830400064587593
4096,2048,1024,64,128,64,5,4,8,0.0671359971165657
4096,2048,1024,64,32,128,3,4,8,0.052799999713897705
4096,2048,1024,64,32,128,4,8,8,0.052032001316547394
4096,2048,1024,64,64,128,3,4,8,0.05708799883723259
4096,2048,1024,64,128,128,4,4,8,0.05564799904823303
4096,2048,1024,128,32,64,3,4,8,0.054687999188899994
4096,2048,1024,128,32,64,4,8,8,0.05564799904823303
4096,2048,1024,128,32,128,2,8,8,0.0737600028514862
4096,2048,1024,128,32,128,3,4,8,0.05484800040721893
4096,2048,1024,128,64,128,3,4,8,0.046112000942230225
4096,2048,1024,128,64,128,5,8,8,0.048767998814582825
SAME
--------------------
512,32000,768,32,16,32,1,2,8,1.0601600408554077
512,32000,768,32,128,32,2,4,8,0.24931199848651886
512,32000,768,32,32,64,5,8,8,0.28336000442504883
512,32000,768,64,32,32,5,8,8,0.23676800727844238
512,32000,768,64,128,32,5,4,8,0.15318399667739868
512,32000,768,64,16,64,2,4,8,1.15830397605896
512,32000,768,64,32,64,2,4,8,0.6425279974937439
512,32000,768,64,64,64,3,8,8,0.20876799523830414
512,32000,768,64,128,64,5,4,8,0.1005759984254837
512,32000,768,64,32,128,3,4,8,0.35231998562812805
512,32000,768,64,32,128,4,8,8,0.2518720030784607
512,32000,768,64,64,128,3,4,8,0.2077759951353073
512,32000,768,64,128,128,4,4,8,0.1125440001487732
512,32000,768,128,32,64,3,4,8,0.37459200620651245
512,32000,768,128,32,64,4,8,8,0.26416000723838806
512,32000,768,128,32,128,2,8,8,0.7300159931182861
512,32000,768,128,32,128,3,4,8,0.3882560133934021
512,32000,768,128,64,128,3,4,8,0.2253119945526123
512,32000,768,128,64,128,5,8,8,0.16444799304008484
SAME
--------------------
768,4096,2304,32,16,32,1,2,8,0.19020800292491913
768,4096,2304,32,128,32,2,4,8,0.10963200032711029
768,4096,2304,32,32,64,5,8,8,0.12902399897575378
768,4096,2304,64,32,32,5,8,8,0.11276800185441971
768,4096,2304,64,128,32,5,4,8,0.0928959995508194
768,4096,2304,64,16,64,2,4,8,0.16771200299263
768,4096,2304,64,32,64,2,4,8,0.11081600189208984
768,4096,2304,64,64,64,3,8,8,0.06345599889755249
768,4096,2304,64,128,64,5,4,8,0.06614399701356888
768,4096,2304,64,32,128,3,4,8,0.07228799909353256
768,4096,2304,64,32,128,4,8,8,0.060416001826524734
768,4096,2304,64,64,128,3,4,8,0.053408000618219376
768,4096,2304,64,128,128,4,4,8,0.0560000017285347
768,4096,2304,128,32,64,3,4,8,0.07487999647855759
768,4096,2304,128,32,64,4,8,8,0.061216000467538834
768,4096,2304,128,32,128,2,8,8,0.11337599903345108
768,4096,2304,128,32,128,3,4,8,0.07513599842786789
768,4096,2304,128,64,128,3,4,8,0.05446400120854378
768,4096,2304,128,64,128,5,8,8,0.04438399896025658
SAME
--------------------
256,1024,4096,32,16,32,1,2,8,0.05724800005555153
256,1024,4096,32,128,32,2,4,8,0.03846399858593941
256,1024,4096,32,32,64,5,8,8,0.037408001720905304
256,1024,4096,64,32,32,5,8,8,0.035232000052928925
256,1024,4096,64,128,32,5,4,8,0.03248000144958496
256,1024,4096,64,16,64,2,4,8,0.05798399820923805
256,1024,4096,64,32,64,2,4,8,0.04188799858093262
256,1024,4096,64,64,64,3,8,8,0.028063999488949776
256,1024,4096,64,128,64,5,4,8,0.02831999957561493
256,1024,4096,64,32,128,3,4,8,0.03190400078892708
256,1024,4096,64,32,128,4,8,8,0.02876799926161766
256,1024,4096,64,64,128,3,4,8,0.027135999873280525
256,1024,4096,64,128,128,4,4,8,0.02672000043094158
256,1024,4096,128,32,64,3,4,8,0.03484800085425377
256,1024,4096,128,32,64,4,8,8,0.028736000880599022
256,1024,4096,128,32,128,2,8,8,0.043455999344587326
256,1024,4096,128,32,128,3,4,8,0.03593600168824196
256,1024,4096,128,64,128,3,4,8,0.031968001276254654
256,1024,4096,128,64,128,5,8,8,0.026655999943614006
SAME
--------------------
2048,512,30522,32,16,32,1,2,8,0.8426240086555481
2048,512,30522,32,128,32,2,4,8,0.6866559982299805
2048,512,30522,32,32,64,5,8,8,0.7557439804077148
2048,512,30522,64,32,32,5,8,8,0.5641279816627502
2048,512,30522,64,128,32,5,4,8,0.8446400165557861
2048,512,30522,64,16,64,2,4,8,0.4166400134563446
2048,512,30522,64,32,64,2,4,8,0.30483201146125793
2048,512,30522,64,64,64,3,8,8,0.510591983795166
2048,512,30522,64,128,64,5,4,8,0.5981119871139526
2048,512,30522,64,32,128,3,4,8,0.2617279887199402
2048,512,30522,64,32,128,4,8,8,0.3003840148448944
2048,512,30522,64,64,128,3,4,8,0.2882559895515442
2048,512,30522,64,128,128,4,4,8,0.474016010761261
2048,512,30522,128,32,64,3,4,8,0.23942400515079498
2048,512,30522,128,32,64,4,8,8,0.25254398584365845
2048,512,30522,128,32,128,2,8,8,0.29657599329948425
2048,512,30522,128,32,128,3,4,8,0.22176000475883484
2048,512,30522,128,64,128,3,4,8,0.22111999988555908
2048,512,30522,128,64,128,5,8,8,0.27372801303863525
SAME
--------------------
32005,512,768,32,16,32,1,2,8,0.32438400387763977
32005,512,768,32,128,32,2,4,8,0.19203199446201324
32005,512,768,32,32,64,5,8,8,0.2306240051984787
32005,512,768,64,32,32,5,8,8,0.20399999618530273
32005,512,768,64,128,32,5,4,8,0.19945600628852844
32005,512,768,64,16,64,2,4,8,0.12518399953842163
32005,512,768,64,32,64,2,4,8,0.10627199709415436
32005,512,768,64,64,64,3,8,8,0.1011200025677681
32005,512,768,64,128,64,5,4,8,0.11692799627780914
32005,512,768,64,32,128,3,4,8,0.07900799810886383
32005,512,768,64,32,128,4,8,8,0.08483199775218964
32005,512,768,64,64,128,3,4,8,0.08105599880218506
32005,512,768,64,128,128,4,4,8,0.10358399897813797
32005,512,768,128,32,64,3,4,8,0.08617600053548813
32005,512,768,128,32,64,4,8,8,0.0867839977145195
32005,512,768,128,32,128,2,8,8,0.1093439981341362
32005,512,768,128,32,128,3,4,8,0.07785599678754807
32005,512,768,128,64,128,3,4,8,0.07993599772453308
32005,512,768,128,64,128,5,8,8,0.08102399855852127
SAME
--------------------
256,8192,256,32,16,32,1,2,8,0.2574400007724762
256,8192,256,32,128,32,2,4,8,0.07526399940252304
256,8192,256,32,32,64,5,8,8,0.0626240000128746
256,8192,256,64,32,32,5,8,8,0.06272000074386597
256,8192,256,64,128,32,5,4,8,0.03510399907827377
256,8192,256,64,16,64,2,4,8,0.2958720028400421
256,8192,256,64,32,64,2,4,8,0.16646400094032288
256,8192,256,64,64,64,3,8,8,0.06543999910354614
256,8192,256,64,128,64,5,4,8,0.03465599939227104
256,8192,256,64,32,128,3,4,8,0.10393600165843964
256,8192,256,64,32,128,4,8,8,0.07744000107049942
256,8192,256,64,64,128,3,4,8,0.06576000154018402
256,8192,256,64,128,128,4,4,8,0.04428799822926521
256,8192,256,128,32,64,3,4,8,0.10732799768447876
256,8192,256,128,32,64,4,8,8,0.08128000050783157
256,8192,256,128,32,128,2,8,8,0.19068799912929535
256,8192,256,128,32,128,3,4,8,0.10835199803113937
256,8192,256,128,64,128,3,4,8,0.06985600292682648
256,8192,256,128,64,128,5,8,8,0.05852799862623215
SAME
--------------------
512,768,50257,32,16,32,1,2,8,0.5705599784851074
512,768,50257,32,128,32,2,4,8,1.029088020324707
512,768,50257,32,32,64,5,8,8,0.5652160048484802
512,768,50257,64,32,32,5,8,8,0.4705600142478943
512,768,50257,64,128,32,5,4,8,0.6447679996490479
512,768,50257,64,16,64,2,4,8,0.34300801157951355
512,768,50257,64,32,64,2,4,8,0.3697279989719391
512,768,50257,64,64,64,3,8,8,0.36073601245880127
512,768,50257,64,128,64,5,4,8,1.418496012687683
512,768,50257,64,32,128,3,4,8,0.3246079981327057
512,768,50257,64,32,128,4,8,8,0.39827200770378113
512,768,50257,64,64,128,3,4,8,0.27987200021743774
512,768,50257,64,128,128,4,4,8,0.2577280104160309
512,768,50257,128,32,64,3,4,8,0.19580799341201782
512,768,50257,128,32,64,4,8,8,0.24982400238513947
512,768,50257,128,32,128,2,8,8,0.2531839907169342
512,768,50257,128,32,128,3,4,8,0.20147199928760529
512,768,50257,128,64,128,3,4,8,0.17564800381660461
512,768,50257,128,64,128,5,8,8,0.25651198625564575
SAME
--------------------
50265,8192,512,32,16,32,1,2,8,5.102015972137451
50265,8192,512,32,128,32,2,4,8,2.754688024520874
50265,8192,512,32,32,64,5,8,8,3.310336112976074
50265,8192,512,64,32,32,5,8,8,2.905247926712036
50265,8192,512,64,128,32,5,4,8,1.953503966331482
50265,8192,512,64,16,64,2,4,8,1.97433602809906
50265,8192,512,64,32,64,2,4,8,1.3046720027923584
50265,8192,512,64,64,64,3,8,8,1.350208044052124
50265,8192,512,64,128,64,5,4,8,1.1601279973983765
50265,8192,512,64,32,128,3,4,8,0.9855999946594238
50265,8192,512,64,32,128,4,8,8,1.0728319883346558
50265,8192,512,64,64,128,3,4,8,0.9083840250968933
50265,8192,512,64,128,128,4,4,8,0.9411200284957886
50265,8192,512,128,32,64,3,4,8,1.0807360410690308
50265,8192,512,128,32,64,4,8,8,1.105023980140686
50265,8192,512,128,32,128,2,8,8,1.306496024131775
50265,8192,512,128,32,128,3,4,8,0.7982079982757568
50265,8192,512,128,64,128,3,4,8,0.7263680100440979
50265,8192,512,128,64,128,5,8,8,0.7589759826660156
SAME
--------------------
2048,1024,1024,32,16,32,1,2,8,0.07292799651622772
2048,1024,1024,32,128,32,2,4,8,0.0504320003092289
2048,1024,1024,32,32,64,5,8,8,0.0549440011382103
2048,1024,1024,64,32,32,5,8,8,0.05113599821925163
2048,1024,1024,64,128,32,5,4,8,0.043935999274253845
2048,1024,1024,64,16,64,2,4,8,0.05411199852824211
2048,1024,1024,64,32,64,2,4,8,0.03872000053524971
2048,1024,1024,64,64,64,3,8,8,0.02768000029027462
2048,1024,1024,64,128,64,5,4,8,0.033055998384952545
2048,1024,1024,64,32,128,3,4,8,0.029664000496268272
2048,1024,1024,64,32,128,4,8,8,0.027424000203609467
2048,1024,1024,64,64,128,3,4,8,0.026528000831604004
2048,1024,1024,64,128,128,4,4,8,0.029311999678611755
2048,1024,1024,128,32,64,3,4,8,0.03311999887228012
2048,1024,1024,128,32,64,4,8,8,0.028031999245285988
2048,1024,1024,128,32,128,2,8,8,0.040863998234272
2048,1024,1024,128,32,128,3,4,8,0.034432001411914825
2048,1024,1024,128,64,128,3,4,8,0.029888000339269638
2048,1024,1024,128,64,128,5,8,8,0.02521600015461445
SAME
--------------------
2048,1024,4096,32,16,32,1,2,8,0.2215999960899353
2048,1024,4096,32,128,32,2,4,8,0.11955200135707855
2048,1024,4096,32,32,64,5,8,8,0.1515520066022873
2048,1024,4096,64,32,32,5,8,8,0.1340160071849823
2048,1024,4096,64,128,32,5,4,8,0.1093439981341362
2048,1024,4096,64,16,64,2,4,8,0.09296000003814697
2048,1024,4096,64,32,64,2,4,8,0.06764800101518631
2048,1024,4096,64,64,64,3,8,8,0.06470400094985962
2048,1024,4096,64,128,64,5,4,8,0.0769599974155426
2048,1024,4096,64,32,128,3,4,8,0.050944000482559204
2048,1024,4096,64,32,128,4,8,8,0.054976001381874084
2048,1024,4096,64,64,128,3,4,8,0.05183999985456467
2048,1024,4096,64,128,128,4,4,8,0.06163199990987778
2048,1024,4096,128,32,64,3,4,8,0.05510399863123894
2048,1024,4096,128,32,64,4,8,8,0.05737600103020668
2048,1024,4096,128,32,128,2,8,8,0.06351999938488007
2048,1024,4096,128,32,128,3,4,8,0.054816000163555145
2048,1024,4096,128,64,128,3,4,8,0.04947200044989586
2048,1024,4096,128,64,128,5,8,8,0.0488319993019104
SAME
--------------------
768,16,768,32,16,32,1,2,8,0.024000000208616257
768,16,768,32,16,32,2,4,8,0.024064000695943832
768,16,768,32,16,64,5,8,8,0.024320000782608986
768,16,768,64,16,32,5,8,8,0.024351999163627625
768,16,768,64,16,32,5,4,8,0.023584000766277313
768,16,768,64,16,64,2,4,8,0.024288000538945198
768,16,768,64,16,64,3,8,8,0.024000000208616257
768,16,768,64,16,64,5,4,8,0.02454400062561035
768,16,768,64,16,128,3,4,8,0.02425600029528141
768,16,768,64,16,128,4,8,8,0.02412799932062626
768,16,768,64,16,128,4,4,8,0.024320000782608986
768,16,768,128,16,64,3,4,8,0.024320000782608986
768,16,768,128,16,64,4,8,8,0.02300800010561943
768,16,768,128,16,128,2,8,8,0.024064000695943832
768,16,768,128,16,128,3,4,8,0.02457600086927414
768,16,768,128,16,128,5,8,8,0.024064000695943832
SAME
--------------------
30000,1024,128,32,16,32,1,2,8,0.11324799805879593
30000,1024,128,32,128,32,2,4,8,0.0875839963555336
30000,1024,128,32,32,64,5,8,8,0.08963199704885483
30000,1024,128,64,32,32,5,8,8,0.08463999629020691
30000,1024,128,64,128,32,5,4,8,0.07676800340414047
30000,1024,128,64,16,64,2,4,8,0.08585599809885025
30000,1024,128,64,32,64,2,4,8,0.07596799731254578
30000,1024,128,64,64,64,3,8,8,0.0605119988322258
30000,1024,128,64,128,64,5,4,8,0.06486400216817856
30000,1024,128,64,32,128,3,4,8,0.06083200126886368
30000,1024,128,64,32,128,4,8,8,0.06534399837255478
30000,1024,128,64,64,128,3,4,8,0.06111999973654747
30000,1024,128,64,128,128,4,4,8,0.061055999249219894
30000,1024,128,128,32,64,3,4,8,0.0629120022058487
30000,1024,128,128,32,64,4,8,8,0.07036799937486649
30000,1024,128,128,32,128,2,8,8,0.07868800312280655
30000,1024,128,128,32,128,3,4,8,0.06393600255250931
30000,1024,128,128,64,128,3,4,8,0.059007998555898666
30000,1024,128,128,64,128,5,8,8,0.059776000678539276
SAME
--------------------
1024,4096,1024,32,16,32,1,2,8,0.14988799393177032
1024,4096,1024,32,128,32,2,4,8,0.08566399663686752
1024,4096,1024,32,32,64,5,8,8,0.08905600011348724
1024,4096,1024,64,32,32,5,8,8,0.07820799946784973
1024,4096,1024,64,128,32,5,4,8,0.05961599946022034
1024,4096,1024,64,16,64,2,4,8,0.157151997089386
1024,4096,1024,64,32,64,2,4,8,0.10569600015878677
1024,4096,1024,64,64,64,3,8,8,0.049375999718904495
1024,4096,1024,64,128,64,5,4,8,0.04255999997258186
1024,4096,1024,64,32,128,3,4,8,0.06815999746322632
1024,4096,1024,64,32,128,4,8,8,0.055743999779224396
1024,4096,1024,64,64,128,3,4,8,0.048576001077890396
1024,4096,1024,64,128,128,4,4,8,0.036607999354600906
1024,4096,1024,128,32,64,3,4,8,0.07065600156784058
1024,4096,1024,128,32,64,4,8,8,0.05686400085687637
1024,4096,1024,128,32,128,2,8,8,0.10918399691581726
1024,4096,1024,128,32,128,3,4,8,0.07199999690055847
1024,4096,1024,128,64,128,3,4,8,0.05036799982190132
1024,4096,1024,128,64,128,5,8,8,0.04118400067090988
SAME
--------------------
2048,50272,768,32,16,32,1,2,8,1.851680040359497
2048,50272,768,32,128,32,2,4,8,1.180799961090088
2048,50272,768,32,32,64,5,8,8,1.274399995803833
2048,50272,768,64,32,32,5,8,8,1.1656960248947144
2048,50272,768,64,128,32,5,4,8,0.7965440154075623
2048,50272,768,64,16,64,2,4,8,1.8244800567626953
2048,50272,768,64,32,64,2,4,8,1.0074880123138428
2048,50272,768,64,64,64,3,8,8,0.5833920240402222
2048,50272,768,64,128,64,5,4,8,0.5273920297622681
2048,50272,768,64,32,128,3,4,8,0.563040018081665
2048,50272,768,64,32,128,4,8,8,0.4603840112686157
2048,50272,768,64,64,128,3,4,8,0.38870400190353394
2048,50272,768,64,128,128,4,4,8,0.4256319999694824
2048,50272,768,128,32,64,3,4,8,0.5960320234298706
2048,50272,768,128,32,64,4,8,8,0.4564799964427948
2048,50272,768,128,32,128,2,8,8,1.1373120546340942
2048,50272,768,128,32,128,3,4,8,0.6077439785003662
2048,50272,768,128,64,128,3,4,8,0.37836799025535583
2048,50272,768,128,64,128,5,8,8,0.33955198526382446
SAME
--------------------
4096,768,3072,32,16,32,1,2,8,0.2492160052061081
4096,768,3072,32,128,32,2,4,8,0.14220799505710602
4096,768,3072,32,32,64,5,8,8,0.1709119975566864
4096,768,3072,64,32,32,5,8,8,0.15056000649929047
4096,768,3072,64,128,32,5,4,8,0.12982399761676788
4096,768,3072,64,16,64,2,4,8,0.09843199700117111
4096,768,3072,64,32,64,2,4,8,0.07577600330114365
4096,768,3072,64,64,64,3,8,8,0.07327999919652939
4096,768,3072,64,128,64,5,4,8,0.09126400202512741
4096,768,3072,64,32,128,3,4,8,0.06233600154519081
4096,768,3072,64,32,128,4,8,8,0.062144000083208084
4096,768,3072,64,64,128,3,4,8,0.056671999394893646
4096,768,3072,64,128,128,4,4,8,0.07356800138950348
4096,768,3072,128,32,64,3,4,8,0.06364800035953522
4096,768,3072,128,32,64,4,8,8,0.06505600363016129
4096,768,3072,128,32,128,2,8,8,0.07184000313282013
4096,768,3072,128,32,128,3,4,8,0.05244800075888634
4096,768,3072,128,64,128,3,4,8,0.0562559999525547
4096,768,3072,128,64,128,5,8,8,0.05673599988222122
SAME
--------------------
1024,4096,4096,32,16,32,1,2,8,0.43721601366996765
1024,4096,4096,32,128,32,2,4,8,0.22483199834823608
1024,4096,4096,32,32,64,5,8,8,0.2842560112476349
1024,4096,4096,64,32,32,5,8,8,0.24799999594688416
1024,4096,4096,64,128,32,5,4,8,0.1674879938364029
1024,4096,4096,64,16,64,2,4,8,0.18009600043296814
1024,4096,4096,64,32,64,2,4,8,0.11539199948310852
1024,4096,4096,64,64,64,3,8,8,0.1157120019197464
1024,4096,4096,64,128,64,5,4,8,0.11564800143241882
1024,4096,4096,64,32,128,3,4,8,0.0833280012011528
1024,4096,4096,64,32,128,4,8,8,0.09174399822950363
1024,4096,4096,64,64,128,3,4,8,0.09424000233411789
1024,4096,4096,64,128,128,4,4,8,0.09481599926948547
1024,4096,4096,128,32,64,3,4,8,0.08908800035715103
1024,4096,4096,128,32,64,4,8,8,0.10041599720716476
1024,4096,4096,128,32,128,2,8,8,0.11606399714946747
1024,4096,4096,128,32,128,3,4,8,0.08495999872684479
1024,4096,4096,128,64,128,3,4,8,0.06739199906587601
1024,4096,4096,128,64,128,5,8,8,0.0740479975938797
SAME
--------------------
2,2048,768,16,16,32,1,2,8,0.08521600067615509
2,2048,768,16,128,32,2,2,8,0.03203200176358223
2,2048,768,16,32,64,5,4,8,0.02812799997627735
2,2048,768,16,32,32,5,2,8,0.028224000707268715
2,2048,768,16,128,32,5,2,8,0.02473600022494793
2,2048,768,16,16,64,2,4,8,0.08495999872684479
2,2048,768,16,32,64,2,4,8,0.055615998804569244
2,2048,768,16,64,64,3,4,8,0.028863999992609024
2,2048,768,16,128,64,5,4,8,0.02505600079894066
2,2048,768,16,32,128,3,4,8,0.04012800008058548
2,2048,768,16,32,128,4,8,8,0.03222399950027466
2,2048,768,16,64,128,3,4,8,0.032575998455286026
2,2048,768,16,128,128,4,4,8,0.025887999683618546
2,2048,768,16,32,64,3,4,8,0.03788800165057182
2,2048,768,16,32,64,4,4,8,0.031808000057935715
2,2048,768,16,32,128,2,8,8,0.05936000123620033
2,2048,768,16,64,128,5,8,8,0.0261439997702837
SAME
--------------------
768,4096,3072,32,16,32,1,2,8,0.3076480031013489
768,4096,3072,32,128,32,2,4,8,0.13478399813175201
768,4096,3072,32,32,64,5,8,8,0.16448000073432922
768,4096,3072,64,32,32,5,8,8,0.13945600390434265
768,4096,3072,64,128,32,5,4,8,0.11340799927711487
768,4096,3072,64,16,64,2,4,8,0.17315199971199036
768,4096,3072,64,32,64,2,4,8,0.11366400122642517
768,4096,3072,64,64,64,3,8,8,0.08262400329113007
768,4096,3072,64,128,64,5,4,8,0.08115199953317642
768,4096,3072,64,32,128,3,4,8,0.07631999999284744
768,4096,3072,64,32,128,4,8,8,0.06950400024652481
768,4096,3072,64,64,128,3,4,8,0.05929600074887276
768,4096,3072,64,128,128,4,4,8,0.07276800274848938
768,4096,3072,128,32,64,3,4,8,0.0783040001988411
768,4096,3072,128,32,64,4,8,8,0.06924799829721451
768,4096,3072,128,32,128,2,8,8,0.11449600011110306
768,4096,3072,128,32,128,3,4,8,0.0791039988398552
768,4096,3072,128,64,128,3,4,8,0.06304000318050385
768,4096,3072,128,64,128,5,8,8,0.07152000069618225
SAME
--------------------
8192,768,3072,32,16,32,1,2,8,0.4886400103569031
8192,768,3072,32,128,32,2,4,8,0.2796800136566162
8192,768,3072,32,32,64,5,8,8,0.3370879888534546
8192,768,3072,64,32,32,5,8,8,0.2953279912471771
8192,768,3072,64,128,32,5,4,8,0.25203201174736023
8192,768,3072,64,16,64,2,4,8,0.1629759967327118
8192,768,3072,64,32,64,2,4,8,0.12441600114107132
8192,768,3072,64,64,64,3,8,8,0.12217599898576736
8192,768,3072,64,128,64,5,4,8,0.14822399616241455
8192,768,3072,64,32,128,3,4,8,0.10406400263309479
8192,768,3072,64,32,128,4,8,8,0.10787200182676315
8192,768,3072,64,64,128,3,4,8,0.09955199807882309
8192,768,3072,64,128,128,4,4,8,0.11459200084209442
8192,768,3072,128,32,64,3,4,8,0.10831999778747559
8192,768,3072,128,32,64,4,8,8,0.1117120012640953
8192,768,3072,128,32,128,2,8,8,0.10822399705648422
8192,768,3072,128,32,128,3,4,8,0.08924800157546997
8192,768,3072,128,64,128,3,4,8,0.09673599898815155
8192,768,3072,128,64,128,5,8,8,0.09775999933481216
SAME
--------------------
2048,50272,1024,32,16,32,1,2,8,2.4636480808258057
2048,50272,1024,32,128,32,2,4,8,1.6105279922485352
2048,50272,1024,32,32,64,5,8,8,1.7017600536346436
2048,50272,1024,64,32,32,5,8,8,1.5666559934616089
2048,50272,1024,64,128,32,5,4,8,1.0643199682235718
2048,50272,1024,64,16,64,2,4,8,1.811295986175537
2048,50272,1024,64,32,64,2,4,8,1.008512020111084
2048,50272,1024,64,64,64,3,8,8,0.780351996421814
2048,50272,1024,64,128,64,5,4,8,0.7146880030632019
2048,50272,1024,64,32,128,3,4,8,0.5776640176773071
2048,50272,1024,64,32,128,4,8,8,0.5164160132408142
2048,50272,1024,64,64,128,3,4,8,0.4368959963321686
2048,50272,1024,64,128,128,4,4,8,0.4503040015697479
2048,50272,1024,128,32,64,3,4,8,0.6131839752197266
2048,50272,1024,128,32,64,4,8,8,0.5071359872817993
2048,50272,1024,128,32,128,2,8,8,1.1369919776916504
2048,50272,1024,128,32,128,3,4,8,0.608672022819519
2048,50272,1024,128,64,128,3,4,8,0.4102720022201538
2048,50272,1024,128,64,128,5,8,8,0.3914240002632141
SAME
--------------------
512,30522,128,32,16,32,1,2,8,1.071295976638794
512,30522,128,32,128,32,2,4,8,0.21772800385951996
512,30522,128,32,32,64,5,8,8,0.19484800100326538
512,30522,128,64,32,32,5,8,8,0.27084800601005554
512,30522,128,64,128,32,5,4,8,0.16944000124931335
512,30522,128,64,16,64,2,4,8,1.1934720277786255
512,30522,128,64,32,64,2,4,8,0.6801919937133789
512,30522,128,64,64,64,3,8,8,0.2603519856929779
512,30522,128,64,128,64,5,4,8,0.18611200153827667
512,30522,128,64,32,128,3,4,8,0.37059199810028076
512,30522,128,64,32,128,4,8,8,0.2717440128326416
512,30522,128,64,64,128,3,4,8,0.22486400604248047
512,30522,128,64,128,128,4,4,8,0.20243200659751892
512,30522,128,128,32,64,3,4,8,0.39769598841667175
512,30522,128,128,32,64,4,8,8,0.30483201146125793
512,30522,128,128,32,128,2,8,8,0.7899519801139832
512,30522,128,128,32,128,3,4,8,0.42105600237846375
512,30522,128,128,64,128,3,4,8,0.43750399351119995
512,30522,128,128,64,128,5,8,8,0.3800640106201172
SAME
--------------------
2,32768,256,16,16,32,1,2,8,0.9926720261573792
2,32768,256,16,128,32,2,2,8,0.20880000293254852
2,32768,256,16,32,64,5,4,8,0.16012799739837646
2,32768,256,16,32,32,5,2,8,0.15321600437164307
2,32768,256,16,128,32,5,2,8,0.09334400296211243
2,32768,256,16,16,64,2,4,8,1.0698879957199097
2,32768,256,16,32,64,2,4,8,0.584384024143219
2,32768,256,16,64,64,3,4,8,0.17615999281406403
2,32768,256,16,128,64,5,4,8,0.09708800166845322
2,32768,256,16,32,128,3,4,8,0.3643839955329895
2,32768,256,16,32,128,4,8,8,0.23177599906921387
2,32768,256,16,64,128,3,4,8,0.2333119958639145
2,32768,256,16,128,128,4,4,8,0.12172800302505493
2,32768,256,16,32,64,3,4,8,0.298335999250412
2,32768,256,16,32,64,4,4,8,0.20841600000858307
2,32768,256,16,32,128,2,8,8,0.6574400067329407
2,32768,256,16,64,128,5,8,8,0.1441279947757721
SAME
--------------------
1024,2,1024,32,16,32,1,2,8,0.025151999667286873
1024,2,1024,32,16,32,2,4,8,0.024639999493956566
1024,2,1024,32,16,64,5,8,8,0.024512000381946564
1024,2,1024,64,16,32,5,8,8,0.02380800060927868
1024,2,1024,64,16,32,5,4,8,0.024224000051617622
1024,2,1024,64,16,64,2,4,8,0.024383999407291412
1024,2,1024,64,16,64,3,8,8,0.02409599907696247
1024,2,1024,64,16,64,5,4,8,0.02486399933695793
1024,2,1024,64,16,128,3,4,8,0.024800000712275505
1024,2,1024,64,16,128,4,8,8,0.02380800060927868
1024,2,1024,64,16,128,4,4,8,0.024320000782608986
1024,2,1024,128,16,64,3,4,8,0.024288000538945198
1024,2,1024,128,16,64,4,8,8,0.024639999493956566
1024,2,1024,128,16,128,2,8,8,0.025151999667286873
1024,2,1024,128,16,128,3,4,8,0.02425600029528141
1024,2,1024,128,16,128,5,8,8,0.024032000452280045
SAME
--------------------
4096,2,512,32,16,32,1,2,8,0.025472000241279602
4096,2,512,32,16,32,2,4,8,0.024960000067949295
4096,2,512,32,16,64,5,8,8,0.024191999807953835
4096,2,512,64,16,32,5,8,8,0.024831999093294144
4096,2,512,64,16,32,5,4,8,0.02486399933695793
4096,2,512,64,16,64,2,4,8,0.024191999807953835
4096,2,512,64,16,64,3,8,8,0.02505600079894066
4096,2,512,64,16,64,5,4,8,0.02396799996495247
4096,2,512,64,16,128,3,4,8,0.02380800060927868
4096,2,512,64,16,128,4,8,8,0.02364799939095974
4096,2,512,64,16,128,4,4,8,0.024671999737620354
4096,2,512,128,16,64,3,4,8,0.024480000138282776
4096,2,512,128,16,64,4,8,8,0.024351999163627625
4096,2,512,128,16,128,2,8,8,0.024671999737620354
4096,2,512,128,16,128,3,4,8,0.024351999163627625
4096,2,512,128,16,128,5,8,8,0.024512000381946564
SAME
--------------------
2,512,1536,16,16,32,1,2,8,0.0350399985909462
2,512,1536,16,128,32,2,2,8,0.024671999737620354
2,512,1536,16,32,64,5,4,8,0.024159999564290047
2,512,1536,16,32,32,5,2,8,0.02457600086927414
2,512,1536,16,128,32,5,2,8,0.02454400062561035
2,512,1536,16,16,64,2,4,8,0.03433600068092346
2,512,1536,16,32,64,2,4,8,0.027295999228954315
2,512,1536,16,64,64,3,4,8,0.02454400062561035
2,512,1536,16,128,64,5,4,8,0.023871999233961105
2,512,1536,16,32,128,3,4,8,0.02457600086927414
2,512,1536,16,32,128,4,8,8,0.024607999250292778
2,512,1536,16,64,128,3,4,8,0.024927999824285507
2,512,1536,16,128,128,4,4,8,0.02412799932062626
2,512,1536,16,32,64,3,4,8,0.024768000468611717
2,512,1536,16,32,64,4,4,8,0.023903999477624893
2,512,1536,16,32,128,2,8,8,0.027648000046610832
2,512,1536,16,64,128,5,8,8,0.02412799932062626
SAME
--------------------
3072,4096,768,32,16,32,1,2,8,0.3160960078239441
3072,4096,768,32,128,32,2,4,8,0.13369600474834442
3072,4096,768,32,32,64,5,8,8,0.16412800550460815
3072,4096,768,64,32,32,5,8,8,0.13843199610710144
3072,4096,768,64,128,32,5,4,8,0.11017599701881409
3072,4096,768,64,16,64,2,4,8,0.16204799711704254
3072,4096,768,64,32,64,2,4,8,0.11430399864912033
3072,4096,768,64,64,64,3,8,8,0.08249600231647491
3072,4096,768,64,128,64,5,4,8,0.07807999849319458
3072,4096,768,64,32,128,3,4,8,0.08054400235414505
3072,4096,768,64,32,128,4,8,8,0.07068800181150436
3072,4096,768,64,64,128,3,4,8,0.0605119988322258
3072,4096,768,64,128,128,4,4,8,0.07212799787521362
3072,4096,768,128,32,64,3,4,8,0.0833280012011528
3072,4096,768,128,32,64,4,8,8,0.07187200337648392
3072,4096,768,128,32,128,2,8,8,0.11366400122642517
3072,4096,768,128,32,128,3,4,8,0.08409599959850311
3072,4096,768,128,64,128,3,4,8,0.06348799914121628
3072,4096,768,128,64,128,5,8,8,0.07446400076150894
SAME
--------------------
1024,2,4096,32,16,32,1,2,8,0.02489599958062172
1024,2,4096,32,16,32,2,4,8,0.02534399926662445
1024,2,4096,32,16,64,5,8,8,0.02502400055527687
1024,2,4096,64,16,32,5,8,8,0.02518399991095066
1024,2,4096,64,16,32,5,4,8,0.024320000782608986
1024,2,4096,64,16,64,2,4,8,0.02505600079894066
1024,2,4096,64,16,64,3,8,8,0.025567999109625816
1024,2,4096,64,16,64,5,4,8,0.024480000138282776
1024,2,4096,64,16,128,3,4,8,0.024800000712275505
1024,2,4096,64,16,128,4,8,8,0.024512000381946564
1024,2,4096,64,16,128,4,4,8,0.02470399998128414
1024,2,4096,128,16,64,3,4,8,0.025119999423623085
1024,2,4096,128,16,64,4,8,8,0.024768000468611717
1024,2,4096,128,16,128,2,8,8,0.024831999093294144
1024,2,4096,128,16,128,3,4,8,0.02534399926662445
1024,2,4096,128,16,128,5,8,8,0.024992000311613083
SAME
--------------------
512,768,768,32,16,32,1,2,8,0.042080000042915344
512,768,768,32,128,32,2,4,8,0.02393599972128868
512,768,768,32,32,64,5,8,8,0.024607999250292778
512,768,768,64,32,32,5,8,8,0.024607999250292778
512,768,768,64,128,32,5,4,8,0.024639999493956566
512,768,768,64,16,64,2,4,8,0.04412800073623657
512,768,768,64,32,64,2,4,8,0.03145600110292435
512,768,768,64,64,64,3,8,8,0.024320000782608986
512,768,768,64,128,64,5,4,8,0.024351999163627625
512,768,768,64,32,128,3,4,8,0.02537599951028824
512,768,768,64,32,128,4,8,8,0.024831999093294144
512,768,768,64,64,128,3,4,8,0.02473600022494793
512,768,768,64,128,128,4,4,8,0.024288000538945198
512,768,768,128,32,64,3,4,8,0.0272000003606081
512,768,768,128,32,64,4,8,8,0.024480000138282776
512,768,768,128,32,128,2,8,8,0.03376000002026558
512,768,768,128,32,128,3,4,8,0.028736000880599022
512,768,768,128,64,128,3,4,8,0.025760000571608543
512,768,768,128,64,128,5,8,8,0.024447999894618988
SAME
--------------------
768,512,2304,32,16,32,1,2,8,0.04249599948525429
768,512,2304,32,128,32,2,4,8,0.03254399821162224
768,512,2304,32,32,64,5,8,8,0.03577600046992302
768,512,2304,64,32,32,5,8,8,0.034304000437259674
768,512,2304,64,128,32,5,4,8,0.0350399985909462
768,512,2304,64,16,64,2,4,8,0.038816001266241074
768,512,2304,64,32,64,2,4,8,0.028863999992609024
768,512,2304,64,64,64,3,8,8,0.027424000203609467
768,512,2304,64,128,64,5,4,8,0.02848000079393387
768,512,2304,64,32,128,3,4,8,0.026016000658273697
768,512,2304,64,32,128,4,8,8,0.025855999439954758
768,512,2304,64,64,128,3,4,8,0.02627200074493885
768,512,2304,64,128,128,4,4,8,0.02534399926662445
768,512,2304,128,32,64,3,4,8,0.02550400048494339
768,512,2304,128,32,64,4,8,8,0.02643200010061264
768,512,2304,128,32,128,2,8,8,0.0315839983522892
768,512,2304,128,32,128,3,4,8,0.026176000013947487
768,512,2304,128,64,128,3,4,8,0.026944000273942947
768,512,2304,128,64,128,5,8,8,0.025472000241279602
SAME
--------------------
4096,2,768,32,16,32,1,2,8,0.02518399991095066
4096,2,768,32,16,32,2,4,8,0.024351999163627625
4096,2,768,32,16,64,5,8,8,0.024064000695943832
4096,2,768,64,16,32,5,8,8,0.024447999894618988
4096,2,768,64,16,32,5,4,8,0.025472000241279602
4096,2,768,64,16,64,2,4,8,0.024607999250292778
4096,2,768,64,16,64,3,8,8,0.024671999737620354
4096,2,768,64,16,64,5,4,8,0.023871999233961105
4096,2,768,64,16,128,3,4,8,0.024064000695943832
4096,2,768,64,16,128,4,8,8,0.024191999807953835
4096,2,768,64,16,128,4,4,8,0.023520000278949738
4096,2,768,128,16,64,3,4,8,0.023871999233961105
4096,2,768,128,16,64,4,8,8,0.024288000538945198
4096,2,768,128,16,128,2,8,8,0.024671999737620354
4096,2,768,128,16,128,3,4,8,0.024224000051617622
4096,2,768,128,16,128,5,8,8,0.024480000138282776
SAME
--------------------
4096,768,768,32,16,32,1,2,8,0.08441600203514099
4096,768,768,32,128,32,2,4,8,0.053599998354911804
4096,768,768,32,32,64,5,8,8,0.060095999389886856
4096,768,768,64,32,32,5,8,8,0.0560000017285347
4096,768,768,64,128,32,5,4,8,0.052000001072883606
4096,768,768,64,16,64,2,4,8,0.04608000069856644
4096,768,768,64,32,64,2,4,8,0.03545600175857544
4096,768,768,64,64,64,3,8,8,0.03276799991726875
4096,768,768,64,128,64,5,4,8,0.03811199963092804
4096,768,768,64,32,128,3,4,8,0.02940800040960312
4096,768,768,64,32,128,4,8,8,0.02848000079393387
4096,768,768,64,64,128,3,4,8,0.027424000203609467
4096,768,768,64,128,128,4,4,8,0.03270399942994118
4096,768,768,128,32,64,3,4,8,0.03097599931061268
4096,768,768,128,32,64,4,8,8,0.02831999957561493
4096,768,768,128,32,128,2,8,8,0.03705599904060364
4096,768,768,128,32,128,3,4,8,0.031072000041604042
4096,768,768,128,64,128,3,4,8,0.02924799919128418
4096,768,768,128,64,128,5,8,8,0.03129599988460541
SAME
--------------------
128100,512,1536,32,16,32,1,2,8,2.511199951171875
128100,512,1536,32,128,32,2,4,8,1.5456000566482544
128100,512,1536,32,32,64,5,8,8,1.8097920417785645
128100,512,1536,64,32,32,5,8,8,1.5850239992141724
128100,512,1536,64,128,32,5,4,8,1.5438400506973267
128100,512,1536,64,16,64,2,4,8,0.8846719861030579
128100,512,1536,64,32,64,2,4,8,0.677951991558075
128100,512,1536,64,64,64,3,8,8,0.7310400009155273
128100,512,1536,64,128,64,5,4,8,0.9176959991455078
128100,512,1536,64,32,128,3,4,8,0.5343679785728455
128100,512,1536,64,32,128,4,8,8,0.5691199898719788
128100,512,1536,64,64,128,3,4,8,0.4978879988193512
128100,512,1536,64,128,128,4,4,8,0.6867520213127136
128100,512,1536,128,32,64,3,4,8,0.5648319721221924
128100,512,1536,128,32,64,4,8,8,0.5850239992141724
128100,512,1536,128,32,128,2,8,8,0.6442559957504272
128100,512,1536,128,32,128,3,4,8,0.47542399168014526
128100,512,1536,128,64,128,3,4,8,0.4918079972267151
128100,512,1536,128,64,128,5,8,8,0.5017279982566833
SAME
--------------------
30522,512,128,32,16,32,1,2,8,0.0767040029168129
30522,512,128,32,128,32,2,4,8,0.05507199838757515
30522,512,128,32,32,64,5,8,8,0.05632000043988228
30522,512,128,64,32,32,5,8,8,0.055743999779224396
30522,512,128,64,128,32,5,4,8,0.05724800005555153
30522,512,128,64,16,64,2,4,8,0.054496001452207565
30522,512,128,64,32,64,2,4,8,0.05100800096988678
30522,512,128,64,64,64,3,8,8,0.04195199906826019
30522,512,128,64,128,64,5,4,8,0.04800000041723251
30522,512,128,64,32,128,3,4,8,0.04323200136423111
30522,512,128,64,32,128,4,8,8,0.04527999833226204
30522,512,128,64,64,128,3,4,8,0.041471999138593674
30522,512,128,64,128,128,4,4,8,0.04374400153756142
30522,512,128,128,32,64,3,4,8,0.04575999826192856
30522,512,128,128,32,64,4,8,8,0.047520000487565994
30522,512,128,128,32,128,2,8,8,0.05164799839258194
30522,512,128,128,32,128,3,4,8,0.044096000492572784
30522,512,128,128,64,128,3,4,8,0.04025600105524063
30522,512,128,128,64,128,5,8,8,0.04131200164556503
SAME
--------------------
768,4096,768,32,16,32,1,2,8,0.1401599943637848
768,4096,768,32,128,32,2,4,8,0.05558399856090546
768,4096,768,32,32,64,5,8,8,0.07372800260782242
768,4096,768,64,32,32,5,8,8,0.06374400109052658
768,4096,768,64,128,32,5,4,8,0.048576001077890396
768,4096,768,64,16,64,2,4,8,0.152319997549057
768,4096,768,64,32,64,2,4,8,0.10281600058078766
768,4096,768,64,64,64,3,8,8,0.04742399975657463
768,4096,768,64,128,64,5,4,8,0.040863998234272
768,4096,768,64,32,128,3,4,8,0.06508799642324448
768,4096,768,64,32,128,4,8,8,0.053727999329566956
768,4096,768,64,64,128,3,4,8,0.04678399860858917
768,4096,768,64,128,128,4,4,8,0.03500799834728241
768,4096,768,128,32,64,3,4,8,0.06780800223350525
768,4096,768,128,32,64,4,8,8,0.053888000547885895
768,4096,768,128,32,128,2,8,8,0.10819199681282043
768,4096,768,128,32,128,3,4,8,0.07126399874687195
768,4096,768,128,64,128,3,4,8,0.049215998500585556
768,4096,768,128,64,128,5,8,8,0.04009599983692169
SAME
--------------------
4096,768,2,32,16,16,1,2,8,0.040383998304605484
4096,768,2,32,128,16,2,2,8,0.02505600079894066
4096,768,2,32,32,16,5,2,8,0.02598400041460991
4096,768,2,64,32,16,5,4,8,0.024671999737620354
4096,768,2,64,128,16,5,4,8,0.025439999997615814
4096,768,2,64,16,16,2,4,8,0.04275200143456459
4096,768,2,64,32,16,2,4,8,0.03561599925160408
4096,768,2,64,64,16,3,4,8,0.02505600079894066
4096,768,2,64,32,16,3,4,8,0.02796800062060356
4096,768,2,64,32,16,4,4,8,0.02598400041460991
4096,768,2,64,128,16,4,4,8,0.02579200081527233
4096,768,2,128,32,16,3,4,8,0.02940800040960312
4096,768,2,128,32,16,4,8,8,0.026399999856948853
4096,768,2,128,32,16,2,8,8,0.03705599904060364
4096,768,2,128,64,16,3,4,8,0.02595200017094612
4096,768,2,128,64,16,5,8,8,0.026335999369621277
SAME
--------------------
8192,2,768,32,16,32,1,2,8,0.026784000918269157
8192,2,768,32,16,32,2,4,8,0.025760000571608543
8192,2,768,32,16,64,5,8,8,0.02537599951028824
8192,2,768,64,16,32,5,8,8,0.026976000517606735
8192,2,768,64,16,32,5,4,8,0.02768000029027462
8192,2,768,64,16,64,2,4,8,0.025728000327944756
8192,2,768,64,16,64,3,8,8,0.025887999683618546
8192,2,768,64,16,64,5,4,8,0.025919999927282333
8192,2,768,64,16,128,3,4,8,0.024671999737620354
8192,2,768,64,16,128,4,8,8,0.025087999179959297
8192,2,768,64,16,128,4,4,8,0.025439999997615814
8192,2,768,128,16,64,3,4,8,0.024960000067949295
8192,2,768,128,16,64,4,8,8,0.025248000398278236
8192,2,768,128,16,128,2,8,8,0.024191999807953835
8192,2,768,128,16,128,3,4,8,0.024831999093294144
8192,2,768,128,16,128,5,8,8,0.02550400048494339
SAME
--------------------
4096,512,128,32,16,32,1,2,8,0.03302399814128876
4096,512,128,32,128,32,2,4,8,0.024191999807953835
4096,512,128,32,32,64,5,8,8,0.024607999250292778
4096,512,128,64,32,32,5,8,8,0.024351999163627625
4096,512,128,64,128,32,5,4,8,0.02595200017094612
4096,512,128,64,16,64,2,4,8,0.03372799977660179
4096,512,128,64,32,64,2,4,8,0.027488000690937042
4096,512,128,64,64,64,3,8,8,0.024512000381946564
4096,512,128,64,128,64,5,4,8,0.02489599958062172
4096,512,128,64,32,128,3,4,8,0.02409599907696247
4096,512,128,64,32,128,4,8,8,0.023903999477624893
4096,512,128,64,64,128,3,4,8,0.02505600079894066
4096,512,128,64,128,128,4,4,8,0.02396799996495247
4096,512,128,128,32,64,3,4,8,0.025312000885605812
4096,512,128,128,32,64,4,8,8,0.024768000468611717
4096,512,128,128,32,128,2,8,8,0.029600000008940697
4096,512,128,128,32,128,3,4,8,0.02672000043094158
4096,512,128,128,64,128,3,4,8,0.024480000138282776
4096,512,128,128,64,128,5,8,8,0.024383999407291412
SAME
--------------------
512,30522,768,32,16,32,1,2,8,1.1103359460830688
512,30522,768,32,128,32,2,4,8,0.24329599738121033
512,30522,768,32,32,64,5,8,8,0.28992000222206116
512,30522,768,64,32,32,5,8,8,0.5125439763069153
512,30522,768,64,128,32,5,4,8,0.3079040050506592
512,30522,768,64,16,64,2,4,8,1.1374720335006714
512,30522,768,64,32,64,2,4,8,0.6877760291099548
512,30522,768,64,64,64,3,8,8,0.2622080147266388
512,30522,768,64,128,64,5,4,8,0.17315199971199036
512,30522,768,64,32,128,3,4,8,0.37321600317955017
512,30522,768,64,32,128,4,8,8,0.2736319899559021
512,30522,768,64,64,128,3,4,8,0.2247679978609085
512,30522,768,64,128,128,4,4,8,0.20416000485420227
512,30522,768,128,32,64,3,4,8,0.3936319947242737
512,30522,768,128,32,64,4,8,8,0.3155199885368347
512,30522,768,128,32,128,2,8,8,0.7896959781646729
512,30522,768,128,32,128,3,4,8,0.4161919951438904
512,30522,768,128,64,128,3,4,8,0.41523200273513794
512,30522,768,128,64,128,5,8,8,0.36982399225234985
SAME
--------------------
32000,2048,1024,32,16,32,1,2,8,1.6414400339126587
32000,2048,1024,32,128,32,2,4,8,0.9111999869346619
32000,2048,1024,32,32,64,5,8,8,1.0987520217895508
32000,2048,1024,64,32,32,5,8,8,0.948415994644165
32000,2048,1024,64,128,32,5,4,8,0.6439359784126282
32000,2048,1024,64,16,64,2,4,8,0.5866879820823669
32000,2048,1024,64,32,64,2,4,8,0.41836801171302795
32000,2048,1024,64,64,64,3,8,8,0.38700801134109497
32000,2048,1024,64,128,64,5,4,8,0.38979199528694153
32000,2048,1024,64,32,128,3,4,8,0.30316799879074097
32000,2048,1024,64,32,128,4,8,8,0.31747201085090637
32000,2048,1024,64,64,128,3,4,8,0.28220799565315247
32000,2048,1024,64,128,128,4,4,8,0.30025601387023926
32000,2048,1024,128,32,64,3,4,8,0.3346560001373291
32000,2048,1024,128,32,64,4,8,8,0.3250240087509155
32000,2048,1024,128,32,128,2,8,8,0.3879680037498474
32000,2048,1024,128,32,128,3,4,8,0.2603519856929779
32000,2048,1024,128,64,128,3,4,8,0.23836800456047058
32000,2048,1024,128,64,128,5,8,8,0.24620799720287323
SAME
--------------------
1024,4096,16384,32,16,32,1,2,8,1.685920000076294
1024,4096,16384,32,128,32,2,4,8,0.9163519740104675
1024,4096,16384,32,32,64,5,8,8,1.184224009513855
1024,4096,16384,64,32,32,5,8,8,0.9688640236854553
1024,4096,16384,64,128,32,5,4,8,0.6481599807739258
1024,4096,16384,64,16,64,2,4,8,0.6835200190544128
1024,4096,16384,64,32,64,2,4,8,0.41760000586509705
1024,4096,16384,64,64,64,3,8,8,0.4310080111026764
1024,4096,16384,64,128,64,5,4,8,0.42739200592041016
1024,4096,16384,64,32,128,3,4,8,0.32758399844169617
1024,4096,16384,64,32,128,4,8,8,0.3355199992656708
1024,4096,16384,64,64,128,3,4,8,0.2991040050983429
1024,4096,16384,64,128,128,4,4,8,0.30294400453567505
1024,4096,16384,128,32,64,3,4,8,0.3433600068092346
1024,4096,16384,128,32,64,4,8,8,0.3375680148601532
1024,4096,16384,128,32,128,2,8,8,0.4148479998111725
1024,4096,16384,128,32,128,3,4,8,0.24953599274158478
1024,4096,16384,128,64,128,3,4,8,0.2269439995288849
1024,4096,16384,128,64,128,5,8,8,0.24111999571323395
SAME
--------------------
1024,32768,256,32,16,32,1,2,8,1.0007679462432861
1024,32768,256,32,128,32,2,4,8,0.236735999584198
1024,32768,256,32,32,64,5,8,8,0.20000000298023224
1024,32768,256,64,32,32,5,8,8,0.2051520049571991
1024,32768,256,64,128,32,5,4,8,0.10150399804115295
1024,32768,256,64,16,64,2,4,8,1.1406400203704834
1024,32768,256,64,32,64,2,4,8,0.6446080207824707
1024,32768,256,64,64,64,3,8,8,0.2030400037765503
1024,32768,256,64,128,64,5,4,8,0.10105600208044052
1024,32768,256,64,32,128,3,4,8,0.3684479892253876
1024,32768,256,64,32,128,4,8,8,0.26368001103401184
1024,32768,256,64,64,128,3,4,8,0.20950399339199066
1024,32768,256,64,128,128,4,4,8,0.13238400220870972
1024,32768,256,128,32,64,3,4,8,0.3765439987182617
1024,32768,256,128,32,64,4,8,8,0.2638719975948334
1024,32768,256,128,32,128,2,8,8,0.7590399980545044
1024,32768,256,128,32,128,3,4,8,0.40617600083351135
1024,32768,256,128,64,128,3,4,8,0.2319359928369522
1024,32768,256,128,64,128,5,8,8,0.1656000018119812
SAME
--------------------
512,3072,768,32,16,32,1,2,8,0.12569600343704224
512,3072,768,32,128,32,2,4,8,0.04297599941492081
512,3072,768,32,32,64,5,8,8,0.04451199993491173
512,3072,768,64,32,32,5,8,8,0.04054399952292442
512,3072,768,64,128,32,5,4,8,0.03372799977660179
512,3072,768,64,16,64,2,4,8,0.1154559999704361
512,3072,768,64,32,64,2,4,8,0.08083199709653854
512,3072,768,64,64,64,3,8,8,0.038816001266241074
512,3072,768,64,128,64,5,4,8,0.027648000046610832
512,3072,768,64,32,128,3,4,8,0.05344000086188316
512,3072,768,64,32,128,4,8,8,0.041919998824596405
512,3072,768,64,64,128,3,4,8,0.03807999938726425
512,3072,768,64,128,128,4,4,8,0.02953599952161312
512,3072,768,128,32,64,3,4,8,0.055456001311540604
512,3072,768,128,32,64,4,8,8,0.044895999133586884
512,3072,768,128,32,128,2,8,8,0.08905600011348724
512,3072,768,128,32,128,3,4,8,0.05676800012588501
512,3072,768,128,64,128,3,4,8,0.04092799872159958
512,3072,768,128,64,128,5,8,8,0.03558399900794029
SAME
--------------------
4096,512,384,32,16,32,1,2,8,0.038816001266241074
4096,512,384,32,128,32,2,4,8,0.031647998839616776
4096,512,384,32,32,64,5,8,8,0.03174399957060814
4096,512,384,64,32,32,5,8,8,0.0307839997112751
4096,512,384,64,128,32,5,4,8,0.03190400078892708
4096,512,384,64,16,64,2,4,8,0.03622400015592575
4096,512,384,64,32,64,2,4,8,0.02816000021994114
4096,512,384,64,64,64,3,8,8,0.0261439997702837
4096,512,384,64,128,64,5,4,8,0.02659199945628643
4096,512,384,64,32,128,3,4,8,0.025599999353289604
4096,512,384,64,32,128,4,8,8,0.024960000067949295
4096,512,384,64,64,128,3,4,8,0.02489599958062172
4096,512,384,64,128,128,4,4,8,0.025567999109625816
4096,512,384,128,32,64,3,4,8,0.02598400041460991
4096,512,384,128,32,64,4,8,8,0.025119999423623085
4096,512,384,128,32,128,2,8,8,0.030079999938607216
4096,512,384,128,32,128,3,4,8,0.026464000344276428
4096,512,384,128,64,128,3,4,8,0.02566399984061718
4096,512,384,128,64,128,5,8,8,0.024671999737620354
SAME
--------------------
1024,2048,1024,32,16,32,1,2,8,0.0910400003194809
1024,2048,1024,32,128,32,2,4,8,0.05238400027155876
1024,2048,1024,32,32,64,5,8,8,0.05417599901556969
1024,2048,1024,64,32,32,5,8,8,0.049375999718904495
1024,2048,1024,64,128,32,5,4,8,0.03964800015091896
1024,2048,1024,64,16,64,2,4,8,0.09465599805116653
1024,2048,1024,64,32,64,2,4,8,0.061535999178886414
1024,2048,1024,64,64,64,3,8,8,0.03302399814128876
1024,2048,1024,64,128,64,5,4,8,0.03129599988460541
1024,2048,1024,64,32,128,3,4,8,0.04297599941492081
1024,2048,1024,64,32,128,4,8,8,0.035551998764276505
1024,2048,1024,64,64,128,3,4,8,0.03328000009059906
1024,2048,1024,64,128,128,4,4,8,0.027168000116944313
1024,2048,1024,128,32,64,3,4,8,0.04303999990224838
1024,2048,1024,128,32,64,4,8,8,0.035551998764276505
1024,2048,1024,128,32,128,2,8,8,0.06572800129652023
1024,2048,1024,128,32,128,3,4,8,0.044895999133586884
1024,2048,1024,128,64,128,3,4,8,0.03484800085425377
1024,2048,1024,128,64,128,5,8,8,0.029823999851942062
SAME
--------------------
128,2048,50257,32,16,32,1,2,8,0.38419198989868164
128,2048,50257,32,128,32,2,4,8,0.7156479954719543
128,2048,50257,32,32,64,5,8,8,0.377375990152359
128,2048,50257,64,32,32,5,8,8,0.34009599685668945
128,2048,50257,64,128,32,5,4,8,0.44435200095176697
128,2048,50257,64,16,64,2,4,8,0.2993279993534088
128,2048,50257,64,32,64,2,4,8,0.2913919985294342
128,2048,50257,64,64,64,3,8,8,0.23478400707244873
128,2048,50257,64,128,64,5,4,8,1.0055359601974487
128,2048,50257,64,32,128,3,4,8,0.2831040024757385
128,2048,50257,64,32,128,4,8,8,0.27193599939346313
128,2048,50257,64,64,128,3,4,8,0.2008959949016571
128,2048,50257,64,128,128,4,4,8,0.1921599954366684
128,2048,50257,128,32,64,3,4,8,0.17532800137996674
128,2048,50257,128,32,64,4,8,8,0.21695999801158905
128,2048,50257,128,32,128,2,8,8,0.2550080120563507
128,2048,50257,128,32,128,3,4,8,0.18902400135993958
128,2048,50257,128,64,128,3,4,8,0.17126399278640747
128,2048,50257,128,64,128,5,8,8,0.2253440022468567
SAME
--------------------
2,4096,512,16,16,32,1,2,8,0.13884800672531128
2,4096,512,16,128,32,2,2,8,0.04681599885225296
2,4096,512,16,32,64,5,4,8,0.03891199827194214
2,4096,512,16,32,32,5,2,8,0.03951999917626381
2,4096,512,16,128,32,5,2,8,0.027712000533938408
2,4096,512,16,16,64,2,4,8,0.13967999815940857
2,4096,512,16,32,64,2,4,8,0.09081599861383438
2,4096,512,16,64,64,3,4,8,0.04150399938225746
2,4096,512,16,128,64,5,4,8,0.02828799933195114
2,4096,512,16,32,128,3,4,8,0.06304000318050385
2,4096,512,16,32,128,4,8,8,0.04668800160288811
2,4096,512,16,64,128,3,4,8,0.047488000243902206
2,4096,512,16,128,128,4,4,8,0.03315199911594391
2,4096,512,16,32,64,3,4,8,0.05651199817657471
2,4096,512,16,32,64,4,4,8,0.04412800073623657
2,4096,512,16,32,128,2,8,8,0.09728000313043594
2,4096,512,16,64,128,5,8,8,0.03596799820661545
SAME
--------------------
1024,2048,4096,32,16,32,1,2,8,0.22182400524616241
1024,2048,4096,32,128,32,2,4,8,0.11657600104808807
1024,2048,4096,32,32,64,5,8,8,0.14844800531864166
1024,2048,4096,64,32,32,5,8,8,0.1292160004377365
1024,2048,4096,64,128,32,5,4,8,0.10684800148010254
1024,2048,4096,64,16,64,2,4,8,0.10707200318574905
1024,2048,4096,64,32,64,2,4,8,0.0703359991312027
1024,2048,4096,64,64,64,3,8,8,0.06092799827456474
1024,2048,4096,64,128,64,5,4,8,0.07235199958086014
1024,2048,4096,64,32,128,3,4,8,0.05084799975156784
1024,2048,4096,64,32,128,4,8,8,0.048928000032901764
1024,2048,4096,64,64,128,3,4,8,0.056095998734235764
1024,2048,4096,64,128,128,4,4,8,0.0586559996008873
1024,2048,4096,128,32,64,3,4,8,0.05196800082921982
1024,2048,4096,128,32,64,4,8,8,0.055904000997543335
1024,2048,4096,128,32,128,2,8,8,0.07321599870920181
1024,2048,4096,128,32,128,3,4,8,0.050655998289585114
1024,2048,4096,128,64,128,3,4,8,0.04198399931192398
1024,2048,4096,128,64,128,5,8,8,0.045791998505592346
SAME
--------------------
768,2048,3072,32,16,32,1,2,8,0.1509760022163391
768,2048,3072,32,128,32,2,4,8,0.09148799628019333
768,2048,3072,32,32,64,5,8,8,0.09993600100278854
768,2048,3072,64,32,32,5,8,8,0.08819200098514557
768,2048,3072,64,128,32,5,4,8,0.06815999746322632
768,2048,3072,64,16,64,2,4,8,0.10188800096511841
768,2048,3072,64,32,64,2,4,8,0.0663359984755516
768,2048,3072,64,64,64,3,8,8,0.04553600028157234
768,2048,3072,64,128,64,5,4,8,0.050144001841545105
768,2048,3072,64,32,128,3,4,8,0.045632001012563705
768,2048,3072,64,32,128,4,8,8,0.03999999910593033
768,2048,3072,64,64,128,3,4,8,0.037151999771595
768,2048,3072,64,128,128,4,4,8,0.046431999653577805
768,2048,3072,128,32,64,3,4,8,0.04732799902558327
768,2048,3072,128,32,64,4,8,8,0.03996799886226654
768,2048,3072,128,32,128,2,8,8,0.06992000341415405
768,2048,3072,128,32,128,3,4,8,0.04726399853825569
768,2048,3072,128,64,128,3,4,8,0.03961599990725517
768,2048,3072,128,64,128,5,8,8,0.04387199878692627
SAME
--------------------
512,1536,1536,32,16,32,1,2,8,0.07126399874687195
512,1536,1536,32,128,32,2,4,8,0.035232000052928925
512,1536,1536,32,32,64,5,8,8,0.03868800029158592
512,1536,1536,64,32,32,5,8,8,0.03516799956560135
512,1536,1536,64,128,32,5,4,8,0.032127998769283295
512,1536,1536,64,16,64,2,4,8,0.07513599842786789
512,1536,1536,64,32,64,2,4,8,0.04867200180888176
512,1536,1536,64,64,64,3,8,8,0.028224000707268715
512,1536,1536,64,128,64,5,4,8,0.02723200060427189
512,1536,1536,64,32,128,3,4,8,0.035360001027584076
512,1536,1536,64,32,128,4,8,8,0.029759999364614487
512,1536,1536,64,64,128,3,4,8,0.029055999591946602
512,1536,1536,64,128,128,4,4,8,0.025728000327944756
512,1536,1536,128,32,64,3,4,8,0.036479998379945755
512,1536,1536,128,32,64,4,8,8,0.030912000685930252
512,1536,1536,128,32,128,2,8,8,0.05116799846291542
512,1536,1536,128,32,128,3,4,8,0.03776000067591667
512,1536,1536,128,64,128,3,4,8,0.030047999694943428
512,1536,1536,128,64,128,5,8,8,0.02537599951028824
SAME
--------------------
768,512,3072,32,16,32,1,2,8,0.04841599985957146
768,512,3072,32,128,32,2,4,8,0.03619199991226196
768,512,3072,32,32,64,5,8,8,0.03932800143957138
768,512,3072,64,32,32,5,8,8,0.03776000067591667
768,512,3072,64,128,32,5,4,8,0.039712000638246536
768,512,3072,64,16,64,2,4,8,0.037728000432252884
768,512,3072,64,32,64,2,4,8,0.02969600073993206
768,512,3072,64,64,64,3,8,8,0.025760000571608543
768,512,3072,64,128,64,5,4,8,0.03145600110292435
768,512,3072,64,32,128,3,4,8,0.02598400041460991
768,512,3072,64,32,128,4,8,8,0.02486399933695793
768,512,3072,64,64,128,3,4,8,0.026559999212622643
768,512,3072,64,128,128,4,4,8,0.02940800040960312
768,512,3072,128,32,64,3,4,8,0.02643200010061264
768,512,3072,128,32,64,4,8,8,0.02598400041460991
768,512,3072,128,32,128,2,8,8,0.03081599995493889
768,512,3072,128,32,128,3,4,8,0.02876799926161766
768,512,3072,128,64,128,3,4,8,0.027456000447273254
768,512,3072,128,64,128,5,8,8,0.027295999228954315
SAME
--------------------
128,2048,128,32,16,32,1,2,8,0.07702399790287018
128,2048,128,32,128,32,2,4,8,0.031136000528931618
128,2048,128,32,32,64,5,8,8,0.027615999802947044
128,2048,128,64,32,32,5,8,8,0.027775999158620834
128,2048,128,64,128,32,5,4,8,0.02454400062561035
128,2048,128,64,16,64,2,4,8,0.08742400258779526
128,2048,128,64,32,64,2,4,8,0.05657599866390228
128,2048,128,64,64,64,3,8,8,0.027744000777602196
128,2048,128,64,128,64,5,4,8,0.02425600029528141
128,2048,128,64,32,128,3,4,8,0.038943998515605927
128,2048,128,64,32,128,4,8,8,0.030432000756263733
128,2048,128,64,64,128,3,4,8,0.029311999678611755
128,2048,128,64,128,128,4,4,8,0.024320000782608986
128,2048,128,128,32,64,3,4,8,0.039423998445272446
128,2048,128,128,32,64,4,8,8,0.03177599981427193
128,2048,128,128,32,128,2,8,8,0.0650240033864975
128,2048,128,128,32,128,3,4,8,0.041152000427246094
128,2048,128,128,64,128,3,4,8,0.031072000041604042
128,2048,128,128,64,128,5,8,8,0.02723200060427189
SAME
--------------------
30522,512,768,32,16,32,1,2,8,0.31004801392555237
30522,512,768,32,128,32,2,4,8,0.18143999576568604
30522,512,768,32,32,64,5,8,8,0.21900799870491028
30522,512,768,64,32,32,5,8,8,0.19580799341201782
30522,512,768,64,128,32,5,4,8,0.18934400379657745
30522,512,768,64,16,64,2,4,8,0.1191679984331131
30522,512,768,64,32,64,2,4,8,0.10566399991512299
30522,512,768,64,64,64,3,8,8,0.09705600142478943
30522,512,768,64,128,64,5,4,8,0.11151999980211258
30522,512,768,64,32,128,3,4,8,0.07763200253248215
30522,512,768,64,32,128,4,8,8,0.08150400221347809
30522,512,768,64,64,128,3,4,8,0.07657600194215775
30522,512,768,64,128,128,4,4,8,0.1034879982471466
30522,512,768,128,32,64,3,4,8,0.08585599809885025
30522,512,768,128,32,64,4,8,8,0.08460800349712372
30522,512,768,128,32,128,2,8,8,0.10688000172376633
30522,512,768,128,32,128,3,4,8,0.07763200253248215
30522,512,768,128,64,128,3,4,8,0.0788159966468811
30522,512,768,128,64,128,5,8,8,0.07868800312280655
SAME
--------------------
128,512,256,32,16,32,1,2,8,0.03254399821162224
128,512,256,32,128,32,2,4,8,0.02470399998128414
128,512,256,32,32,64,5,8,8,0.024159999564290047
128,512,256,64,32,32,5,8,8,0.02425600029528141
128,512,256,64,128,32,5,4,8,0.024000000208616257
128,512,256,64,16,64,2,4,8,0.034143999218940735
128,512,256,64,32,64,2,4,8,0.02595200017094612
128,512,256,64,64,64,3,8,8,0.02412799932062626
128,512,256,64,128,64,5,4,8,0.024064000695943832
128,512,256,64,32,128,3,4,8,0.02457600086927414
128,512,256,64,32,128,4,8,8,0.024383999407291412
128,512,256,64,64,128,3,4,8,0.02412799932062626
128,512,256,64,128,128,4,4,8,0.024351999163627625
128,512,256,128,32,64,3,4,8,0.024447999894618988
128,512,256,128,32,64,4,8,8,0.023871999233961105
128,512,256,128,32,128,2,8,8,0.027295999228954315
128,512,256,128,32,128,3,4,8,0.024960000067949295
128,512,256,128,64,128,3,4,8,0.02470399998128414
128,512,256,128,64,128,5,8,8,0.024224000051617622
SAME
--------------------
512,256,128,32,16,32,1,2,8,0.02630399912595749
512,256,128,32,128,32,2,4,8,0.024383999407291412
512,256,128,32,32,64,5,8,8,0.024768000468611717
512,256,128,64,32,32,5,8,8,0.024159999564290047
512,256,128,64,128,32,5,4,8,0.024831999093294144
512,256,128,64,16,64,2,4,8,0.024960000067949295
512,256,128,64,32,64,2,4,8,0.025407999753952026
512,256,128,64,64,64,3,8,8,0.023840000852942467
512,256,128,64,128,64,5,4,8,0.0244159996509552
512,256,128,64,32,128,3,4,8,0.02470399998128414
512,256,128,64,32,128,4,8,8,0.024927999824285507
512,256,128,64,64,128,3,4,8,0.02454400062561035
512,256,128,64,128,128,4,4,8,0.023903999477624893
512,256,128,128,32,64,3,4,8,0.02518399991095066
512,256,128,128,32,64,4,8,8,0.0244159996509552
512,256,128,128,32,128,2,8,8,0.024383999407291412
512,256,128,128,32,128,3,4,8,0.025567999109625816
512,256,128,128,64,128,3,4,8,0.025439999997615814
512,256,128,128,64,128,5,8,8,0.024480000138282776
SAME
--------------------
3072,2048,768,32,16,32,1,2,8,0.1589760035276413
3072,2048,768,32,128,32,2,4,8,0.09055999666452408
3072,2048,768,32,32,64,5,8,8,0.0997759997844696
3072,2048,768,64,32,32,5,8,8,0.08774399757385254
3072,2048,768,64,128,32,5,4,8,0.06649599969387054
3072,2048,768,64,16,64,2,4,8,0.0960640013217926
3072,2048,768,64,32,64,2,4,8,0.06511999666690826
3072,2048,768,64,64,64,3,8,8,0.04505600035190582
3072,2048,768,64,128,64,5,4,8,0.04867200180888176
3072,2048,768,64,32,128,3,4,8,0.04739199951291084
3072,2048,768,64,32,128,4,8,8,0.04163200035691261
3072,2048,768,64,64,128,3,4,8,0.03759999945759773
3072,2048,768,64,128,128,4,4,8,0.04620800167322159
3072,2048,768,128,32,64,3,4,8,0.04918399825692177
3072,2048,768,128,32,64,4,8,8,0.042399998754262924
3072,2048,768,128,32,128,2,8,8,0.06992000341415405
3072,2048,768,128,32,128,3,4,8,0.0496320016682148
3072,2048,768,128,64,128,3,4,8,0.03977600112557411
3072,2048,768,128,64,128,5,8,8,0.04521600157022476
SAME
--------------------
3072,512,768,32,16,32,1,2,8,0.04966399818658829
3072,512,768,32,128,32,2,4,8,0.036768000572919846
3072,512,768,32,32,64,5,8,8,0.04041599854826927
3072,512,768,64,32,32,5,8,8,0.03686400130391121
3072,512,768,64,128,32,5,4,8,0.03891199827194214
3072,512,768,64,16,64,2,4,8,0.036479998379945755
3072,512,768,64,32,64,2,4,8,0.029279999434947968
3072,512,768,64,64,64,3,8,8,0.027168000116944313
3072,512,768,64,128,64,5,4,8,0.031039999797940254
3072,512,768,64,32,128,3,4,8,0.024960000067949295
3072,512,768,64,32,128,4,8,8,0.025087999179959297
3072,512,768,64,64,128,3,4,8,0.025407999753952026
3072,512,768,64,128,128,4,4,8,0.02864000014960766
3072,512,768,128,32,64,3,4,8,0.027135999873280525
3072,512,768,128,32,64,4,8,8,0.024191999807953835
3072,512,768,128,32,128,2,8,8,0.03046399913728237
3072,512,768,128,32,128,3,4,8,0.027712000533938408
3072,512,768,128,64,128,3,4,8,0.026176000013947487
3072,512,768,128,64,128,5,8,8,0.027456000447273254
SAME
--------------------
512,256,256,32,16,32,1,2,8,0.026240000501275063
512,256,256,32,128,32,2,4,8,0.02409599907696247
512,256,256,32,32,64,5,8,8,0.024320000782608986
512,256,256,64,32,32,5,8,8,0.024288000538945198
512,256,256,64,128,32,5,4,8,0.024351999163627625
512,256,256,64,16,64,2,4,8,0.024768000468611717
512,256,256,64,32,64,2,4,8,0.024671999737620354
512,256,256,64,64,64,3,8,8,0.024927999824285507
512,256,256,64,128,64,5,4,8,0.024224000051617622
512,256,256,64,32,128,3,4,8,0.023552000522613525
512,256,256,64,32,128,4,8,8,0.024191999807953835
512,256,256,64,64,128,3,4,8,0.024447999894618988
512,256,256,64,128,128,4,4,8,0.02425600029528141
512,256,256,128,32,64,3,4,8,0.02425600029528141
512,256,256,128,32,64,4,8,8,0.024159999564290047
512,256,256,128,32,128,2,8,8,0.025248000398278236
512,256,256,128,32,128,3,4,8,0.024480000138282776
512,256,256,128,64,128,3,4,8,0.023584000766277313
512,256,256,128,64,128,5,8,8,0.02380800060927868
SAME
--------------------
128,2048,512,32,16,32,1,2,8,0.08585599809885025
128,2048,512,32,128,32,2,4,8,0.032287999987602234
128,2048,512,32,32,64,5,8,8,0.029279999434947968
128,2048,512,64,32,32,5,8,8,0.028416000306606293
128,2048,512,64,128,32,5,4,8,0.025407999753952026
128,2048,512,64,16,64,2,4,8,0.09164799749851227
128,2048,512,64,32,64,2,4,8,0.05641600117087364
128,2048,512,64,64,64,3,8,8,0.028831999748945236
128,2048,512,64,128,64,5,4,8,0.02505600079894066
128,2048,512,64,32,128,3,4,8,0.03907199949026108
128,2048,512,64,32,128,4,8,8,0.03232000023126602
128,2048,512,64,64,128,3,4,8,0.03033600002527237
128,2048,512,64,128,128,4,4,8,0.025151999667286873
128,2048,512,128,32,64,3,4,8,0.0398080013692379
128,2048,512,128,32,64,4,8,8,0.03254399821162224
128,2048,512,128,32,128,2,8,8,0.06278400123119354
128,2048,512,128,32,128,3,4,8,0.041280001401901245
128,2048,512,128,64,128,3,4,8,0.032287999987602234
128,2048,512,128,64,128,5,8,8,0.028543999418616295
SAME
--------------------
30522,2048,768,32,16,32,1,2,8,1.1831680536270142
30522,2048,768,32,128,32,2,4,8,0.6520640254020691
30522,2048,768,32,32,64,5,8,8,0.7824000120162964
30522,2048,768,64,32,32,5,8,8,0.664031982421875
30522,2048,768,64,128,32,5,4,8,0.4670400023460388
30522,2048,768,64,16,64,2,4,8,0.4729599952697754
30522,2048,768,64,32,64,2,4,8,0.31091201305389404
30522,2048,768,64,64,64,3,8,8,0.2762880027294159
30522,2048,768,64,128,64,5,4,8,0.2850239872932434
30522,2048,768,64,32,128,3,4,8,0.21830399334430695
30522,2048,768,64,32,128,4,8,8,0.22620800137519836
30522,2048,768,64,64,128,3,4,8,0.20073600113391876
30522,2048,768,64,128,128,4,4,8,0.22588799893856049
30522,2048,768,128,32,64,3,4,8,0.24531200528144836
30522,2048,768,128,32,64,4,8,8,0.23820799589157104
30522,2048,768,128,32,128,2,8,8,0.3246400058269501
30522,2048,768,128,32,128,3,4,8,0.19350400567054749
30522,2048,768,128,64,128,3,4,8,0.17843200266361237
30522,2048,768,128,64,128,5,8,8,0.17871999740600586
SAME
--------------------
768,2048,768,32,16,32,1,2,8,0.08537600189447403
768,2048,768,32,128,32,2,4,8,0.039135999977588654
768,2048,768,32,32,64,5,8,8,0.04444799944758415
768,2048,768,64,32,32,5,8,8,0.039744000881910324
768,2048,768,64,128,32,5,4,8,0.033215999603271484
768,2048,768,64,16,64,2,4,8,0.08857599645853043
768,2048,768,64,32,64,2,4,8,0.05798399820923805
768,2048,768,64,64,64,3,8,8,0.029983999207615852
768,2048,768,64,128,64,5,4,8,0.028831999748945236
768,2048,768,64,32,128,3,4,8,0.03964800015091896
768,2048,768,64,32,128,4,8,8,0.03292800113558769
768,2048,768,64,64,128,3,4,8,0.030688000842928886
768,2048,768,64,128,128,4,4,8,0.0261439997702837
768,2048,768,128,32,64,3,4,8,0.04137599840760231
768,2048,768,128,32,64,4,8,8,0.033952001482248306
768,2048,768,128,32,128,2,8,8,0.0631679967045784
768,2048,768,128,32,128,3,4,8,0.04310400038957596
768,2048,768,128,64,128,3,4,8,0.0323840007185936
768,2048,768,128,64,128,5,8,8,0.0289280004799366
SAME
--------------------
256,256008,1024,32,16,32,1,2,8,14.906784057617188
256,256008,1024,32,128,32,2,4,8,1.9208639860153198
256,256008,1024,32,32,64,5,8,8,1.458400011062622
256,256008,1024,64,32,32,5,8,8,1.5115840435028076
256,256008,1024,64,128,32,5,4,8,0.8543679714202881
256,256008,1024,64,16,64,2,4,8,9.3787202835083
256,256008,1024,64,32,64,2,4,8,5.2275519371032715
256,256008,1024,64,64,64,3,8,8,1.6956160068511963
256,256008,1024,64,128,64,5,4,8,0.8689919710159302
256,256008,1024,64,32,128,3,4,8,2.7714240550994873
256,256008,1024,64,32,128,4,8,8,1.996224045753479
256,256008,1024,64,64,128,3,4,8,1.65174400806427
256,256008,1024,64,128,128,4,4,8,0.9359040260314941
256,256008,1024,128,32,64,3,4,8,2.980288028717041
256,256008,1024,128,32,64,4,8,8,2.171999931335449
256,256008,1024,128,32,128,2,8,8,6.314847946166992
256,256008,1024,128,32,128,3,4,8,3.047231912612915
256,256008,1024,128,64,128,3,4,8,1.8743040561676025
256,256008,1024,128,64,128,5,8,8,1.69760000705719
SAME
--------------------
8192,512,50272,32,16,32,1,2,8,5.208127975463867
8192,512,50272,32,128,32,2,4,8,3.285151958465576
8192,512,50272,32,32,64,5,8,8,3.7317121028900146
8192,512,50272,64,32,32,5,8,8,3.326688051223755
8192,512,50272,64,128,32,5,4,8,3.58240008354187
8192,512,50272,64,16,64,2,4,8,2.2710719108581543
8192,512,50272,64,32,64,2,4,8,1.5617599487304688
8192,512,50272,64,64,64,3,8,8,1.6056959629058838
8192,512,50272,64,128,64,5,4,8,2.107840061187744
8192,512,50272,64,32,128,3,4,8,1.1969599723815918
8192,512,50272,64,32,128,4,8,8,1.2463680505752563
8192,512,50272,64,64,128,3,4,8,1.2319680452346802
8192,512,50272,64,128,128,4,4,8,1.5457279682159424
8192,512,50272,128,32,64,3,4,8,1.2134720087051392
8192,512,50272,128,32,64,4,8,8,1.2862399816513062
8192,512,50272,128,32,128,2,8,8,1.5295679569244385
8192,512,50272,128,32,128,3,4,8,1.032096028327942
8192,512,50272,128,64,128,3,4,8,1.0900800228118896
8192,512,50272,128,64,128,5,8,8,1.1520639657974243
SAME
--------------------
128,2048,2,32,16,16,1,2,8,0.07395199686288834
128,2048,2,32,128,16,2,2,8,0.03203200176358223
128,2048,2,32,32,16,5,2,8,0.026464000344276428
128,2048,2,64,32,16,5,4,8,0.027744000777602196
128,2048,2,64,128,16,5,4,8,0.023840000852942467
128,2048,2,64,16,16,2,4,8,0.08755200356245041
128,2048,2,64,32,16,2,4,8,0.056671999394893646
128,2048,2,64,64,16,3,4,8,0.02924799919128418
128,2048,2,64,32,16,3,4,8,0.03728000074625015
128,2048,2,64,32,16,4,4,8,0.03145600110292435
128,2048,2,64,128,16,4,4,8,0.024320000782608986
128,2048,2,128,32,16,3,4,8,0.03929600119590759
128,2048,2,128,32,16,4,8,8,0.032575998455286026
128,2048,2,128,32,16,2,8,8,0.06412799656391144
128,2048,2,128,64,16,3,4,8,0.029184000566601753
128,2048,2,128,64,16,5,8,8,0.026784000918269157
SAME
--------------------
50005,1024,768,32,16,32,1,2,8,0.977728009223938
50005,1024,768,32,128,32,2,4,8,0.5605760216712952
50005,1024,768,32,32,64,5,8,8,0.6642559766769409
50005,1024,768,64,32,32,5,8,8,0.5719360113143921
50005,1024,768,64,128,32,5,4,8,0.4368320107460022
50005,1024,768,64,16,64,2,4,8,0.34009599685668945
50005,1024,768,64,32,64,2,4,8,0.2447039932012558
50005,1024,768,64,64,64,3,8,8,0.24172799289226532
50005,1024,768,64,128,64,5,4,8,0.271807998418808
50005,1024,768,64,32,128,3,4,8,0.17827199399471283
50005,1024,768,64,32,128,4,8,8,0.19654400646686554
50005,1024,768,64,64,128,3,4,8,0.17404800653457642
50005,1024,768,64,128,128,4,4,8,0.2449280023574829
50005,1024,768,128,32,64,3,4,8,0.2032639980316162
50005,1024,768,128,32,64,4,8,8,0.2040639966726303
50005,1024,768,128,32,128,2,8,8,0.2534720003604889
50005,1024,768,128,32,128,3,4,8,0.16396799683570862
50005,1024,768,128,64,128,3,4,8,0.16550399363040924
50005,1024,768,128,64,128,5,8,8,0.1627199947834015
SAME
--------------------
10000,8192,256,32,16,32,1,2,8,0.6695359945297241
10000,8192,256,32,128,32,2,4,8,0.2949120104312897
10000,8192,256,32,32,64,5,8,8,0.3521920144557953
10000,8192,256,64,32,32,5,8,8,0.31494399905204773
10000,8192,256,64,128,32,5,4,8,0.20787200331687927
10000,8192,256,64,16,64,2,4,8,0.32950401306152344
10000,8192,256,64,32,64,2,4,8,0.22572800517082214
10000,8192,256,64,64,64,3,8,8,0.1615999937057495
10000,8192,256,64,128,64,5,4,8,0.1372479945421219
10000,8192,256,64,32,128,3,4,8,0.1536960005760193
10000,8192,256,64,32,128,4,8,8,0.1438080072402954
10000,8192,256,64,64,128,3,4,8,0.11353600025177002
10000,8192,256,64,128,128,4,4,8,0.1271039992570877
10000,8192,256,128,32,64,3,4,8,0.1592639982700348
10000,8192,256,128,32,64,4,8,8,0.1424960047006607
10000,8192,256,128,32,128,2,8,8,0.2377920001745224
10000,8192,256,128,32,128,3,4,8,0.16022400557994843
10000,8192,256,128,64,128,3,4,8,0.11363200098276138
10000,8192,256,128,64,128,5,8,8,0.13011200726032257
SAME
--------------------
512,6144,1536,32,16,32,1,2,8,0.22572800517082214
512,6144,1536,32,128,32,2,4,8,0.08511999994516373
512,6144,1536,32,32,64,5,8,8,0.10147199779748917
512,6144,1536,64,32,32,5,8,8,0.08713600039482117
512,6144,1536,64,128,32,5,4,8,0.06540799885988235
512,6144,1536,64,16,64,2,4,8,0.2370239943265915
512,6144,1536,64,32,64,2,4,8,0.13763199746608734
512,6144,1536,64,64,64,3,8,8,0.06560000032186508
512,6144,1536,64,128,64,5,4,8,0.05331199988722801
512,6144,1536,64,32,128,3,4,8,0.09465599805116653
512,6144,1536,64,32,128,4,8,8,0.07369600236415863
512,6144,1536,64,64,128,3,4,8,0.06486400216817856
512,6144,1536,64,128,128,4,4,8,0.04566400125622749
512,6144,1536,128,32,64,3,4,8,0.09638399630784988
512,6144,1536,128,32,64,4,8,8,0.07382400333881378
512,6144,1536,128,32,128,2,8,8,0.15001599490642548
512,6144,1536,128,32,128,3,4,8,0.1003199964761734
512,6144,1536,128,64,128,3,4,8,0.06755200028419495
512,6144,1536,128,64,128,5,8,8,0.051392000168561935
SAME
--------------------
2048,1024,50272,32,16,32,1,2,8,2.5803840160369873
2048,1024,50272,32,128,32,2,4,8,1.4994560480117798
2048,1024,50272,32,32,64,5,8,8,1.7653119564056396
2048,1024,50272,64,32,32,5,8,8,1.5196479558944702
2048,1024,50272,64,128,32,5,4,8,1.2800320386886597
2048,1024,50272,64,16,64,2,4,8,1.0819200277328491
2048,1024,50272,64,32,64,2,4,8,0.6884160041809082
2048,1024,50272,64,64,64,3,8,8,0.6738880276679993
2048,1024,50272,64,128,64,5,4,8,0.7614079713821411
2048,1024,50272,64,32,128,3,4,8,0.5229759812355042
2048,1024,50272,64,32,128,4,8,8,0.5421440005302429
2048,1024,50272,64,64,128,3,4,8,0.48841598629951477
2048,1024,50272,64,128,128,4,4,8,0.6199359893798828
2048,1024,50272,128,32,64,3,4,8,0.5435199737548828
2048,1024,50272,128,32,64,4,8,8,0.5470719933509827
2048,1024,50272,128,32,128,2,8,8,0.666592001914978
2048,1024,50272,128,32,128,3,4,8,0.4291200041770935
2048,1024,50272,128,64,128,3,4,8,0.4368639886379242
2048,1024,50272,128,64,128,5,8,8,0.42822399735450745
SAME
--------------------
512,128,256,32,16,32,1,2,8,0.024639999493956566
512,128,256,32,128,32,2,4,8,0.024351999163627625
512,128,256,32,32,64,5,8,8,0.0244159996509552
512,128,256,64,32,32,5,8,8,0.0244159996509552
512,128,256,64,128,32,5,4,8,0.02521600015461445
512,128,256,64,16,64,2,4,8,0.023711999878287315
512,128,256,64,32,64,2,4,8,0.024480000138282776
512,128,256,64,64,64,3,8,8,0.02425600029528141
512,128,256,64,128,64,5,4,8,0.024000000208616257
512,128,256,64,32,128,3,4,8,0.0244159996509552
512,128,256,64,32,128,4,8,8,0.02454400062561035
512,128,256,64,64,128,3,4,8,0.024383999407291412
512,128,256,64,128,128,4,4,8,0.02502400055527687
512,128,256,128,32,64,3,4,8,0.02454400062561035
512,128,256,128,32,64,4,8,8,0.02425600029528141
512,128,256,128,32,128,2,8,8,0.024000000208616257
512,128,256,128,32,128,3,4,8,0.02409599907696247
512,128,256,128,64,128,3,4,8,0.024224000051617622
512,128,256,128,64,128,5,8,8,0.02454400062561035
SAME
--------------------
512,1024,1024,32,16,32,1,2,8,0.053279999643564224
512,1024,1024,32,128,32,2,4,8,0.027904000133275986
512,1024,1024,32,32,64,5,8,8,0.02672000043094158
512,1024,1024,64,32,32,5,8,8,0.027168000116944313
512,1024,1024,64,128,32,5,4,8,0.025248000398278236
512,1024,1024,64,16,64,2,4,8,0.05462399870157242
512,1024,1024,64,32,64,2,4,8,0.03750399872660637
512,1024,1024,64,64,64,3,8,8,0.02672000043094158
512,1024,1024,64,128,64,5,4,8,0.02425600029528141
512,1024,1024,64,32,128,3,4,8,0.02848000079393387
512,1024,1024,64,32,128,4,8,8,0.02595200017094612
512,1024,1024,64,64,128,3,4,8,0.025631999596953392
512,1024,1024,64,128,128,4,4,8,0.02505600079894066
512,1024,1024,128,32,64,3,4,8,0.031968001276254654
512,1024,1024,128,32,64,4,8,8,0.025280000641942024
512,1024,1024,128,32,128,2,8,8,0.04076800122857094
512,1024,1024,128,32,128,3,4,8,0.03299200162291527
512,1024,1024,128,64,128,3,4,8,0.028896000236272812
512,1024,1024,128,64,128,5,8,8,0.024800000712275505
SAME
--------------------
512,256,1024,32,16,32,1,2,8,0.025855999439954758
512,256,1024,32,128,32,2,4,8,0.025439999997615814
512,256,1024,32,32,64,5,8,8,0.02518399991095066
512,256,1024,64,32,32,5,8,8,0.024320000782608986
512,256,1024,64,128,32,5,4,8,0.024320000782608986
512,256,1024,64,16,64,2,4,8,0.026048000901937485
512,256,1024,64,32,64,2,4,8,0.024447999894618988
512,256,1024,64,64,64,3,8,8,0.02319999970495701
512,256,1024,64,128,64,5,4,8,0.024671999737620354
512,256,1024,64,32,128,3,4,8,0.023744000121951103
512,256,1024,64,32,128,4,8,8,0.025855999439954758
512,256,1024,64,64,128,3,4,8,0.025151999667286873
512,256,1024,64,128,128,4,4,8,0.023871999233961105
512,256,1024,128,32,64,3,4,8,0.02396799996495247
512,256,1024,128,32,64,4,8,8,0.02454400062561035
512,256,1024,128,32,128,2,8,8,0.024927999824285507
512,256,1024,128,32,128,3,4,8,0.02550400048494339
512,256,1024,128,64,128,3,4,8,0.024288000538945198
512,256,1024,128,64,128,5,8,8,0.024351999163627625
SAME
--------------------
32768,2,256,32,16,32,1,2,8,0.027424000203609467
32768,2,256,32,16,32,2,4,8,0.02739199995994568
32768,2,256,32,16,64,5,8,8,0.025472000241279602
32768,2,256,64,16,32,5,8,8,0.02735999971628189
32768,2,256,64,16,32,5,4,8,0.026079999282956123
32768,2,256,64,16,64,2,4,8,0.025536000728607178
32768,2,256,64,16,64,3,8,8,0.026528000831604004
32768,2,256,64,16,64,5,4,8,0.024607999250292778
32768,2,256,64,16,128,3,4,8,0.025631999596953392
32768,2,256,64,16,128,4,8,8,0.025312000885605812
32768,2,256,64,16,128,4,4,8,0.025087999179959297
32768,2,256,128,16,64,3,4,8,0.026335999369621277
32768,2,256,128,16,64,4,8,8,0.026208000257611275
32768,2,256,128,16,128,2,8,8,0.025439999997615814
32768,2,256,128,16,128,3,4,8,0.024383999407291412
32768,2,256,128,16,128,5,8,8,0.025439999997615814
SAME
--------------------
512,8192,512,32,16,32,1,2,8,0.27859199047088623
512,8192,512,32,128,32,2,4,8,0.0835840031504631
512,8192,512,32,32,64,5,8,8,0.07046400010585785
512,8192,512,64,32,32,5,8,8,0.06998399645090103
512,8192,512,64,128,32,5,4,8,0.03993599861860275
512,8192,512,64,16,64,2,4,8,0.29971200227737427
512,8192,512,64,32,64,2,4,8,0.16838400065898895
512,8192,512,64,64,64,3,8,8,0.0721919983625412
512,8192,512,64,128,64,5,4,8,0.0398080013692379
512,8192,512,64,32,128,3,4,8,0.10847999900579453
512,8192,512,64,32,128,4,8,8,0.08371199667453766
512,8192,512,64,64,128,3,4,8,0.07110399752855301
512,8192,512,64,128,128,4,4,8,0.04460800066590309
512,8192,512,128,32,64,3,4,8,0.11007999628782272
512,8192,512,128,32,64,4,8,8,0.08697599917650223
512,8192,512,128,32,128,2,8,8,0.1908479928970337
512,8192,512,128,32,128,3,4,8,0.10976000130176544
512,8192,512,128,64,128,3,4,8,0.07433599978685379
512,8192,512,128,64,128,5,8,8,0.058368001133203506
SAME
--------------------
50272,512,768,32,16,32,1,2,8,0.5019519925117493
50272,512,768,32,128,32,2,4,8,0.2996160089969635
50272,512,768,32,32,64,5,8,8,0.35888001322746277
50272,512,768,64,32,32,5,8,8,0.31564798951148987
50272,512,768,64,128,32,5,4,8,0.30691200494766235
50272,512,768,64,16,64,2,4,8,0.18540799617767334
50272,512,768,64,32,64,2,4,8,0.1380160003900528
50272,512,768,64,64,64,3,8,8,0.13766400516033173
50272,512,768,64,128,64,5,4,8,0.17871999740600586
50272,512,768,64,32,128,3,4,8,0.11004800349473953
50272,512,768,64,32,128,4,8,8,0.11296000331640244
50272,512,768,64,64,128,3,4,8,0.11142399907112122
50272,512,768,64,128,128,4,4,8,0.14230400323867798
50272,512,768,128,32,64,3,4,8,0.11283200234174728
50272,512,768,128,32,64,4,8,8,0.11680000275373459
50272,512,768,128,32,128,2,8,8,0.143327996134758
50272,512,768,128,32,128,3,4,8,0.11135999858379364
50272,512,768,128,64,128,3,4,8,0.10899200290441513
50272,512,768,128,64,128,5,8,8,0.11046399921178818
SAME
--------------------
29056,256,1024,32,16,32,1,2,8,0.2040960043668747
29056,256,1024,32,128,32,2,4,8,0.12863999605178833
29056,256,1024,32,32,64,5,8,8,0.15907199680805206
29056,256,1024,64,32,32,5,8,8,0.14697599411010742
29056,256,1024,64,128,32,5,4,8,0.1910720020532608
29056,256,1024,64,16,64,2,4,8,0.09696000069379807
29056,256,1024,64,32,64,2,4,8,0.08019199967384338
29056,256,1024,64,64,64,3,8,8,0.07999999821186066
29056,256,1024,64,128,64,5,4,8,0.1170559972524643
29056,256,1024,64,32,128,3,4,8,0.06547199934720993
29056,256,1024,64,32,128,4,8,8,0.06831999868154526
29056,256,1024,64,64,128,3,4,8,0.06729599833488464
29056,256,1024,64,128,128,4,4,8,0.09225600212812424
29056,256,1024,128,32,64,3,4,8,0.06960000097751617
29056,256,1024,128,32,64,4,8,8,0.069023996591568
29056,256,1024,128,32,128,2,8,8,0.08079999685287476
29056,256,1024,128,32,128,3,4,8,0.0663359984755516
29056,256,1024,128,64,128,3,4,8,0.0647680014371872
29056,256,1024,128,64,128,5,8,8,0.0697920024394989
SAME
--------------------
512,1024,4096,32,16,32,1,2,8,0.07526399940252304
512,1024,4096,32,128,32,2,4,8,0.049536000937223434
512,1024,4096,32,32,64,5,8,8,0.055424001067876816
512,1024,4096,64,32,32,5,8,8,0.05135999992489815
512,1024,4096,64,128,32,5,4,8,0.04646399989724159
512,1024,4096,64,16,64,2,4,8,0.05830400064587593
512,1024,4096,64,32,64,2,4,8,0.04134399816393852
512,1024,4096,64,64,64,3,8,8,0.02921600081026554
512,1024,4096,64,128,64,5,4,8,0.03500799834728241
512,1024,4096,64,32,128,3,4,8,0.03097599931061268
512,1024,4096,64,32,128,4,8,8,0.028896000236272812
512,1024,4096,64,64,128,3,4,8,0.028224000707268715
512,1024,4096,64,128,128,4,4,8,0.03097599931061268
512,1024,4096,128,32,64,3,4,8,0.034304000437259674
512,1024,4096,128,32,64,4,8,8,0.029023999348282814
512,1024,4096,128,32,128,2,8,8,0.04265600070357323
512,1024,4096,128,32,128,3,4,8,0.03484800085425377
512,1024,4096,128,64,128,3,4,8,0.03110400028526783
512,1024,4096,128,64,128,5,8,8,0.02630399912595749
SAME
--------------------
1024,768,768,32,16,32,1,2,8,0.04259200021624565
1024,768,768,32,128,32,2,4,8,0.02675200067460537
1024,768,768,32,32,64,5,8,8,0.02783999964594841
1024,768,768,64,32,32,5,8,8,0.026688000187277794
1024,768,768,64,128,32,5,4,8,0.025919999927282333
1024,768,768,64,16,64,2,4,8,0.04447999969124794
1024,768,768,64,32,64,2,4,8,0.03203200176358223
1024,768,768,64,64,64,3,8,8,0.024320000782608986
1024,768,768,64,128,64,5,4,8,0.024768000468611717
1024,768,768,64,32,128,3,4,8,0.024960000067949295
1024,768,768,64,32,128,4,8,8,0.02377600036561489
1024,768,768,64,64,128,3,4,8,0.02473600022494793
1024,768,768,64,128,128,4,4,8,0.024351999163627625
1024,768,768,128,32,64,3,4,8,0.027615999802947044
1024,768,768,128,32,64,4,8,8,0.024480000138282776
1024,768,768,128,32,128,2,8,8,0.03372799977660179
1024,768,768,128,32,128,3,4,8,0.02908799983561039
1024,768,768,128,64,128,3,4,8,0.026240000501275063
1024,768,768,128,64,128,5,8,8,0.024447999894618988
SAME
--------------------
2048,32000,1024,32,16,32,1,2,8,1.664512038230896
2048,32000,1024,32,128,32,2,4,8,1.0149760246276855
2048,32000,1024,32,32,64,5,8,8,1.0979199409484863
2048,32000,1024,64,32,32,5,8,8,0.9827200174331665
2048,32000,1024,64,128,32,5,4,8,0.6211519837379456
2048,32000,1024,64,16,64,2,4,8,1.160159945487976
2048,32000,1024,64,32,64,2,4,8,0.6511039733886719
2048,32000,1024,64,64,64,3,8,8,0.4336639940738678
2048,32000,1024,64,128,64,5,4,8,0.36905598640441895
2048,32000,1024,64,32,128,3,4,8,0.3731519877910614
2048,32000,1024,64,32,128,4,8,8,0.3286080062389374
2048,32000,1024,64,64,128,3,4,8,0.26159998774528503
2048,32000,1024,64,128,128,4,4,8,0.27904000878334045
2048,32000,1024,128,32,64,3,4,8,0.39449599385261536
2048,32000,1024,128,32,64,4,8,8,0.3251520097255707
2048,32000,1024,128,32,128,2,8,8,0.7389119863510132
2048,32000,1024,128,32,128,3,4,8,0.39552000164985657
2048,32000,1024,128,64,128,3,4,8,0.2494720071554184
2048,32000,1024,128,64,128,5,8,8,0.2306240051984787
SAME
--------------------
50257,512,768,32,16,32,1,2,8,0.5019840002059937
50257,512,768,32,128,32,2,4,8,0.30083200335502625
50257,512,768,32,32,64,5,8,8,0.3591040074825287
50257,512,768,64,32,32,5,8,8,0.3160000145435333
50257,512,768,64,128,32,5,4,8,0.30847999453544617
50257,512,768,64,16,64,2,4,8,0.1857600063085556
50257,512,768,64,32,64,2,4,8,0.1382720023393631
50257,512,768,64,64,64,3,8,8,0.13916799426078796
50257,512,768,64,128,64,5,4,8,0.17948800325393677
50257,512,768,64,32,128,3,4,8,0.11180800199508667
50257,512,768,64,32,128,4,8,8,0.11366400122642517
50257,512,768,64,64,128,3,4,8,0.11289600282907486
50257,512,768,64,128,128,4,4,8,0.13609600067138672
50257,512,768,128,32,64,3,4,8,0.11340799927711487
50257,512,768,128,32,64,4,8,8,0.1167680025100708
50257,512,768,128,32,128,2,8,8,0.14316800236701965
50257,512,768,128,32,128,3,4,8,0.11046399921178818
50257,512,768,128,64,128,3,4,8,0.1111999973654747
50257,512,768,128,64,128,5,8,8,0.11311999708414078
SAME
--------------------
512,768,3072,32,16,32,1,2,8,0.047648001462221146
512,768,3072,32,128,32,2,4,8,0.03667199984192848
512,768,3072,32,32,64,5,8,8,0.03964800015091896
512,768,3072,64,32,32,5,8,8,0.036288000643253326
512,768,3072,64,128,32,5,4,8,0.03587200120091438
512,768,3072,64,16,64,2,4,8,0.04623999819159508
512,768,3072,64,32,64,2,4,8,0.03471999987959862
512,768,3072,64,64,64,3,8,8,0.024351999163627625
512,768,3072,64,128,64,5,4,8,0.02796800062060356
512,768,3072,64,32,128,3,4,8,0.027168000116944313
512,768,3072,64,32,128,4,8,8,0.026079999282956123
512,768,3072,64,64,128,3,4,8,0.024800000712275505
512,768,3072,64,128,128,4,4,8,0.02735999971628189
512,768,3072,128,32,64,3,4,8,0.029440000653266907
512,768,3072,128,32,64,4,8,8,0.02627200074493885
512,768,3072,128,32,128,2,8,8,0.03596799820661545
512,768,3072,128,32,128,3,4,8,0.030047999694943428
512,768,3072,128,64,128,3,4,8,0.026559999212622643
512,768,3072,128,64,128,5,8,8,0.024768000468611717
SAME
--------------------
512,1536,6144,32,16,32,1,2,8,0.13478399813175201
512,1536,6144,32,128,32,2,4,8,0.08656000345945358
512,1536,6144,32,32,64,5,8,8,0.10143999755382538
512,1536,6144,64,32,32,5,8,8,0.09084799885749817
512,1536,6144,64,128,32,5,4,8,0.07423999905586243
512,1536,6144,64,16,64,2,4,8,0.08585599809885025
512,1536,6144,64,32,64,2,4,8,0.0560000017285347
512,1536,6144,64,64,64,3,8,8,0.04867200180888176
512,1536,6144,64,128,64,5,4,8,0.052191998809576035
512,1536,6144,64,32,128,3,4,8,0.0416640006005764
512,1536,6144,64,32,128,4,8,8,0.039583999663591385
512,1536,6144,64,64,128,3,4,8,0.038047999143600464
512,1536,6144,64,128,128,4,4,8,0.04460800066590309
512,1536,6144,128,32,64,3,4,8,0.04275200143456459
512,1536,6144,128,32,64,4,8,8,0.040608000010252
512,1536,6144,128,32,128,2,8,8,0.059967998415231705
512,1536,6144,128,32,128,3,4,8,0.04374400153756142
512,1536,6144,128,64,128,3,4,8,0.03824000060558319
512,1536,6144,128,64,128,5,8,8,0.04211200028657913
SAME
--------------------
256,512,128,32,16,32,1,2,8,0.031039999797940254
256,512,128,32,128,32,2,4,8,0.023423999547958374
256,512,128,32,32,64,5,8,8,0.024000000208616257
256,512,128,64,32,32,5,8,8,0.023679999634623528
256,512,128,64,128,32,5,4,8,0.024447999894618988
256,512,128,64,16,64,2,4,8,0.03267199918627739
256,512,128,64,32,64,2,4,8,0.02505600079894066
256,512,128,64,64,64,3,8,8,0.023455999791622162
256,512,128,64,128,64,5,4,8,0.02470399998128414
256,512,128,64,32,128,3,4,8,0.025119999423623085
256,512,128,64,32,128,4,8,8,0.02319999970495701
256,512,128,64,64,128,3,4,8,0.02412799932062626
256,512,128,64,128,128,4,4,8,0.024383999407291412
256,512,128,128,32,64,3,4,8,0.024639999493956566
256,512,128,128,32,64,4,8,8,0.02409599907696247
256,512,128,128,32,128,2,8,8,0.028831999748945236
256,512,128,128,32,128,3,4,8,0.024671999737620354
256,512,128,128,64,128,3,4,8,0.024639999493956566
256,512,128,128,64,128,5,8,8,0.02377600036561489
SAME
--------------------
8192,2048,512,32,16,32,1,2,8,0.2215999960899353
8192,2048,512,32,128,32,2,4,8,0.12495999783277512
8192,2048,512,32,32,64,5,8,8,0.14774399995803833
8192,2048,512,64,32,32,5,8,8,0.12886400520801544
8192,2048,512,64,128,32,5,4,8,0.10374400019645691
8192,2048,512,64,16,64,2,4,8,0.11046399921178818
8192,2048,512,64,32,64,2,4,8,0.08131200075149536
8192,2048,512,64,64,64,3,8,8,0.0647680014371872
8192,2048,512,64,128,64,5,4,8,0.07187200337648392
8192,2048,512,64,32,128,3,4,8,0.06355199962854385
8192,2048,512,64,32,128,4,8,8,0.06297600269317627
8192,2048,512,64,64,128,3,4,8,0.06483200192451477
8192,2048,512,64,128,128,4,4,8,0.06272000074386597
8192,2048,512,128,32,64,3,4,8,0.06748799979686737
8192,2048,512,128,32,64,4,8,8,0.06735999882221222
8192,2048,512,128,32,128,2,8,8,0.08607999980449677
8192,2048,512,128,32,128,3,4,8,0.06595200300216675
8192,2048,512,128,64,128,3,4,8,0.0549440011382103
8192,2048,512,128,64,128,5,8,8,0.057151999324560165
SAME
--------------------
1024,3072,768,32,16,32,1,2,8,0.10883200168609619
1024,3072,768,32,128,32,2,4,8,0.049855999648571014
1024,3072,768,32,32,64,5,8,8,0.05913599953055382
1024,3072,768,64,32,32,5,8,8,0.05299200117588043
1024,3072,768,64,128,32,5,4,8,0.041152000427246094
1024,3072,768,64,16,64,2,4,8,0.11523199826478958
1024,3072,768,64,32,64,2,4,8,0.08236800134181976
1024,3072,768,64,64,64,3,8,8,0.03977600112557411
1024,3072,768,64,128,64,5,4,8,0.036031998693943024
1024,3072,768,64,32,128,3,4,8,0.054016001522541046
1024,3072,768,64,32,128,4,8,8,0.04383999854326248
1024,3072,768,64,64,128,3,4,8,0.03968000039458275
1024,3072,768,64,128,128,4,4,8,0.031168000772595406
1024,3072,768,128,32,64,3,4,8,0.055904000997543335
1024,3072,768,128,32,64,4,8,8,0.044704001396894455
1024,3072,768,128,32,128,2,8,8,0.08899199962615967
1024,3072,768,128,32,128,3,4,8,0.05676800012588501
1024,3072,768,128,64,128,3,4,8,0.041439998894929886
1024,3072,768,128,64,128,5,8,8,0.03526400029659271
SAME
--------------------
256,512,256,32,16,32,1,2,8,0.03315199911594391
256,512,256,32,128,32,2,4,8,0.025728000327944756
256,512,256,32,32,64,5,8,8,0.02627200074493885
256,512,256,64,32,32,5,8,8,0.025887999683618546
256,512,256,64,128,32,5,4,8,0.0261439997702837
256,512,256,64,16,64,2,4,8,0.03465599939227104
256,512,256,64,32,64,2,4,8,0.026784000918269157
256,512,256,64,64,64,3,8,8,0.02537599951028824
256,512,256,64,128,64,5,4,8,0.025536000728607178
256,512,256,64,32,128,3,4,8,0.025151999667286873
256,512,256,64,32,128,4,8,8,0.024159999564290047
256,512,256,64,64,128,3,4,8,0.02521600015461445
256,512,256,64,128,128,4,4,8,0.025728000327944756
256,512,256,128,32,64,3,4,8,0.0261439997702837
256,512,256,128,32,64,4,8,8,0.02486399933695793
256,512,256,128,32,128,2,8,8,0.028416000306606293
256,512,256,128,32,128,3,4,8,0.026496000587940216
256,512,256,128,64,128,3,4,8,0.025567999109625816
256,512,256,128,64,128,5,8,8,0.025280000641942024
SAME
--------------------
128,2048,2048,32,16,32,1,2,8,0.0875839963555336
128,2048,2048,32,128,32,2,4,8,0.034752000123262405
128,2048,2048,32,32,64,5,8,8,0.03046399913728237
128,2048,2048,64,32,32,5,8,8,0.03046399913728237
128,2048,2048,64,128,32,5,4,8,0.025407999753952026
128,2048,2048,64,16,64,2,4,8,0.09196799993515015
128,2048,2048,64,32,64,2,4,8,0.05852799862623215
128,2048,2048,64,64,64,3,8,8,0.03200000151991844
128,2048,2048,64,128,64,5,4,8,0.025728000327944756
128,2048,2048,64,32,128,3,4,8,0.04169600084424019
128,2048,2048,64,32,128,4,8,8,0.03420799970626831
128,2048,2048,64,64,128,3,4,8,0.03254399821162224
128,2048,2048,64,128,128,4,4,8,0.026335999369621277
128,2048,2048,128,32,64,3,4,8,0.042399998754262924
128,2048,2048,128,32,64,4,8,8,0.03452799841761589
128,2048,2048,128,32,128,2,8,8,0.06508799642324448
128,2048,2048,128,32,128,3,4,8,0.04390399903059006
128,2048,2048,128,64,128,3,4,8,0.03376000002026558
128,2048,2048,128,64,128,5,8,8,0.02876799926161766
SAME
--------------------
2048,4096,1024,32,16,32,1,2,8,0.2215680032968521
2048,4096,1024,32,128,32,2,4,8,0.12217599898576736
2048,4096,1024,32,32,64,5,8,8,0.14537599682807922
2048,4096,1024,64,32,32,5,8,8,0.1268160045146942
2048,4096,1024,64,128,32,5,4,8,0.10118400305509567
2048,4096,1024,64,16,64,2,4,8,0.1626880019903183
2048,4096,1024,64,32,64,2,4,8,0.11113599687814713
2048,4096,1024,64,64,64,3,8,8,0.06473600119352341
2048,4096,1024,64,128,64,5,4,8,0.06588800251483917
2048,4096,1024,64,32,128,3,4,8,0.0767040029168129
2048,4096,1024,64,32,128,4,8,8,0.06563200056552887
2048,4096,1024,64,64,128,3,4,8,0.05603199824690819
2048,4096,1024,64,128,128,4,4,8,0.05500800162553787
2048,4096,1024,128,32,64,3,4,8,0.07900799810886383
2048,4096,1024,128,32,64,4,8,8,0.06595200300216675
2048,4096,1024,128,32,128,2,8,8,0.11308799684047699
2048,4096,1024,128,32,128,3,4,8,0.08035200089216232
2048,4096,1024,128,64,128,3,4,8,0.05740800127387047
2048,4096,1024,128,64,128,5,8,8,0.04975999891757965
SAME
--------------------
128,50257,2048,32,16,32,1,2,8,3.014240026473999
128,50257,2048,32,128,32,2,4,8,0.4483200013637543
128,50257,2048,32,32,64,5,8,8,1.0548160076141357
128,50257,2048,64,32,32,5,8,8,1.6692479848861694
128,50257,2048,64,128,32,5,4,8,0.8180480003356934
128,50257,2048,64,16,64,2,4,8,2.039072036743164
128,50257,2048,64,32,64,2,4,8,1.2150399684906006
128,50257,2048,64,64,64,3,8,8,0.8640959858894348
128,50257,2048,64,128,64,5,4,8,0.9370880126953125
128,50257,2048,64,32,128,3,4,8,1.280959963798523
128,50257,2048,64,32,128,4,8,8,1.2895359992980957
128,50257,2048,64,64,128,3,4,8,0.8808959722518921
128,50257,2048,64,128,128,4,4,8,0.9949759840965271
128,50257,2048,128,32,64,3,4,8,1.4958720207214355
128,50257,2048,128,32,64,4,8,8,1.4367680549621582
128,50257,2048,128,32,128,2,8,8,1.5383039712905884
128,50257,2048,128,32,128,3,4,8,1.8559679985046387
128,50257,2048,128,64,128,3,4,8,6.753503799438477
128,50257,2048,128,64,128,5,8,8,1.2748160362243652
SAME
--------------------
1024,768,50005,32,16,32,1,2,8,1.1170239448547363
1024,768,50005,32,128,32,2,4,8,2.0083839893341064
1024,768,50005,32,32,64,5,8,8,1.1089600324630737
1024,768,50005,64,32,32,5,8,8,0.9195839762687683
1024,768,50005,64,128,32,5,4,8,1.26310396194458
1024,768,50005,64,16,64,2,4,8,0.6589440107345581
1024,768,50005,64,32,64,2,4,8,0.7191680073738098
1024,768,50005,64,64,64,3,8,8,0.6729599833488464
1024,768,50005,64,128,64,5,4,8,2.7693440914154053
1024,768,50005,64,32,128,3,4,8,0.6329600214958191
1024,768,50005,64,32,128,4,8,8,0.7786880135536194
1024,768,50005,64,64,128,3,4,8,0.544704020023346
1024,768,50005,64,128,128,4,4,8,0.4989120066165924
1024,768,50005,128,32,64,3,4,8,0.3778879940509796
1024,768,50005,128,32,64,4,8,8,0.4672960042953491
1024,768,50005,128,32,128,2,8,8,0.4724160134792328
1024,768,50005,128,32,128,3,4,8,0.3786559998989105
1024,768,50005,128,64,128,3,4,8,0.3678399920463562
1024,768,50005,128,64,128,5,8,8,0.484607994556427
SAME
--------------------
512,2304,768,32,16,32,1,2,8,0.09462399780750275
512,2304,768,32,128,32,2,4,8,0.03747199848294258
512,2304,768,32,32,64,5,8,8,0.03836800158023834
512,2304,768,64,32,32,5,8,8,0.03478400036692619
512,2304,768,64,128,32,5,4,8,0.02908799983561039
512,2304,768,64,16,64,2,4,8,0.10169599950313568
512,2304,768,64,32,64,2,4,8,0.06457599997520447
512,2304,768,64,64,64,3,8,8,0.033376000821590424
512,2304,768,64,128,64,5,4,8,0.026016000658273697
512,2304,768,64,32,128,3,4,8,0.043136000633239746
512,2304,768,64,32,128,4,8,8,0.03766399994492531
512,2304,768,64,64,128,3,4,8,0.033344000577926636
512,2304,768,64,128,128,4,4,8,0.026335999369621277
512,2304,768,128,32,64,3,4,8,0.04572800174355507
512,2304,768,128,32,64,4,8,8,0.03747199848294258
512,2304,768,128,32,128,2,8,8,0.07119999825954437
512,2304,768,128,32,128,3,4,8,0.046431999653577805
512,2304,768,128,64,128,3,4,8,0.03500799834728241
512,2304,768,128,64,128,5,8,8,0.030432000756263733
SAME
--------------------
2048,512,128,32,16,32,1,2,8,0.032575998455286026
2048,512,128,32,128,32,2,4,8,0.02598400041460991
2048,512,128,32,32,64,5,8,8,0.02502400055527687
2048,512,128,64,32,32,5,8,8,0.024639999493956566
2048,512,128,64,128,32,5,4,8,0.024447999894618988
2048,512,128,64,16,64,2,4,8,0.03292800113558769
2048,512,128,64,32,64,2,4,8,0.027327999472618103
2048,512,128,64,64,64,3,8,8,0.024607999250292778
2048,512,128,64,128,64,5,4,8,0.0244159996509552
2048,512,128,64,32,128,3,4,8,0.024224000051617622
2048,512,128,64,32,128,4,8,8,0.02502400055527687
2048,512,128,64,64,128,3,4,8,0.02454400062561035
2048,512,128,64,128,128,4,4,8,0.02473600022494793
2048,512,128,128,32,64,3,4,8,0.024992000311613083
2048,512,128,128,32,64,4,8,8,0.02627200074493885
2048,512,128,128,32,128,2,8,8,0.028672000393271446
2048,512,128,128,32,128,3,4,8,0.025312000885605812
2048,512,128,128,64,128,3,4,8,0.024447999894618988
2048,512,128,128,64,128,5,8,8,0.02489599958062172
SAME
--------------------
128,2048,8192,32,16,32,1,2,8,0.10556799918413162
128,2048,8192,32,128,32,2,4,8,0.06569600105285645
128,2048,8192,32,32,64,5,8,8,0.056671999394893646
128,2048,8192,64,32,32,5,8,8,0.05407999828457832
128,2048,8192,64,128,32,5,4,8,0.05555199831724167
128,2048,8192,64,16,64,2,4,8,0.11158400028944016
128,2048,8192,64,32,64,2,4,8,0.07254400104284286
128,2048,8192,64,64,64,3,8,8,0.04729599878191948
128,2048,8192,64,128,64,5,4,8,0.043935999274253845
128,2048,8192,64,32,128,3,4,8,0.05392000079154968
128,2048,8192,64,32,128,4,8,8,0.048928000032901764
128,2048,8192,64,64,128,3,4,8,0.046592000871896744
128,2048,8192,64,128,128,4,4,8,0.03999999910593033
128,2048,8192,128,32,64,3,4,8,0.05375999957323074
128,2048,8192,128,32,64,4,8,8,0.04870399832725525
128,2048,8192,128,32,128,2,8,8,0.07760000228881836
128,2048,8192,128,32,128,3,4,8,0.054655998945236206
128,2048,8192,128,64,128,3,4,8,0.04755200073122978
128,2048,8192,128,64,128,5,8,8,0.041471999138593674
SAME
--------------------
50265,1024,768,32,16,32,1,2,8,0.9790719747543335
50265,1024,768,32,128,32,2,4,8,0.5618879795074463
50265,1024,768,32,32,64,5,8,8,0.6662399768829346
50265,1024,768,64,32,32,5,8,8,0.5732160210609436
50265,1024,768,64,128,32,5,4,8,0.4400320053100586
50265,1024,768,64,16,64,2,4,8,0.3407039940357208
50265,1024,768,64,32,64,2,4,8,0.2457599937915802
50265,1024,768,64,64,64,3,8,8,0.24403199553489685
50265,1024,768,64,128,64,5,4,8,0.2743679881095886
50265,1024,768,64,32,128,3,4,8,0.18121600151062012
50265,1024,768,64,32,128,4,8,8,0.19766399264335632
50265,1024,768,64,64,128,3,4,8,0.1746239960193634
50265,1024,768,64,128,128,4,4,8,0.22604799270629883
50265,1024,768,128,32,64,3,4,8,0.2040639966726303
50265,1024,768,128,32,64,4,8,8,0.20422400534152985
50265,1024,768,128,32,128,2,8,8,0.25065600872039795
50265,1024,768,128,32,128,3,4,8,0.16435199975967407
50265,1024,768,128,64,128,3,4,8,0.16627199947834015
50265,1024,768,128,64,128,5,8,8,0.16316799819469452
SAME
--------------------
4096,2304,768,32,16,32,1,2,8,0.20854400098323822
4096,2304,768,32,128,32,2,4,8,0.11423999816179276
4096,2304,768,32,32,64,5,8,8,0.12479999661445618
4096,2304,768,64,32,32,5,8,8,0.11558400094509125
4096,2304,768,64,128,32,5,4,8,0.09247999638319016
4096,2304,768,64,16,64,2,4,8,0.11027199774980545
4096,2304,768,64,32,64,2,4,8,0.07833600044250488
4096,2304,768,64,64,64,3,8,8,0.06006399914622307
4096,2304,768,64,128,64,5,4,8,0.06307200342416763
4096,2304,768,64,32,128,3,4,8,0.05753599852323532
4096,2304,768,64,32,128,4,8,8,0.05286400020122528
4096,2304,768,64,64,128,3,4,8,0.04585599899291992
4096,2304,768,64,128,128,4,4,8,0.053119998425245285
4096,2304,768,128,32,64,3,4,8,0.06047999858856201
4096,2304,768,128,32,64,4,8,8,0.054655998945236206
4096,2304,768,128,32,128,2,8,8,0.08188799768686295
4096,2304,768,128,32,128,3,4,8,0.06028800085186958
4096,2304,768,128,64,128,3,4,8,0.046911999583244324
4096,2304,768,128,64,128,5,8,8,0.05100800096988678
SAME
--------------------
2048,512,384,32,16,32,1,2,8,0.03420799970626831
2048,512,384,32,128,32,2,4,8,0.025439999997615814
2048,512,384,32,32,64,5,8,8,0.026176000013947487
2048,512,384,64,32,32,5,8,8,0.025855999439954758
2048,512,384,64,128,32,5,4,8,0.025855999439954758
2048,512,384,64,16,64,2,4,8,0.034591998904943466
2048,512,384,64,32,64,2,4,8,0.027488000690937042
2048,512,384,64,64,64,3,8,8,0.024639999493956566
2048,512,384,64,128,64,5,4,8,0.026048000901937485
2048,512,384,64,32,128,3,4,8,0.02566399984061718
2048,512,384,64,32,128,4,8,8,0.02457600086927414
2048,512,384,64,64,128,3,4,8,0.024768000468611717
2048,512,384,64,128,128,4,4,8,0.024927999824285507
2048,512,384,128,32,64,3,4,8,0.02470399998128414
2048,512,384,128,32,64,4,8,8,0.026079999282956123
2048,512,384,128,32,128,2,8,8,0.030559999868273735
2048,512,384,128,32,128,3,4,8,0.02672000043094158
2048,512,384,128,64,128,3,4,8,0.025887999683618546
2048,512,384,128,64,128,5,8,8,0.03129599988460541
SAME
--------------------
50265,512,1024,32,16,32,1,2,8,0.666815996170044
50265,512,1024,32,128,32,2,4,8,0.4047679901123047
50265,512,1024,32,32,64,5,8,8,0.4782400131225586
50265,512,1024,64,32,32,5,8,8,0.4283199906349182
50265,512,1024,64,128,32,5,4,8,0.40432000160217285
50265,512,1024,64,16,64,2,4,8,0.23839999735355377
50265,512,1024,64,32,64,2,4,8,0.18108800053596497
50265,512,1024,64,64,64,3,8,8,0.18355199694633484
50265,512,1024,64,128,64,5,4,8,0.23628799617290497
50265,512,1024,64,32,128,3,4,8,0.1287039965391159
50265,512,1024,64,32,128,4,8,8,0.1467200070619583
50265,512,1024,64,64,128,3,4,8,0.13075199723243713
50265,512,1024,64,128,128,4,4,8,0.17107200622558594
50265,512,1024,128,32,64,3,4,8,0.14220799505710602
50265,512,1024,128,32,64,4,8,8,0.15145599842071533
50265,512,1024,128,32,128,2,8,8,0.1728000044822693
50265,512,1024,128,32,128,3,4,8,0.12435200065374374
50265,512,1024,128,64,128,3,4,8,0.12598399817943573
50265,512,1024,128,64,128,5,8,8,0.12848000228405
SAME
--------------------
8192,256,2048,32,16,32,1,2,8,0.1178240031003952
8192,256,2048,32,128,32,2,4,8,0.08633600175380707
8192,256,2048,32,32,64,5,8,8,0.10463999956846237
8192,256,2048,64,32,32,5,8,8,0.09916800260543823
8192,256,2048,64,128,32,5,4,8,0.1098560020327568
8192,256,2048,64,16,64,2,4,8,0.06015999987721443
8192,256,2048,64,32,64,2,4,8,0.05027199909090996
8192,256,2048,64,64,64,3,8,8,0.050655998289585114
8192,256,2048,64,128,64,5,4,8,0.081216000020504
8192,256,2048,64,32,128,3,4,8,0.04233599826693535
8192,256,2048,64,32,128,4,8,8,0.04560000076889992
8192,256,2048,64,64,128,3,4,8,0.043136000633239746
8192,256,2048,64,128,128,4,4,8,0.06188800185918808
8192,256,2048,128,32,64,3,4,8,0.045184001326560974
8192,256,2048,128,32,64,4,8,8,0.045823998749256134
8192,256,2048,128,32,128,2,8,8,0.047040000557899475
8192,256,2048,128,32,128,3,4,8,0.04179200157523155
8192,256,2048,128,64,128,3,4,8,0.03977600112557411
8192,256,2048,128,64,128,5,8,8,0.046879999339580536
SAME
--------------------
2048,512,512,32,16,32,1,2,8,0.03510399907827377
2048,512,512,32,128,32,2,4,8,0.027103999629616737
2048,512,512,32,32,64,5,8,8,0.026464000344276428
2048,512,512,64,32,32,5,8,8,0.02598400041460991
2048,512,512,64,128,32,5,4,8,0.026688000187277794
2048,512,512,64,16,64,2,4,8,0.03516799956560135
2048,512,512,64,32,64,2,4,8,0.02768000029027462
2048,512,512,64,64,64,3,8,8,0.0244159996509552
2048,512,512,64,128,64,5,4,8,0.02457600086927414
2048,512,512,64,32,128,3,4,8,0.02457600086927414
2048,512,512,64,32,128,4,8,8,0.02489599958062172
2048,512,512,64,64,128,3,4,8,0.025280000641942024
2048,512,512,64,128,128,4,4,8,0.024288000538945198
2048,512,512,128,32,64,3,4,8,0.024671999737620354
2048,512,512,128,32,64,4,8,8,0.024351999163627625
2048,512,512,128,32,128,2,8,8,0.028863999992609024
2048,512,512,128,32,128,3,4,8,0.025151999667286873
2048,512,512,128,64,128,3,4,8,0.025087999179959297
2048,512,512,128,64,128,5,8,8,0.024224000051617622
SAME
--------------------
256,512,1024,32,16,32,1,2,8,0.03446400165557861
256,512,1024,32,128,32,2,4,8,0.02473600022494793
256,512,1024,32,32,64,5,8,8,0.02486399933695793
256,512,1024,64,32,32,5,8,8,0.025439999997615814
256,512,1024,64,128,32,5,4,8,0.024512000381946564
256,512,1024,64,16,64,2,4,8,0.03488000109791756
256,512,1024,64,32,64,2,4,8,0.027264000847935677
256,512,1024,64,64,64,3,8,8,0.024831999093294144
256,512,1024,64,128,64,5,4,8,0.024639999493956566
256,512,1024,64,32,128,3,4,8,0.025119999423623085
256,512,1024,64,32,128,4,8,8,0.02454400062561035
256,512,1024,64,64,128,3,4,8,0.02473600022494793
256,512,1024,64,128,128,4,4,8,0.024768000468611717
256,512,1024,128,32,64,3,4,8,0.025087999179959297
256,512,1024,128,32,64,4,8,8,0.02473600022494793
256,512,1024,128,32,128,2,8,8,0.028704000636935234
256,512,1024,128,32,128,3,4,8,0.025407999753952026
256,512,1024,128,64,128,3,4,8,0.025567999109625816
256,512,1024,128,64,128,5,8,8,0.024191999807953835
SAME
--------------------
512,8192,2048,32,16,32,1,2,8,0.3014400005340576
512,8192,2048,32,128,32,2,4,8,0.11798399686813354
512,8192,2048,32,32,64,5,8,8,0.14713600277900696
512,8192,2048,64,32,32,5,8,8,0.1265600025653839
512,8192,2048,64,128,32,5,4,8,0.10121600329875946
512,8192,2048,64,16,64,2,4,8,0.318015992641449
512,8192,2048,64,32,64,2,4,8,0.1855359971523285
512,8192,2048,64,64,64,3,8,8,0.0838719978928566
512,8192,2048,64,128,64,5,4,8,0.06870400160551071
512,8192,2048,64,32,128,3,4,8,0.11420799791812897
512,8192,2048,64,32,128,4,8,8,0.09334400296211243
512,8192,2048,64,64,128,3,4,8,0.08246400207281113
512,8192,2048,64,128,128,4,4,8,0.05961599946022034
512,8192,2048,128,32,64,3,4,8,0.11423999816179276
512,8192,2048,128,32,64,4,8,8,0.09772799909114838
512,8192,2048,128,32,128,2,8,8,0.20291200280189514
512,8192,2048,128,32,128,3,4,8,0.11507199704647064
512,8192,2048,128,64,128,3,4,8,0.08848000317811966
512,8192,2048,128,64,128,5,8,8,0.06790400296449661
SAME
--------------------
50265,2048,768,32,16,32,1,2,8,1.9321600198745728
50265,2048,768,32,128,32,2,4,8,1.0792959928512573
50265,2048,768,32,32,64,5,8,8,1.2791680097579956
50265,2048,768,64,32,32,5,8,8,1.0998079776763916
50265,2048,768,64,128,32,5,4,8,0.7480639815330505
50265,2048,768,64,16,64,2,4,8,0.7167680263519287
50265,2048,768,64,32,64,2,4,8,0.4856959879398346
50265,2048,768,64,64,64,3,8,8,0.46486398577690125
50265,2048,768,64,128,64,5,4,8,0.4657920002937317
50265,2048,768,64,32,128,3,4,8,0.3691200017929077
50265,2048,768,64,32,128,4,8,8,0.3750079870223999
50265,2048,768,64,64,128,3,4,8,0.3360320031642914
50265,2048,768,64,128,128,4,4,8,0.3771840035915375
50265,2048,768,128,32,64,3,4,8,0.411327987909317
50265,2048,768,128,32,64,4,8,8,0.3968000113964081
50265,2048,768,128,32,128,2,8,8,0.49372801184654236
50265,2048,768,128,32,128,3,4,8,0.3086400032043457
50265,2048,768,128,64,128,3,4,8,0.2730560004711151
50265,2048,768,128,64,128,5,8,8,0.28460800647735596
SAME
--------------------
2,8192,768,16,16,32,1,2,8,0.27875199913978577
2,8192,768,16,128,32,2,2,8,0.07807999849319458
2,8192,768,16,32,64,5,4,8,0.06307200342416763
2,8192,768,16,32,32,5,2,8,0.06380800157785416
2,8192,768,16,128,32,5,2,8,0.036639999598264694
2,8192,768,16,16,64,2,4,8,0.2884800136089325
2,8192,768,16,32,64,2,4,8,0.1624000072479248
2,8192,768,16,64,64,3,4,8,0.06864000111818314
2,8192,768,16,128,64,5,4,8,0.036959998309612274
2,8192,768,16,32,128,3,4,8,0.1090560033917427
2,8192,768,16,32,128,4,8,8,0.07676800340414047
2,8192,768,16,64,128,3,4,8,0.0772479996085167
2,8192,768,16,128,128,4,4,8,0.04710400104522705
2,8192,768,16,32,64,3,4,8,0.10060799866914749
2,8192,768,16,32,64,4,4,8,0.07465600222349167
2,8192,768,16,32,128,2,8,8,0.17052799463272095
2,8192,768,16,64,128,5,8,8,0.0525440014898777
SAME
--------------------
512,32005,768,32,16,32,1,2,8,1.882912039756775
512,32005,768,32,128,32,2,4,8,0.30640000104904175
512,32005,768,32,32,64,5,8,8,0.6739519834518433
512,32005,768,64,32,32,5,8,8,1.0548479557037354
512,32005,768,64,128,32,5,4,8,0.506816029548645
512,32005,768,64,16,64,2,4,8,1.289631962776184
512,32005,768,64,32,64,2,4,8,0.7543359994888306
512,32005,768,64,64,64,3,8,8,0.5368959903717041
512,32005,768,64,128,64,5,4,8,0.5971199870109558
512,32005,768,64,32,128,3,4,8,0.796671986579895
512,32005,768,64,32,128,4,8,8,0.7923200130462646
512,32005,768,64,64,128,3,4,8,0.5538880228996277
512,32005,768,64,128,128,4,4,8,0.6202560067176819
512,32005,768,128,32,64,3,4,8,0.9304959774017334
512,32005,768,128,32,64,4,8,8,0.8945279717445374
512,32005,768,128,32,128,2,8,8,0.9535679817199707
512,32005,768,128,32,128,3,4,8,1.168063998222351
512,32005,768,128,64,128,3,4,8,4.226687908172607
512,32005,768,128,64,128,5,8,8,0.8015679717063904
SAME
--------------------
50265,2048,1024,32,16,32,1,2,8,2.573823928833008
50265,2048,1024,32,128,32,2,4,8,1.4293440580368042
50265,2048,1024,32,32,64,5,8,8,1.7124160528182983
50265,2048,1024,64,32,32,5,8,8,1.4916479587554932
50265,2048,1024,64,128,32,5,4,8,0.9852160215377808
50265,2048,1024,64,16,64,2,4,8,0.8607040047645569
50265,2048,1024,64,32,64,2,4,8,0.6457920074462891
50265,2048,1024,64,64,64,3,8,8,0.6127359867095947
50265,2048,1024,64,128,64,5,4,8,0.6054720282554626
50265,2048,1024,64,32,128,3,4,8,0.48444798588752747
50265,2048,1024,64,32,128,4,8,8,0.5011839866638184
50265,2048,1024,64,64,128,3,4,8,0.4558719992637634
50265,2048,1024,64,128,128,4,4,8,0.4689599871635437
50265,2048,1024,128,32,64,3,4,8,0.5340160131454468
50265,2048,1024,128,32,64,4,8,8,0.5199999809265137
50265,2048,1024,128,32,128,2,8,8,0.5975679755210876
50265,2048,1024,128,32,128,3,4,8,0.4104959964752197
50265,2048,1024,128,64,128,3,4,8,0.3632639944553375
50265,2048,1024,128,64,128,5,8,8,0.38675200939178467
SAME
--------------------
256,32768,256,32,16,32,1,2,8,1.0257600545883179
256,32768,256,32,128,32,2,4,8,0.23951999843120575
256,32768,256,32,32,64,5,8,8,0.19574399292469025
256,32768,256,64,32,32,5,8,8,0.20268799364566803
256,32768,256,64,128,32,5,4,8,0.08912000060081482
256,32768,256,64,16,64,2,4,8,1.182144045829773
256,32768,256,64,32,64,2,4,8,0.6604160070419312
256,32768,256,64,64,64,3,8,8,0.20396800339221954
256,32768,256,64,128,64,5,4,8,0.09142400324344635
256,32768,256,64,32,128,3,4,8,0.3543039858341217
256,32768,256,64,32,128,4,8,8,0.2512640058994293
256,32768,256,64,64,128,3,4,8,0.20265600085258484
256,32768,256,64,128,128,4,4,8,0.11078400164842606
256,32768,256,128,32,64,3,4,8,0.3754560053348541
256,32768,256,128,32,64,4,8,8,0.2596159875392914
256,32768,256,128,32,128,2,8,8,0.7528640031814575
256,32768,256,128,32,128,3,4,8,0.3912320137023926
256,32768,256,128,64,128,3,4,8,0.21804800629615784
256,32768,256,128,64,128,5,8,8,0.16512000560760498
SAME
--------------------
8192,3072,768,32,16,32,1,2,8,0.48473599553108215
8192,3072,768,32,128,32,2,4,8,0.25148800015449524
8192,3072,768,32,32,64,5,8,8,0.32287999987602234
8192,3072,768,64,32,32,5,8,8,0.27584001421928406
8192,3072,768,64,128,32,5,4,8,0.18617600202560425
8192,3072,768,64,16,64,2,4,8,0.23692800104618073
8192,3072,768,64,32,64,2,4,8,0.14815999567508698
8192,3072,768,64,64,64,3,8,8,0.11414399743080139
8192,3072,768,64,128,64,5,4,8,0.11497599631547928
8192,3072,768,64,32,128,3,4,8,0.11417599767446518
8192,3072,768,64,32,128,4,8,8,0.10911999642848969
8192,3072,768,64,64,128,3,4,8,0.08966399729251862
8192,3072,768,64,128,128,4,4,8,0.10556799918413162
8192,3072,768,128,32,64,3,4,8,0.11388800293207169
8192,3072,768,128,32,64,4,8,8,0.1130559965968132
8192,3072,768,128,32,128,2,8,8,0.16147199273109436
8192,3072,768,128,32,128,3,4,8,0.08777599781751633
8192,3072,768,128,64,128,3,4,8,0.09955199807882309
8192,3072,768,128,64,128,5,8,8,0.08835200220346451
SAME
--------------------
1024,1024,1024,32,16,32,1,2,8,0.0522879995405674
1024,1024,1024,32,128,32,2,4,8,0.035840000957250595
1024,1024,1024,32,32,64,5,8,8,0.036159999668598175
1024,1024,1024,64,32,32,5,8,8,0.034432001411914825
1024,1024,1024,64,128,32,5,4,8,0.03152000159025192
1024,1024,1024,64,16,64,2,4,8,0.05459199845790863
1024,1024,1024,64,32,64,2,4,8,0.0379519984126091
1024,1024,1024,64,64,64,3,8,8,0.025536000728607178
1024,1024,1024,64,128,64,5,4,8,0.025087999179959297
1024,1024,1024,64,32,128,3,4,8,0.028672000393271446
1024,1024,1024,64,32,128,4,8,8,0.026559999212622643
1024,1024,1024,64,64,128,3,4,8,0.02630399912595749
1024,1024,1024,64,128,128,4,4,8,0.025696000084280968
1024,1024,1024,128,32,64,3,4,8,0.03219199925661087
1024,1024,1024,128,32,64,4,8,8,0.02659199945628643
1024,1024,1024,128,32,128,2,8,8,0.04076800122857094
1024,1024,1024,128,32,128,3,4,8,0.033215999603271484
1024,1024,1024,128,64,128,3,4,8,0.029632000252604485
1024,1024,1024,128,64,128,5,8,8,0.02566399984061718
SAME
--------------------
512,128100,1536,32,16,32,1,2,8,7.430912017822266
512,128100,1536,32,128,32,2,4,8,2.167840003967285
512,128100,1536,32,32,64,5,8,8,1.7379519939422607
512,128100,1536,64,32,32,5,8,8,2.4092159271240234
512,128100,1536,64,128,32,5,4,8,1.4831360578536987
512,128100,1536,64,16,64,2,4,8,4.754144191741943
512,128100,1536,64,32,64,2,4,8,2.587552070617676
512,128100,1536,64,64,64,3,8,8,1.2863680124282837
512,128100,1536,64,128,64,5,4,8,1.0669440031051636
512,128100,1536,64,32,128,3,4,8,1.4188799858093262
512,128100,1536,64,32,128,4,8,8,1.0513919591903687
512,128100,1536,64,64,128,3,4,8,0.9196159839630127
512,128100,1536,64,128,128,4,4,8,0.7429119944572449
512,128100,1536,128,32,64,3,4,8,1.503775954246521
512,128100,1536,128,32,64,4,8,8,1.108031988143921
512,128100,1536,128,32,128,2,8,8,3.0166399478912354
512,128100,1536,128,32,128,3,4,8,1.5909759998321533
512,128100,1536,128,64,128,3,4,8,1.420799970626831
512,128100,1536,128,64,128,5,8,8,1.3747199773788452
SAME
--------------------
512,1024,256,32,16,32,1,2,8,0.047839999198913574
512,1024,256,32,128,32,2,4,8,0.024512000381946564
512,1024,256,32,32,64,5,8,8,0.024607999250292778
512,1024,256,64,32,32,5,8,8,0.024383999407291412
512,1024,256,64,128,32,5,4,8,0.02412799932062626
512,1024,256,64,16,64,2,4,8,0.05084799975156784
512,1024,256,64,32,64,2,4,8,0.03500799834728241
512,1024,256,64,64,64,3,8,8,0.02473600022494793
512,1024,256,64,128,64,5,4,8,0.024320000782608986
512,1024,256,64,32,128,3,4,8,0.027327999472618103
512,1024,256,64,32,128,4,8,8,0.024671999737620354
512,1024,256,64,64,128,3,4,8,0.024288000538945198
512,1024,256,64,128,128,4,4,8,0.02486399933695793
512,1024,256,128,32,64,3,4,8,0.030271999537944794
512,1024,256,128,32,64,4,8,8,0.025151999667286873
512,1024,256,128,32,128,2,8,8,0.038816001266241074
512,1024,256,128,32,128,3,4,8,0.03283200040459633
512,1024,256,128,64,128,3,4,8,0.02921600081026554
512,1024,256,128,64,128,5,8,8,0.025119999423623085
SAME
--------------------
1024,256,1024,32,16,32,1,2,8,0.025887999683618546
1024,256,1024,32,128,32,2,4,8,0.024512000381946564
1024,256,1024,32,32,64,5,8,8,0.023711999878287315
1024,256,1024,64,32,32,5,8,8,0.023871999233961105
1024,256,1024,64,128,32,5,4,8,0.024288000538945198
1024,256,1024,64,16,64,2,4,8,0.025599999353289604
1024,256,1024,64,32,64,2,4,8,0.02364799939095974
1024,256,1024,64,64,64,3,8,8,0.023711999878287315
1024,256,1024,64,128,64,5,4,8,0.02425600029528141
1024,256,1024,64,32,128,3,4,8,0.024032000452280045
1024,256,1024,64,32,128,4,8,8,0.024159999564290047
1024,256,1024,64,64,128,3,4,8,0.02393599972128868
1024,256,1024,64,128,128,4,4,8,0.02412799932062626
1024,256,1024,128,32,64,3,4,8,0.024159999564290047
1024,256,1024,128,32,64,4,8,8,0.024512000381946564
1024,256,1024,128,32,128,2,8,8,0.024351999163627625
1024,256,1024,128,32,128,3,4,8,0.02332800067961216
1024,256,1024,128,64,128,3,4,8,0.023903999477624893
1024,256,1024,128,64,128,5,8,8,0.024064000695943832
SAME
--------------------
8192,128,2048,32,16,32,1,2,8,0.08022399991750717
8192,128,2048,32,128,32,2,4,8,0.07097599655389786
8192,128,2048,32,32,64,5,8,8,0.07052800059318542
8192,128,2048,64,32,32,5,8,8,0.06963200122117996
8192,128,2048,64,128,32,5,4,8,0.05398400127887726
8192,128,2048,64,16,64,2,4,8,0.04403200000524521
8192,128,2048,64,32,64,2,4,8,0.03996799886226654
8192,128,2048,64,64,64,3,8,8,0.042527999728918076
8192,128,2048,64,128,64,5,4,8,0.04265600070357323
8192,128,2048,64,32,128,3,4,8,0.036031998693943024
8192,128,2048,64,32,128,4,8,8,0.03811199963092804
8192,128,2048,64,64,128,3,4,8,0.037856001406908035
8192,128,2048,64,128,128,4,4,8,0.04022400081157684
8192,128,2048,128,32,64,3,4,8,0.037376001477241516
8192,128,2048,128,32,64,4,8,8,0.0387520007789135
8192,128,2048,128,32,128,2,8,8,0.03948799893260002
8192,128,2048,128,32,128,3,4,8,0.035551998764276505
8192,128,2048,128,64,128,3,4,8,0.03753599897027016
8192,128,2048,128,64,128,5,8,8,0.041919998824596405
SAME
--------------------
8192,10000,256,32,16,32,1,2,8,0.4716480076313019
8192,10000,256,32,128,32,2,4,8,0.328000009059906
8192,10000,256,32,32,64,5,8,8,0.3473280072212219
8192,10000,256,64,32,32,5,8,8,0.3178560137748718
8192,10000,256,64,128,32,5,4,8,0.2298240065574646
8192,10000,256,64,16,64,2,4,8,0.41286399960517883
8192,10000,256,64,32,64,2,4,8,0.25808000564575195
8192,10000,256,64,64,64,3,8,8,0.1558080017566681
8192,10000,256,64,128,64,5,4,8,0.15744000673294067
8192,10000,256,64,32,128,3,4,8,0.1759680062532425
8192,10000,256,64,32,128,4,8,8,0.14963200688362122
8192,10000,256,64,64,128,3,4,8,0.12691199779510498
8192,10000,256,64,128,128,4,4,8,0.12643200159072876
8192,10000,256,128,32,64,3,4,8,0.17849600315093994
8192,10000,256,128,32,64,4,8,8,0.1528639942407608
8192,10000,256,128,32,128,2,8,8,0.2836480140686035
8192,10000,256,128,32,128,3,4,8,0.18464000523090363
8192,10000,256,128,64,128,3,4,8,0.12915199995040894
8192,10000,256,128,64,128,5,8,8,0.12403199821710587
SAME
--------------------
384,512,768,32,16,32,1,2,8,0.03372799977660179
384,512,768,32,128,32,2,4,8,0.025439999997615814
384,512,768,32,32,64,5,8,8,0.024992000311613083
384,512,768,64,32,32,5,8,8,0.02579200081527233
384,512,768,64,128,32,5,4,8,0.024480000138282776
384,512,768,64,16,64,2,4,8,0.03551999852061272
384,512,768,64,32,64,2,4,8,0.02659199945628643
384,512,768,64,64,64,3,8,8,0.02393599972128868
384,512,768,64,128,64,5,4,8,0.024800000712275505
384,512,768,64,32,128,3,4,8,0.024032000452280045
384,512,768,64,32,128,4,8,8,0.02425600029528141
384,512,768,64,64,128,3,4,8,0.023744000121951103
384,512,768,64,128,128,4,4,8,0.02454400062561035
384,512,768,128,32,64,3,4,8,0.02470399998128414
384,512,768,128,32,64,4,8,8,0.024512000381946564
384,512,768,128,32,128,2,8,8,0.027775999158620834
384,512,768,128,32,128,3,4,8,0.02521600015461445
384,512,768,128,64,128,3,4,8,0.024351999163627625
384,512,768,128,64,128,5,8,8,0.024480000138282776
SAME
--------------------
4096,1024,128,32,16,32,1,2,8,0.049247998744249344
4096,1024,128,32,128,32,2,4,8,0.02800000086426735
4096,1024,128,32,32,64,5,8,8,0.027295999228954315
4096,1024,128,64,32,32,5,8,8,0.027135999873280525
4096,1024,128,64,128,32,5,4,8,0.026688000187277794
4096,1024,128,64,16,64,2,4,8,0.0530879981815815
4096,1024,128,64,32,64,2,4,8,0.03961599990725517
4096,1024,128,64,64,64,3,8,8,0.026847999542951584
4096,1024,128,64,128,64,5,4,8,0.02611199952661991
4096,1024,128,64,32,128,3,4,8,0.03200000151991844
4096,1024,128,64,32,128,4,8,8,0.029440000653266907
4096,1024,128,64,64,128,3,4,8,0.027583999559283257
4096,1024,128,64,128,128,4,4,8,0.02672000043094158
4096,1024,128,128,32,64,3,4,8,0.03500799834728241
4096,1024,128,128,32,64,4,8,8,0.02956799976527691
4096,1024,128,128,32,128,2,8,8,0.04259200021624565
4096,1024,128,128,32,128,3,4,8,0.036448001861572266
4096,1024,128,128,64,128,3,4,8,0.031647998839616776
4096,1024,128,128,64,128,5,8,8,0.02672000043094158
SAME
--------------------
1024,1024,4096,32,16,32,1,2,8,0.11443199962377548
1024,1024,4096,32,128,32,2,4,8,0.07648000121116638
1024,1024,4096,32,32,64,5,8,8,0.0923520028591156
1024,1024,4096,64,32,32,5,8,8,0.08422400057315826
1024,1024,4096,64,128,32,5,4,8,0.07011199742555618
1024,1024,4096,64,16,64,2,4,8,0.06137600168585777
1024,1024,4096,64,32,64,2,4,8,0.04281599819660187
1024,1024,4096,64,64,64,3,8,8,0.040352001786231995
1024,1024,4096,64,128,64,5,4,8,0.04931199923157692
1024,1024,4096,64,32,128,3,4,8,0.03363199904561043
1024,1024,4096,64,32,128,4,8,8,0.033055998384952545
1024,1024,4096,64,64,128,3,4,8,0.0379519984126091
1024,1024,4096,64,128,128,4,4,8,0.04092799872159958
1024,1024,4096,128,32,64,3,4,8,0.03686400130391121
1024,1024,4096,128,32,64,4,8,8,0.036639999598264694
1024,1024,4096,128,32,128,2,8,8,0.04444799944758415
1024,1024,4096,128,32,128,3,4,8,0.037087999284267426
1024,1024,4096,128,64,128,3,4,8,0.033695999532938004
1024,1024,4096,128,64,128,5,8,8,0.03417599946260452
SAME
--------------------
1024,256,4096,32,16,32,1,2,8,0.046560000628232956
1024,256,4096,32,128,32,2,4,8,0.03622400015592575
1024,256,4096,32,32,64,5,8,8,0.03872000053524971
1024,256,4096,64,32,32,5,8,8,0.03827200084924698
1024,256,4096,64,128,32,5,4,8,0.04630399867892265
1024,256,4096,64,16,64,2,4,8,0.02956799976527691
1024,256,4096,64,32,64,2,4,8,0.02768000029027462
1024,256,4096,64,64,64,3,8,8,0.02659199945628643
1024,256,4096,64,128,64,5,4,8,0.034591998904943466
1024,256,4096,64,32,128,3,4,8,0.02630399912595749
1024,256,4096,64,32,128,4,8,8,0.02550400048494339
1024,256,4096,64,64,128,3,4,8,0.026784000918269157
1024,256,4096,64,128,128,4,4,8,0.02908799983561039
1024,256,4096,128,32,64,3,4,8,0.02691200003027916
1024,256,4096,128,32,64,4,8,8,0.026655999943614006
1024,256,4096,128,32,128,2,8,8,0.025760000571608543
1024,256,4096,128,32,128,3,4,8,0.026367999613285065
1024,256,4096,128,64,128,3,4,8,0.02611199952661991
1024,256,4096,128,64,128,5,8,8,0.025439999997615814
SAME
--------------------
4096,128,128,32,16,32,1,2,8,0.024960000067949295
4096,128,128,32,128,32,2,4,8,0.02598400041460991
4096,128,128,32,32,64,5,8,8,0.024960000067949295
4096,128,128,64,32,32,5,8,8,0.0244159996509552
4096,128,128,64,128,32,5,4,8,0.02518399991095066
4096,128,128,64,16,64,2,4,8,0.02489599958062172
4096,128,128,64,32,64,2,4,8,0.025919999927282333
4096,128,128,64,64,64,3,8,8,0.025696000084280968
4096,128,128,64,128,64,5,4,8,0.025631999596953392
4096,128,128,64,32,128,3,4,8,0.02582399919629097
4096,128,128,64,32,128,4,8,8,0.024032000452280045
4096,128,128,64,64,128,3,4,8,0.02550400048494339
4096,128,128,64,128,128,4,4,8,0.025407999753952026
4096,128,128,128,32,64,3,4,8,0.02409599907696247
4096,128,128,128,32,64,4,8,8,0.024800000712275505
4096,128,128,128,32,128,2,8,8,0.024320000782608986
4096,128,128,128,32,128,3,4,8,0.02409599907696247
4096,128,128,128,64,128,3,4,8,0.02409599907696247
4096,128,128,128,64,128,5,8,8,0.02380800060927868
SAME
--------------------
128,2,2048,32,16,32,1,2,8,0.024607999250292778
128,2,2048,32,16,32,2,4,8,0.02518399991095066
128,2,2048,32,16,64,5,8,8,0.025407999753952026
128,2,2048,64,16,32,5,8,8,0.024000000208616257
128,2,2048,64,16,32,5,4,8,0.024064000695943832
128,2,2048,64,16,64,2,4,8,0.023391999304294586
128,2,2048,64,16,64,3,8,8,0.02425600029528141
128,2,2048,64,16,64,5,4,8,0.023296000435948372
128,2,2048,64,16,128,3,4,8,0.024288000538945198
128,2,2048,64,16,128,4,8,8,0.024383999407291412
128,2,2048,64,16,128,4,4,8,0.025599999353289604
128,2,2048,128,16,64,3,4,8,0.02534399926662445
128,2,2048,128,16,64,4,8,8,0.023584000766277313
128,2,2048,128,16,128,2,8,8,0.023135999217629433
128,2,2048,128,16,128,3,4,8,0.0244159996509552
128,2,2048,128,16,128,5,8,8,0.02550400048494339
SAME
--------------------
2304,2048,768,32,16,32,1,2,8,0.11139199882745743
2304,2048,768,32,128,32,2,4,8,0.06694400310516357
2304,2048,768,32,32,64,5,8,8,0.081216000020504
2304,2048,768,64,32,32,5,8,8,0.07152000069618225
2304,2048,768,64,128,32,5,4,8,0.0551999993622303
2304,2048,768,64,16,64,2,4,8,0.09379199892282486
2304,2048,768,64,32,64,2,4,8,0.06358399987220764
2304,2048,768,64,64,64,3,8,8,0.03619199991226196
2304,2048,768,64,128,64,5,4,8,0.04243199899792671
2304,2048,768,64,32,128,3,4,8,0.04556800052523613
2304,2048,768,64,32,128,4,8,8,0.03936000168323517
2304,2048,768,64,64,128,3,4,8,0.03558399900794029
2304,2048,768,64,128,128,4,4,8,0.03766399994492531
2304,2048,768,128,32,64,3,4,8,0.04665600135922432
2304,2048,768,128,32,64,4,8,8,0.039103999733924866
2304,2048,768,128,32,128,2,8,8,0.06889600306749344
2304,2048,768,128,32,128,3,4,8,0.047807998955249786
2304,2048,768,128,64,128,3,4,8,0.036031998693943024
2304,2048,768,128,64,128,5,8,8,0.03251200169324875
SAME
--------------------
1024,768,3072,32,16,32,1,2,8,0.08348800241947174
1024,768,3072,32,128,32,2,4,8,0.052032001316547394
1024,768,3072,32,32,64,5,8,8,0.05942400172352791
1024,768,3072,64,32,32,5,8,8,0.05475199967622757
1024,768,3072,64,128,32,5,4,8,0.05161599814891815
1024,768,3072,64,16,64,2,4,8,0.047520000487565994
1024,768,3072,64,32,64,2,4,8,0.03488000109791756
1024,768,3072,64,64,64,3,8,8,0.03167999908328056
1024,768,3072,64,128,64,5,4,8,0.03721600025892258
1024,768,3072,64,32,128,3,4,8,0.028095999732613564
1024,768,3072,64,32,128,4,8,8,0.02691200003027916
1024,768,3072,64,64,128,3,4,8,0.025536000728607178
1024,768,3072,64,128,128,4,4,8,0.03139200061559677
1024,768,3072,128,32,64,3,4,8,0.03033600002527237
1024,768,3072,128,32,64,4,8,8,0.027807999402284622
1024,768,3072,128,32,128,2,8,8,0.0363520011305809
1024,768,3072,128,32,128,3,4,8,0.03190400078892708
1024,768,3072,128,64,128,3,4,8,0.02844800055027008
1024,768,3072,128,64,128,5,8,8,0.0306560005992651
SAME
--------------------
1024,16384,4096,32,16,32,1,2,8,1.7408959865570068
1024,16384,4096,32,128,32,2,4,8,0.9011200070381165
1024,16384,4096,32,32,64,5,8,8,1.118656039237976
1024,16384,4096,64,32,32,5,8,8,0.9811519980430603
1024,16384,4096,64,128,32,5,4,8,0.6087679862976074
1024,16384,4096,64,16,64,2,4,8,0.6524159908294678
1024,16384,4096,64,32,64,2,4,8,0.3829120099544525
1024,16384,4096,64,64,64,3,8,8,0.4326080083847046
1024,16384,4096,64,128,64,5,4,8,0.36243200302124023
1024,16384,4096,64,32,128,3,4,8,0.25699201226234436
1024,16384,4096,64,32,128,4,8,8,0.326911985874176
1024,16384,4096,64,64,128,3,4,8,0.2905920147895813
1024,16384,4096,64,128,128,4,4,8,0.2847039997577667
1024,16384,4096,128,32,64,3,4,8,0.31279999017715454
1024,16384,4096,128,32,64,4,8,8,0.3391680121421814
1024,16384,4096,128,32,128,2,8,8,0.39904001355171204
1024,16384,4096,128,32,128,3,4,8,0.24291199445724487
1024,16384,4096,128,64,128,3,4,8,0.2157759964466095
1024,16384,4096,128,64,128,5,8,8,0.2279359996318817
SAME
--------------------
2,128,2048,16,16,32,1,2,8,0.024639999493956566
2,128,2048,16,128,32,2,2,8,0.02380800060927868
2,128,2048,16,32,64,5,4,8,0.024351999163627625
2,128,2048,16,32,32,5,2,8,0.024064000695943832
2,128,2048,16,128,32,5,2,8,0.023455999791622162
2,128,2048,16,16,64,2,4,8,0.02454400062561035
2,128,2048,16,32,64,2,4,8,0.023903999477624893
2,128,2048,16,64,64,3,4,8,0.023903999477624893
2,128,2048,16,128,64,5,4,8,0.02393599972128868
2,128,2048,16,32,128,3,4,8,0.023679999634623528
2,128,2048,16,32,128,4,8,8,0.02380800060927868
2,128,2048,16,64,128,3,4,8,0.025119999423623085
2,128,2048,16,128,128,4,4,8,0.024288000538945198
2,128,2048,16,32,64,3,4,8,0.024000000208616257
2,128,2048,16,32,64,4,4,8,0.024607999250292778
2,128,2048,16,32,128,2,8,8,0.023711999878287315
2,128,2048,16,64,128,5,8,8,0.024032000452280045
SAME
--------------------
1536,512,1536,32,16,32,1,2,8,0.04838399961590767
1536,512,1536,32,128,32,2,4,8,0.03651199862360954
1536,512,1536,32,32,64,5,8,8,0.039455998688936234
1536,512,1536,64,32,32,5,8,8,0.037408001720905304
1536,512,1536,64,128,32,5,4,8,0.03916800022125244
1536,512,1536,64,16,64,2,4,8,0.03612799942493439
1536,512,1536,64,32,64,2,4,8,0.02828799933195114
1536,512,1536,64,64,64,3,8,8,0.02643200010061264
1536,512,1536,64,128,64,5,4,8,0.030079999938607216
1536,512,1536,64,32,128,3,4,8,0.02582399919629097
1536,512,1536,64,32,128,4,8,8,0.024927999824285507
1536,512,1536,64,64,128,3,4,8,0.02502400055527687
1536,512,1536,64,128,128,4,4,8,0.027424000203609467
1536,512,1536,128,32,64,3,4,8,0.026688000187277794
1536,512,1536,128,32,64,4,8,8,0.02412799932062626
1536,512,1536,128,32,128,2,8,8,0.030112000182271004
1536,512,1536,128,32,128,3,4,8,0.026623999699950218
1536,512,1536,128,64,128,3,4,8,0.025919999927282333
1536,512,1536,128,64,128,5,8,8,0.026335999369621277
SAME
--------------------
256,32768,1024,32,16,32,1,2,8,1.0925439596176147
256,32768,1024,32,128,32,2,4,8,0.2535359859466553
256,32768,1024,32,32,64,5,8,8,0.20121599733829498
256,32768,1024,64,32,32,5,8,8,0.20640000700950623
256,32768,1024,64,128,32,5,4,8,0.09948799759149551
256,32768,1024,64,16,64,2,4,8,1.1785600185394287
256,32768,1024,64,32,64,2,4,8,0.6510400176048279
256,32768,1024,64,64,64,3,8,8,0.21315200626850128
256,32768,1024,64,128,64,5,4,8,0.09961599856615067
256,32768,1024,64,32,128,3,4,8,0.3543680012226105
256,32768,1024,64,32,128,4,8,8,0.2579520046710968
256,32768,1024,64,64,128,3,4,8,0.2115519940853119
256,32768,1024,64,128,128,4,4,8,0.11334399878978729
256,32768,1024,128,32,64,3,4,8,0.3782080113887787
256,32768,1024,128,32,64,4,8,8,0.2686080038547516
256,32768,1024,128,32,128,2,8,8,0.7450559735298157
256,32768,1024,128,32,128,3,4,8,0.3898879885673523
256,32768,1024,128,64,128,3,4,8,0.2287680059671402
256,32768,1024,128,64,128,5,8,8,0.16150400042533875
SAME
--------------------
4096,256,1024,32,16,32,1,2,8,0.047168001532554626
4096,256,1024,32,128,32,2,4,8,0.03596799820661545
4096,256,1024,32,32,64,5,8,8,0.03903999924659729
4096,256,1024,64,32,32,5,8,8,0.03920000046491623
4096,256,1024,64,128,32,5,4,8,0.04566400125622749
4096,256,1024,64,16,64,2,4,8,0.029664000496268272
4096,256,1024,64,32,64,2,4,8,0.02643200010061264
4096,256,1024,64,64,64,3,8,8,0.02703999914228916
4096,256,1024,64,128,64,5,4,8,0.03577600046992302
4096,256,1024,64,32,128,3,4,8,0.02672000043094158
4096,256,1024,64,32,128,4,8,8,0.026016000658273697
4096,256,1024,64,64,128,3,4,8,0.026623999699950218
4096,256,1024,64,128,128,4,4,8,0.028416000306606293
4096,256,1024,128,32,64,3,4,8,0.025472000241279602
4096,256,1024,128,32,64,4,8,8,0.02566399984061718
4096,256,1024,128,32,128,2,8,8,0.0261439997702837
4096,256,1024,128,32,128,3,4,8,0.02598400041460991
4096,256,1024,128,64,128,3,4,8,0.02627200074493885
4096,256,1024,128,64,128,5,8,8,0.026016000658273697
SAME
--------------------
512,2048,30522,32,16,32,1,2,8,0.8324800133705139
512,2048,30522,32,128,32,2,4,8,0.6194559931755066
512,2048,30522,32,32,64,5,8,8,0.658847987651825
512,2048,30522,64,32,32,5,8,8,0.5017600059509277
512,2048,30522,64,128,32,5,4,8,0.5878080129623413
512,2048,30522,64,16,64,2,4,8,0.3900800049304962
512,2048,30522,64,32,64,2,4,8,0.2871359884738922
512,2048,30522,64,64,64,3,8,8,0.4291520118713379
512,2048,30522,64,128,64,5,4,8,0.43196800351142883
512,2048,30522,64,32,128,3,4,8,0.23734399676322937
512,2048,30522,64,32,128,4,8,8,0.26630398631095886
512,2048,30522,64,64,128,3,4,8,0.2497279942035675
512,2048,30522,64,128,128,4,4,8,0.3457599878311157
512,2048,30522,128,32,64,3,4,8,0.21062399446964264
512,2048,30522,128,32,64,4,8,8,0.2242880016565323
512,2048,30522,128,32,128,2,8,8,0.25251200795173645
512,2048,30522,128,32,128,3,4,8,0.17955200374126434
512,2048,30522,128,64,128,3,4,8,0.1847040057182312
512,2048,30522,128,64,128,5,8,8,0.22012799978256226
SAME
--------------------
1024,50005,768,32,16,32,1,2,8,2.9779839515686035
1024,50005,768,32,128,32,2,4,8,0.9392960071563721
1024,50005,768,32,32,64,5,8,8,1.0639679431915283
1024,50005,768,64,32,32,5,8,8,1.796447992324829
1024,50005,768,64,128,32,5,4,8,1.5708160400390625
1024,50005,768,64,16,64,2,4,8,1.9993280172348022
1024,50005,768,64,32,64,2,4,8,1.161087989807129
1024,50005,768,64,64,64,3,8,8,0.909600019454956
1024,50005,768,64,128,64,5,4,8,0.9338880181312561
1024,50005,768,64,32,128,3,4,8,1.2249599695205688
1024,50005,768,64,32,128,4,8,8,1.220960021018982
1024,50005,768,64,64,128,3,4,8,0.827072024345398
1024,50005,768,64,128,128,4,4,8,0.9816960096359253
1024,50005,768,128,32,64,3,4,8,1.403264045715332
1024,50005,768,128,32,64,4,8,8,1.3509759902954102
1024,50005,768,128,32,128,2,8,8,1.4475200176239014
1024,50005,768,128,32,128,3,4,8,1.7802239656448364
1024,50005,768,128,64,128,3,4,8,6.5641279220581055
1024,50005,768,128,64,128,5,8,8,1.2302080392837524
SAME
--------------------
8192,256,256,32,16,32,1,2,8,0.03283200040459633
8192,256,256,32,128,32,2,4,8,0.027744000777602196
8192,256,256,32,32,64,5,8,8,0.029055999591946602
8192,256,256,64,32,32,5,8,8,0.027871999889612198
8192,256,256,64,128,32,5,4,8,0.0315839983522892
8192,256,256,64,16,64,2,4,8,0.027807999402284622
8192,256,256,64,32,64,2,4,8,0.02566399984061718
8192,256,256,64,64,64,3,8,8,0.02537599951028824
8192,256,256,64,128,64,5,4,8,0.026399999856948853
8192,256,256,64,32,128,3,4,8,0.026079999282956123
8192,256,256,64,32,128,4,8,8,0.02489599958062172
8192,256,256,64,64,128,3,4,8,0.02489599958062172
8192,256,256,64,128,128,4,4,8,0.025696000084280968
8192,256,256,128,32,64,3,4,8,0.024512000381946564
8192,256,256,128,32,64,4,8,8,0.02457600086927414
8192,256,256,128,32,128,2,8,8,0.02521600015461445
8192,256,256,128,32,128,3,4,8,0.024960000067949295
8192,256,256,128,64,128,3,4,8,0.02489599958062172
8192,256,256,128,64,128,5,8,8,0.024831999093294144
SAME
--------------------
4096,128,512,32,16,32,1,2,8,0.026623999699950218
4096,128,512,32,128,32,2,4,8,0.024447999894618988
4096,128,512,32,32,64,5,8,8,0.024351999163627625
4096,128,512,64,32,32,5,8,8,0.025151999667286873
4096,128,512,64,128,32,5,4,8,0.025248000398278236
4096,128,512,64,16,64,2,4,8,0.024320000782608986
4096,128,512,64,32,64,2,4,8,0.02470399998128414
4096,128,512,64,64,64,3,8,8,0.023552000522613525
4096,128,512,64,128,64,5,4,8,0.023871999233961105
4096,128,512,64,32,128,3,4,8,0.023520000278949738
4096,128,512,64,32,128,4,8,8,0.02425600029528141
4096,128,512,64,64,128,3,4,8,0.02380800060927868
4096,128,512,64,128,128,4,4,8,0.023584000766277313
4096,128,512,128,32,64,3,4,8,0.024383999407291412
4096,128,512,128,32,64,4,8,8,0.023072000592947006
4096,128,512,128,32,128,2,8,8,0.024480000138282776
4096,128,512,128,32,128,3,4,8,0.024064000695943832
4096,128,512,128,64,128,3,4,8,0.02396799996495247
4096,128,512,128,64,128,5,8,8,0.024191999807953835
SAME
--------------------
768,1024,768,32,16,32,1,2,8,0.05049600079655647
768,1024,768,32,128,32,2,4,8,0.02816000021994114
768,1024,768,32,32,64,5,8,8,0.031199999153614044
768,1024,768,64,32,32,5,8,8,0.02864000014960766
768,1024,768,64,128,32,5,4,8,0.02675200067460537
768,1024,768,64,16,64,2,4,8,0.05206400156021118
768,1024,768,64,32,64,2,4,8,0.03622400015592575
768,1024,768,64,64,64,3,8,8,0.025119999423623085
768,1024,768,64,128,64,5,4,8,0.02582399919629097
768,1024,768,64,32,128,3,4,8,0.027936000376939774
768,1024,768,64,32,128,4,8,8,0.024800000712275505
768,1024,768,64,64,128,3,4,8,0.025728000327944756
768,1024,768,64,128,128,4,4,8,0.025599999353289604
768,1024,768,128,32,64,3,4,8,0.03136000037193298
768,1024,768,128,32,64,4,8,8,0.025599999353289604
768,1024,768,128,32,128,2,8,8,0.039264000952243805
768,1024,768,128,32,128,3,4,8,0.0331839993596077
768,1024,768,128,64,128,3,4,8,0.028543999418616295
768,1024,768,128,64,128,5,8,8,0.026335999369621277
SAME
--------------------
1024,128,4096,32,16,32,1,2,8,0.0331839993596077
1024,128,4096,32,128,32,2,4,8,0.030848000198602676
1024,128,4096,32,32,64,5,8,8,0.02985600009560585
1024,128,4096,64,32,32,5,8,8,0.030751999467611313
1024,128,4096,64,128,32,5,4,8,0.027135999873280525
1024,128,4096,64,16,64,2,4,8,0.026623999699950218
1024,128,4096,64,32,64,2,4,8,0.026784000918269157
1024,128,4096,64,64,64,3,8,8,0.025760000571608543
1024,128,4096,64,128,64,5,4,8,0.03587200120091438
1024,128,4096,64,32,128,3,4,8,0.026688000187277794
1024,128,4096,64,32,128,4,8,8,0.024992000311613083
1024,128,4096,64,64,128,3,4,8,0.025312000885605812
1024,128,4096,64,128,128,4,4,8,0.02598400041460991
1024,128,4096,128,32,64,3,4,8,0.023903999477624893
1024,128,4096,128,32,64,4,8,8,0.026016000658273697
1024,128,4096,128,32,128,2,8,8,0.024224000051617622
1024,128,4096,128,32,128,3,4,8,0.02470399998128414
1024,128,4096,128,64,128,3,4,8,0.025536000728607178
1024,128,4096,128,64,128,5,8,8,0.025472000241279602
SAME
--------------------
8192,256,10000,32,16,32,1,2,8,0.5567039847373962
8192,256,10000,32,128,32,2,4,8,0.3601920008659363
8192,256,10000,32,32,64,5,8,8,0.4382399916648865
8192,256,10000,64,32,32,5,8,8,0.38870400190353394
8192,256,10000,64,128,32,5,4,8,0.5124160051345825
8192,256,10000,64,16,64,2,4,8,0.21955199539661407
8192,256,10000,64,32,64,2,4,8,0.16476799547672272
8192,256,10000,64,64,64,3,8,8,0.1903039962053299
8192,256,10000,64,128,64,5,4,8,0.3206399977207184
8192,256,10000,64,32,128,3,4,8,0.13542400300502777
8192,256,10000,64,32,128,4,8,8,0.1590079963207245
8192,256,10000,64,64,128,3,4,8,0.1417279988527298
8192,256,10000,64,128,128,4,4,8,0.22835199534893036
8192,256,10000,128,32,64,3,4,8,0.1443520039319992
8192,256,10000,128,32,64,4,8,8,0.1547199934720993
8192,256,10000,128,32,128,2,8,8,0.16793599724769592
8192,256,10000,128,32,128,3,4,8,0.13411200046539307
8192,256,10000,128,64,128,3,4,8,0.13734400272369385
8192,256,10000,128,64,128,5,8,8,0.16307200491428375
SAME
--------------------
512,768,50272,32,16,32,1,2,8,0.48028799891471863
512,768,50272,32,128,32,2,4,8,0.28409600257873535
512,768,50272,32,32,64,5,8,8,0.3474560081958771
512,768,50272,64,32,32,5,8,8,0.28572800755500793
512,768,50272,64,128,32,5,4,8,0.27395200729370117
512,768,50272,64,16,64,2,4,8,0.2168319970369339
512,768,50272,64,32,64,2,4,8,0.14150400459766388
512,768,50272,64,64,64,3,8,8,0.1345919966697693
512,768,50272,64,128,64,5,4,8,0.16921600699424744
512,768,50272,64,32,128,3,4,8,0.11267200112342834
512,768,50272,64,32,128,4,8,8,0.11670400202274323
512,768,50272,64,64,128,3,4,8,0.11318399757146835
512,768,50272,64,128,128,4,4,8,0.1372160017490387
512,768,50272,128,32,64,3,4,8,0.11283200234174728
512,768,50272,128,32,64,4,8,8,0.11798399686813354
512,768,50272,128,32,128,2,8,8,0.14716799557209015
512,768,50272,128,32,128,3,4,8,0.11190400272607803
512,768,50272,128,64,128,3,4,8,0.11219199746847153
512,768,50272,128,64,128,5,8,8,0.11139199882745743
SAME
--------------------
50265,4096,1024,32,16,32,1,2,8,5.10643196105957
50265,4096,1024,32,128,32,2,4,8,2.7468481063842773
50265,4096,1024,32,32,64,5,8,8,3.3231680393218994
50265,4096,1024,64,32,32,5,8,8,2.937407970428467
50265,4096,1024,64,128,32,5,4,8,1.9932479858398438
50265,4096,1024,64,16,64,2,4,8,1.9460480213165283
50265,4096,1024,64,32,64,2,4,8,1.2392319440841675
50265,4096,1024,64,64,64,3,8,8,1.3148800134658813
50265,4096,1024,64,128,64,5,4,8,1.1597119569778442
50265,4096,1024,64,32,128,3,4,8,0.9665600061416626
50265,4096,1024,64,32,128,4,8,8,1.0205119848251343
50265,4096,1024,64,64,128,3,4,8,0.9200320243835449
50265,4096,1024,64,128,128,4,4,8,0.87254399061203
50265,4096,1024,128,32,64,3,4,8,1.0585919618606567
50265,4096,1024,128,32,64,4,8,8,1.0489599704742432
50265,4096,1024,128,32,128,2,8,8,1.2420159578323364
50265,4096,1024,128,32,128,3,4,8,0.7810879945755005
50265,4096,1024,128,64,128,3,4,8,0.7215999960899353
50265,4096,1024,128,64,128,5,8,8,0.7453759908676147
SAME
--------------------
4096,1024,1024,32,16,32,1,2,8,0.11535999923944473
4096,1024,1024,32,128,32,2,4,8,0.07945600152015686
4096,1024,1024,32,32,64,5,8,8,0.09296000003814697
4096,1024,1024,64,32,32,5,8,8,0.08399999886751175
4096,1024,1024,64,128,32,5,4,8,0.06960000097751617
4096,1024,1024,64,16,64,2,4,8,0.05756799876689911
4096,1024,1024,64,32,64,2,4,8,0.04243199899792671
4096,1024,1024,64,64,64,3,8,8,0.0390079990029335
4096,1024,1024,64,128,64,5,4,8,0.04758400097489357
4096,1024,1024,64,32,128,3,4,8,0.033376000821590424
4096,1024,1024,64,32,128,4,8,8,0.03468799963593483
4096,1024,1024,64,64,128,3,4,8,0.03807999938726425
4096,1024,1024,64,128,128,4,4,8,0.04025600105524063
4096,1024,1024,128,32,64,3,4,8,0.03638400137424469
4096,1024,1024,128,32,64,4,8,8,0.03596799820661545
4096,1024,1024,128,32,128,2,8,8,0.04320000112056732
4096,1024,1024,128,32,128,3,4,8,0.03859199956059456
4096,1024,1024,128,64,128,3,4,8,0.033984001725912094
4096,1024,1024,128,64,128,5,8,8,0.034015998244285583
SAME
--------------------
256,4096,1024,32,16,32,1,2,8,0.142752006649971
256,4096,1024,32,128,32,2,4,8,0.05119999870657921
256,4096,1024,32,32,64,5,8,8,0.04323200136423111
256,4096,1024,64,32,32,5,8,8,0.044863998889923096
256,4096,1024,64,128,32,5,4,8,0.02816000021994114
256,4096,1024,64,16,64,2,4,8,0.1518079936504364
256,4096,1024,64,32,64,2,4,8,0.0990080013871193
256,4096,1024,64,64,64,3,8,8,0.04451199993491173
256,4096,1024,64,128,64,5,4,8,0.027936000376939774
256,4096,1024,64,32,128,3,4,8,0.06332799792289734
256,4096,1024,64,32,128,4,8,8,0.05084799975156784
256,4096,1024,64,64,128,3,4,8,0.04540799930691719
256,4096,1024,64,128,128,4,4,8,0.03139200061559677
256,4096,1024,128,32,64,3,4,8,0.06486400216817856
256,4096,1024,128,32,64,4,8,8,0.051711998879909515
256,4096,1024,128,32,128,2,8,8,0.10652799904346466
256,4096,1024,128,32,128,3,4,8,0.06681600213050842
256,4096,1024,128,64,128,3,4,8,0.048128001391887665
256,4096,1024,128,64,128,5,8,8,0.03827200084924698
SAME
--------------------
256008,256,1024,32,16,32,1,2,8,1.7443519830703735
256008,256,1024,32,128,32,2,4,8,1.1363199949264526
256008,256,1024,32,32,64,5,8,8,1.3648960590362549
256008,256,1024,64,32,32,5,8,8,1.2497279644012451
256008,256,1024,64,128,32,5,4,8,1.6290240287780762
256008,256,1024,64,16,64,2,4,8,0.6674240231513977
256008,256,1024,64,32,64,2,4,8,0.5509759783744812
256008,256,1024,64,64,64,3,8,8,0.5937920212745667
256008,256,1024,64,128,64,5,4,8,0.9828479886054993
256008,256,1024,64,32,128,3,4,8,0.43859198689460754
256008,256,1024,64,32,128,4,8,8,0.4862399995326996
256008,256,1024,64,64,128,3,4,8,0.46031999588012695
256008,256,1024,64,128,128,4,4,8,0.6305279731750488
256008,256,1024,128,32,64,3,4,8,0.4665600061416626
256008,256,1024,128,32,64,4,8,8,0.49775999784469604
256008,256,1024,128,32,128,2,8,8,0.5223680138587952
256008,256,1024,128,32,128,3,4,8,0.42607998847961426
256008,256,1024,128,64,128,3,4,8,0.40409600734710693
256008,256,1024,128,64,128,5,8,8,0.45468801259994507
SAME
--------------------
4096,1024,4096,32,16,32,1,2,8,0.43353599309921265
4096,1024,4096,32,128,32,2,4,8,0.23657600581645966
4096,1024,4096,32,32,64,5,8,8,0.2948159873485565
4096,1024,4096,64,32,32,5,8,8,0.26022401452064514
4096,1024,4096,64,128,32,5,4,8,0.18889600038528442
4096,1024,4096,64,16,64,2,4,8,0.1459520012140274
4096,1024,4096,64,32,64,2,4,8,0.10806400328874588
4096,1024,4096,64,64,64,3,8,8,0.11027199774980545
4096,1024,4096,64,128,64,5,4,8,0.11801599711179733
4096,1024,4096,64,32,128,3,4,8,0.09084799885749817
4096,1024,4096,64,32,128,4,8,8,0.097120001912117
4096,1024,4096,64,64,128,3,4,8,0.08854400366544724
4096,1024,4096,64,128,128,4,4,8,0.10633599758148193
4096,1024,4096,128,32,64,3,4,8,0.0950080007314682
4096,1024,4096,128,32,64,4,8,8,0.10096000134944916
4096,1024,4096,128,32,128,2,8,8,0.09651199728250504
4096,1024,4096,128,32,128,3,4,8,0.08236800134181976
4096,1024,4096,128,64,128,3,4,8,0.08128000050783157
4096,1024,4096,128,64,128,5,8,8,0.07948800176382065
SAME
--------------------
8192,50272,512,32,16,32,1,2,8,4.902815818786621
8192,50272,512,32,128,32,2,4,8,2.9541120529174805
8192,50272,512,32,32,64,5,8,8,3.3769919872283936
8192,50272,512,64,32,32,5,8,8,3.187999963760376
8192,50272,512,64,128,32,5,4,8,2.180191993713379
8192,50272,512,64,16,64,2,4,8,1.9500479698181152
8192,50272,512,64,32,64,2,4,8,1.2910720109939575
8192,50272,512,64,64,64,3,8,8,1.5616960525512695
8192,50272,512,64,128,64,5,4,8,1.4388480186462402
8192,50272,512,64,32,128,3,4,8,0.9766079783439636
8192,50272,512,64,32,128,4,8,8,1.1284159421920776
8192,50272,512,64,64,128,3,4,8,1.0647039413452148
8192,50272,512,64,128,128,4,4,8,0.9910399913787842
8192,50272,512,128,32,64,3,4,8,1.0785280466079712
8192,50272,512,128,32,64,4,8,8,1.232800006866455
8192,50272,512,128,32,128,2,8,8,1.3037439584732056
8192,50272,512,128,32,128,3,4,8,0.9001280069351196
8192,50272,512,128,64,128,3,4,8,0.7533119916915894
8192,50272,512,128,64,128,5,8,8,0.8017280101776123
SAME
--------------------
512,50265,1024,32,16,32,1,2,8,2.970144033432007
512,50265,1024,32,128,32,2,4,8,0.8336640000343323
512,50265,1024,32,32,64,5,8,8,1.0414079427719116
512,50265,1024,64,32,32,5,8,8,1.3587839603424072
512,50265,1024,64,128,32,5,4,8,0.7903040051460266
512,50265,1024,64,16,64,2,4,8,2.0126399993896484
512,50265,1024,64,32,64,2,4,8,1.1656960248947144
512,50265,1024,64,64,64,3,8,8,0.8451840281486511
512,50265,1024,64,128,64,5,4,8,0.9231359958648682
512,50265,1024,64,32,128,3,4,8,1.2341439723968506
512,50265,1024,64,32,128,4,8,8,1.2430399656295776
512,50265,1024,64,64,128,3,4,8,0.8550400137901306
512,50265,1024,64,128,128,4,4,8,0.9695680141448975
512,50265,1024,128,32,64,3,4,8,1.4345279932022095
512,50265,1024,128,32,64,4,8,8,1.378656029701233
512,50265,1024,128,32,128,2,8,8,1.4756159782409668
512,50265,1024,128,32,128,3,4,8,1.8138879537582397
512,50265,1024,128,64,128,3,4,8,6.805215835571289
512,50265,1024,128,64,128,5,8,8,1.2311040163040161
SAME
--------------------
30522,8192,768,32,16,32,1,2,8,4.689631938934326
30522,8192,768,32,128,32,2,4,8,2.4933760166168213
30522,8192,768,32,32,64,5,8,8,3.076767921447754
30522,8192,768,64,32,32,5,8,8,2.6438400745391846
30522,8192,768,64,128,32,5,4,8,1.772704005241394
30522,8192,768,64,16,64,2,4,8,1.899839997291565
30522,8192,768,64,32,64,2,4,8,1.1884479522705078
30522,8192,768,64,64,64,3,8,8,1.1844160556793213
30522,8192,768,64,128,64,5,4,8,1.0263680219650269
30522,8192,768,64,32,128,3,4,8,0.8980159759521484
30522,8192,768,64,32,128,4,8,8,0.9236159920692444
30522,8192,768,64,64,128,3,4,8,0.8356480002403259
30522,8192,768,64,128,128,4,4,8,0.8307520151138306
30522,8192,768,128,32,64,3,4,8,1.005728006362915
30522,8192,768,128,32,64,4,8,8,0.981440007686615
30522,8192,768,128,32,128,2,8,8,1.2103359699249268
30522,8192,768,128,32,128,3,4,8,0.7105600237846375
30522,8192,768,128,64,128,3,4,8,0.6822400093078613
30522,8192,768,128,64,128,5,8,8,0.6872000098228455
SAME
--------------------
768,8192,768,32,16,32,1,2,8,0.28412801027297974
768,8192,768,32,128,32,2,4,8,0.09286399930715561
768,8192,768,32,32,64,5,8,8,0.1167680025100708
768,8192,768,64,32,32,5,8,8,0.11235199868679047
768,8192,768,64,128,32,5,4,8,0.0783040001988411
768,8192,768,64,16,64,2,4,8,0.298911988735199
768,8192,768,64,32,64,2,4,8,0.17683200538158417
768,8192,768,64,64,64,3,8,8,0.07660800218582153
768,8192,768,64,128,64,5,4,8,0.06319999694824219
768,8192,768,64,32,128,3,4,8,0.11241599917411804
768,8192,768,64,32,128,4,8,8,0.08716800063848495
768,8192,768,64,64,128,3,4,8,0.07571200281381607
768,8192,768,64,128,128,4,4,8,0.050783999264240265
768,8192,768,128,32,64,3,4,8,0.11430399864912033
768,8192,768,128,32,64,4,8,8,0.09081599861383438
768,8192,768,128,32,128,2,8,8,0.194240003824234
768,8192,768,128,32,128,3,4,8,0.11318399757146835
768,8192,768,128,64,128,3,4,8,0.08137600123882294
768,8192,768,128,64,128,5,8,8,0.06099199876189232
SAME
--------------------
256,1024,128112,32,16,32,1,2,8,0.8652160167694092
256,1024,128112,32,128,32,2,4,8,0.5024639964103699
256,1024,128112,32,32,64,5,8,8,0.5763199925422668
256,1024,128112,64,32,32,5,8,8,0.49689599871635437
256,1024,128112,64,128,32,5,4,8,0.43327999114990234
256,1024,128112,64,16,64,2,4,8,0.3999679982662201
256,1024,128112,64,32,64,2,4,8,0.2778240144252777
256,1024,128112,64,64,64,3,8,8,0.2467840015888214
256,1024,128112,64,128,64,5,4,8,0.28415998816490173
256,1024,128112,64,32,128,3,4,8,0.21766400337219238
256,1024,128112,64,32,128,4,8,8,0.2261440008878708
256,1024,128112,64,64,128,3,4,8,0.20943999290466309
256,1024,128112,64,128,128,4,4,8,0.24624000489711761
256,1024,128112,128,32,64,3,4,8,0.22860799729824066
256,1024,128112,128,32,64,4,8,8,0.22230400145053864
256,1024,128112,128,32,128,2,8,8,0.28537601232528687
256,1024,128112,128,32,128,3,4,8,0.21430400013923645
256,1024,128112,128,64,128,3,4,8,0.19603200256824493
256,1024,128112,128,64,128,5,8,8,0.195360004901886
SAME
--------------------
2048,2,768,32,16,32,1,2,8,0.026464000344276428
2048,2,768,32,16,32,2,4,8,0.02486399933695793
2048,2,768,32,16,64,5,8,8,0.025248000398278236
2048,2,768,64,16,32,5,8,8,0.02534399926662445
2048,2,768,64,16,32,5,4,8,0.02566399984061718
2048,2,768,64,16,64,2,4,8,0.02489599958062172
2048,2,768,64,16,64,3,8,8,0.025631999596953392
2048,2,768,64,16,64,5,4,8,0.025119999423623085
2048,2,768,64,16,128,3,4,8,0.025280000641942024
2048,2,768,64,16,128,4,8,8,0.025536000728607178
2048,2,768,64,16,128,4,4,8,0.02486399933695793
2048,2,768,128,16,64,3,4,8,0.024639999493956566
2048,2,768,128,16,64,4,8,8,0.024224000051617622
2048,2,768,128,16,128,2,8,8,0.024032000452280045
2048,2,768,128,16,128,3,4,8,0.024607999250292778
2048,2,768,128,16,128,5,8,8,0.023871999233961105
SAME
--------------------
16,768,768,16,16,32,1,2,8,0.04195199906826019
16,768,768,16,128,32,2,2,8,0.02454400062561035
16,768,768,16,32,64,5,4,8,0.024831999093294144
16,768,768,16,32,32,5,2,8,0.02473600022494793
16,768,768,16,128,32,5,2,8,0.024224000051617622
16,768,768,16,16,64,2,4,8,0.042367998510599136
16,768,768,16,32,64,2,4,8,0.031488001346588135
16,768,768,16,64,64,3,4,8,0.02489599958062172
16,768,768,16,128,64,5,4,8,0.02470399998128414
16,768,768,16,32,128,3,4,8,0.02537599951028824
16,768,768,16,32,128,4,8,8,0.024607999250292778
16,768,768,16,64,128,3,4,8,0.02393599972128868
16,768,768,16,128,128,4,4,8,0.023871999233961105
16,768,768,16,32,64,3,4,8,0.023903999477624893
16,768,768,16,32,64,4,4,8,0.02454400062561035
16,768,768,16,32,128,2,8,8,0.03254399821162224
16,768,768,16,64,128,5,8,8,0.0244159996509552
SAME
--------------------
256,29056,1024,32,16,32,1,2,8,0.9715200066566467
256,29056,1024,32,128,32,2,4,8,0.2274560034275055
256,29056,1024,32,32,64,5,8,8,0.17980800569057465
256,29056,1024,64,32,32,5,8,8,0.18598400056362152
256,29056,1024,64,128,32,5,4,8,0.09148799628019333
256,29056,1024,64,16,64,2,4,8,1.0444480180740356
256,29056,1024,64,32,64,2,4,8,0.5818880200386047
256,29056,1024,64,64,64,3,8,8,0.19049599766731262
256,29056,1024,64,128,64,5,4,8,0.09046400338411331
256,29056,1024,64,32,128,3,4,8,0.319487988948822
256,29056,1024,64,32,128,4,8,8,0.23071999847888947
256,29056,1024,64,64,128,3,4,8,0.19046400487422943
256,29056,1024,64,128,128,4,4,8,0.11059200018644333
256,29056,1024,128,32,64,3,4,8,0.34031999111175537
256,29056,1024,128,32,64,4,8,8,0.2412479966878891
256,29056,1024,128,32,128,2,8,8,0.6647679805755615
256,29056,1024,128,32,128,3,4,8,0.3495680093765259
256,29056,1024,128,64,128,3,4,8,0.20550400018692017
256,29056,1024,128,64,128,5,8,8,0.1438400000333786
SAME
--------------------
32768,256,128,32,16,32,1,2,8,0.04864000156521797
32768,256,128,32,128,32,2,4,8,0.038816001266241074
32768,256,128,32,32,64,5,8,8,0.04047999903559685
32768,256,128,64,32,32,5,8,8,0.04032000154256821
32768,256,128,64,128,32,5,4,8,0.04726399853825569
32768,256,128,64,16,64,2,4,8,0.0360959991812706
32768,256,128,64,32,64,2,4,8,0.03388800099492073
32768,256,128,64,64,64,3,8,8,0.03251200169324875
32768,256,128,64,128,64,5,4,8,0.03766399994492531
32768,256,128,64,32,128,3,4,8,0.03110400028526783
32768,256,128,64,32,128,4,8,8,0.03161599859595299
32768,256,128,64,64,128,3,4,8,0.031168000772595406
32768,256,128,64,128,128,4,4,8,0.03388800099492073
32768,256,128,128,32,64,3,4,8,0.03286400064826012
32768,256,128,128,32,64,4,8,8,0.033215999603271484
32768,256,128,128,32,128,2,8,8,0.03417599946260452
32768,256,128,128,32,128,3,4,8,0.03206399828195572
32768,256,128,128,64,128,3,4,8,0.03014400042593479
32768,256,128,128,64,128,5,8,8,0.03280000016093254
SAME
--------------------
4096,1024,16384,32,16,32,1,2,8,1.6936960220336914
4096,1024,16384,32,128,32,2,4,8,0.9932799935340881
4096,1024,16384,32,32,64,5,8,8,1.1480319499969482
4096,1024,16384,64,32,32,5,8,8,1.0157760381698608
4096,1024,16384,64,128,32,5,4,8,0.8319360017776489
4096,1024,16384,64,16,64,2,4,8,0.7063360214233398
4096,1024,16384,64,32,64,2,4,8,0.45001599192619324
4096,1024,16384,64,64,64,3,8,8,0.43091198801994324
4096,1024,16384,64,128,64,5,4,8,0.49158400297164917
4096,1024,16384,64,32,128,3,4,8,0.3279680013656616
4096,1024,16384,64,32,128,4,8,8,0.3505280017852783
4096,1024,16384,64,64,128,3,4,8,0.30399999022483826
4096,1024,16384,64,128,128,4,4,8,0.4020160138607025
4096,1024,16384,128,32,64,3,4,8,0.34246399998664856
4096,1024,16384,128,32,64,4,8,8,0.3575359880924225
4096,1024,16384,128,32,128,2,8,8,0.44281598925590515
4096,1024,16384,128,32,128,3,4,8,0.2804799973964691
4096,1024,16384,128,64,128,3,4,8,0.28678399324417114
4096,1024,16384,128,64,128,5,8,8,0.27740800380706787
SAME
--------------------
2048,30522,512,32,16,32,1,2,8,1.126304030418396
2048,30522,512,32,128,32,2,4,8,0.5746880173683167
2048,30522,512,32,32,64,5,8,8,0.5629760026931763
2048,30522,512,64,32,32,5,8,8,1.0164799690246582
2048,30522,512,64,128,32,5,4,8,0.5991039872169495
2048,30522,512,64,16,64,2,4,8,1.153216004371643
2048,30522,512,64,32,64,2,4,8,0.6743680238723755
2048,30522,512,64,64,64,3,8,8,0.4360319972038269
2048,30522,512,64,128,64,5,4,8,0.3384320139884949
2048,30522,512,64,32,128,3,4,8,0.37564799189567566
2048,30522,512,64,32,128,4,8,8,0.28095999360084534
2048,30522,512,64,64,128,3,4,8,0.22819200158119202
2048,30522,512,64,128,128,4,4,8,0.21747200191020966
2048,30522,512,128,32,64,3,4,8,0.3967680037021637
2048,30522,512,128,32,64,4,8,8,0.3259199857711792
2048,30522,512,128,32,128,2,8,8,0.7518720030784607
2048,30522,512,128,32,128,3,4,8,0.41359999775886536
2048,30522,512,128,64,128,3,4,8,0.426144003868103
2048,30522,512,128,64,128,5,8,8,0.37296000123023987
SAME
--------------------
4096,3072,768,32,16,32,1,2,8,0.26528000831604004
4096,3072,768,32,128,32,2,4,8,0.13359999656677246
4096,3072,768,32,32,64,5,8,8,0.1648000031709671
4096,3072,768,64,32,32,5,8,8,0.14217600226402283
4096,3072,768,64,128,32,5,4,8,0.11027199774980545
4096,3072,768,64,16,64,2,4,8,0.12652799487113953
4096,3072,768,64,32,64,2,4,8,0.09651199728250504
4096,3072,768,64,64,64,3,8,8,0.07283200323581696
4096,3072,768,64,128,64,5,4,8,0.07583999633789062
4096,3072,768,64,32,128,3,4,8,0.07072000205516815
4096,3072,768,64,32,128,4,8,8,0.06428799778223038
4096,3072,768,64,64,128,3,4,8,0.05552000179886818
4096,3072,768,64,128,128,4,4,8,0.06239999830722809
4096,3072,768,128,32,64,3,4,8,0.07334399968385696
4096,3072,768,128,32,64,4,8,8,0.06620799750089645
4096,3072,768,128,32,128,2,8,8,0.10265599936246872
4096,3072,768,128,32,128,3,4,8,0.07382400333881378
4096,3072,768,128,64,128,3,4,8,0.058079998940229416
4096,3072,768,128,64,128,5,8,8,0.06195199862122536
SAME
--------------------
32768,1024,256,32,16,32,1,2,8,0.22336000204086304
32768,1024,256,32,128,32,2,4,8,0.12432000041007996
32768,1024,256,32,32,64,5,8,8,0.15132799744606018
32768,1024,256,64,32,32,5,8,8,0.13497599959373474
32768,1024,256,64,128,32,5,4,8,0.11321599781513214
32768,1024,256,64,16,64,2,4,8,0.11161600053310394
32768,1024,256,64,32,64,2,4,8,0.09388799965381622
32768,1024,256,64,64,64,3,8,8,0.08019199967384338
32768,1024,256,64,128,64,5,4,8,0.08643200248479843
32768,1024,256,64,32,128,3,4,8,0.07574400305747986
32768,1024,256,64,32,128,4,8,8,0.07811199873685837
32768,1024,256,64,64,128,3,4,8,0.07097599655389786
32768,1024,256,64,128,128,4,4,8,0.07948800176382065
32768,1024,256,128,32,64,3,4,8,0.08409599959850311
32768,1024,256,128,32,64,4,8,8,0.08339200168848038
32768,1024,256,128,32,128,2,8,8,0.0974079966545105
32768,1024,256,128,32,128,3,4,8,0.07676800340414047
32768,1024,256,128,64,128,3,4,8,0.0689919963479042
32768,1024,256,128,64,128,5,8,8,0.07062400132417679
SAME
--------------------
32768,256,256,32,16,32,1,2,8,0.0764480009675026
32768,256,256,32,128,32,2,4,8,0.055135998874902725
32768,256,256,32,32,64,5,8,8,0.0628800019621849
32768,256,256,64,32,32,5,8,8,0.059647999703884125
32768,256,256,64,128,32,5,4,8,0.07225599884986877
32768,256,256,64,16,64,2,4,8,0.04569600149989128
32768,256,256,64,32,64,2,4,8,0.03948799893260002
32768,256,256,64,64,64,3,8,8,0.04118400067090988
32768,256,256,64,128,64,5,4,8,0.05222399905323982
32768,256,256,64,32,128,3,4,8,0.036479998379945755
32768,256,256,64,32,128,4,8,8,0.039455998688936234
32768,256,256,64,64,128,3,4,8,0.0379519984126091
32768,256,256,64,128,128,4,4,8,0.044064000248909
32768,256,256,128,32,64,3,4,8,0.03827200084924698
32768,256,256,128,32,64,4,8,8,0.03872000053524971
32768,256,256,128,32,128,2,8,8,0.04028800129890442
32768,256,256,128,32,128,3,4,8,0.03759999945759773
32768,256,256,128,64,128,3,4,8,0.035232000052928925
32768,256,256,128,64,128,5,8,8,0.03907199949026108
SAME
--------------------
1536,512,6144,32,16,32,1,2,8,0.1276800036430359
1536,512,6144,32,128,32,2,4,8,0.09020800143480301
1536,512,6144,32,32,64,5,8,8,0.10425599664449692
1536,512,6144,64,32,32,5,8,8,0.09424000233411789
1536,512,6144,64,128,32,5,4,8,0.09894400089979172
1536,512,6144,64,16,64,2,4,8,0.06646399945020676
1536,512,6144,64,32,64,2,4,8,0.0504320003092289
1536,512,6144,64,64,64,3,8,8,0.04841599985957146
1536,512,6144,64,128,64,5,4,8,0.06499200314283371
1536,512,6144,64,32,128,3,4,8,0.03907199949026108
1536,512,6144,64,32,128,4,8,8,0.04188799858093262
1536,512,6144,64,64,128,3,4,8,0.03929600119590759
1536,512,6144,64,128,128,4,4,8,0.051263999193906784
1536,512,6144,128,32,64,3,4,8,0.04150399938225746
1536,512,6144,128,32,64,4,8,8,0.04303999990224838
1536,512,6144,128,32,128,2,8,8,0.05392000079154968
1536,512,6144,128,32,128,3,4,8,0.039903998374938965
1536,512,6144,128,64,128,3,4,8,0.04390399903059006
1536,512,6144,128,64,128,5,8,8,0.04307200014591217
SAME
--------------------
2048,30522,768,32,16,32,1,2,8,1.2406079769134521
2048,30522,768,32,128,32,2,4,8,0.8547520041465759
2048,30522,768,32,32,64,5,8,8,0.8396160006523132
2048,30522,768,64,32,32,5,8,8,1.5089919567108154
2048,30522,768,64,128,32,5,4,8,0.8954560160636902
2048,30522,768,64,16,64,2,4,8,1.1369600296020508
2048,30522,768,64,32,64,2,4,8,0.6794559955596924
2048,30522,768,64,64,64,3,8,8,0.6439679861068726
2048,30522,768,64,128,64,5,4,8,0.5001279711723328
2048,30522,768,64,32,128,3,4,8,0.39103999733924866
2048,30522,768,64,32,128,4,8,8,0.4532800018787384
2048,30522,768,64,64,128,3,4,8,0.347104012966156
2048,30522,768,64,128,128,4,4,8,0.41948801279067993
2048,30522,768,128,32,64,3,4,8,0.5204480290412903
2048,30522,768,128,32,64,4,8,8,0.5598400235176086
2048,30522,768,128,32,128,2,8,8,0.7770559787750244
2048,30522,768,128,32,128,3,4,8,0.4174720048904419
2048,30522,768,128,64,128,3,4,8,0.41788798570632935
2048,30522,768,128,64,128,5,8,8,0.3736000061035156
SAME
--------------------
16,2,768,16,16,32,1,2,8,0.024351999163627625
16,2,768,16,16,32,2,2,8,0.023455999791622162
16,2,768,16,16,64,5,4,8,0.02396799996495247
16,2,768,16,16,32,5,2,8,0.024224000051617622
16,2,768,16,16,64,2,4,8,0.023264000192284584
16,2,768,16,16,64,3,4,8,0.023231999948620796
16,2,768,16,16,128,3,4,8,0.024480000138282776
16,2,768,16,16,128,4,8,8,0.023552000522613525
16,2,768,16,16,128,4,4,8,0.023903999477624893
16,2,768,16,16,64,4,4,8,0.02489599958062172
16,2,768,16,16,128,2,8,8,0.023391999304294586
16,2,768,16,16,128,5,8,8,0.023615999147295952
SAME
--------------------
50005,2048,768,32,16,32,1,2,8,1.9330559968948364
50005,2048,768,32,128,32,2,4,8,1.0732799768447876
50005,2048,768,32,32,64,5,8,8,1.2750719785690308
50005,2048,768,64,32,32,5,8,8,1.0925439596176147
50005,2048,768,64,128,32,5,4,8,0.7472959756851196
50005,2048,768,64,16,64,2,4,8,0.7032960057258606
50005,2048,768,64,32,64,2,4,8,0.4822080135345459
50005,2048,768,64,64,64,3,8,8,0.46083199977874756
50005,2048,768,64,128,64,5,4,8,0.4650239944458008
50005,2048,768,64,32,128,3,4,8,0.36723199486732483
50005,2048,768,64,32,128,4,8,8,0.3787840008735657
50005,2048,768,64,64,128,3,4,8,0.33375999331474304
50005,2048,768,64,128,128,4,4,8,0.3692159950733185
50005,2048,768,128,32,64,3,4,8,0.40227198600769043
50005,2048,768,128,32,64,4,8,8,0.3892799913883209
50005,2048,768,128,32,128,2,8,8,0.4949440062046051
50005,2048,768,128,32,128,3,4,8,0.3048959970474243
50005,2048,768,128,64,128,3,4,8,0.2707839906215668
50005,2048,768,128,64,128,5,8,8,0.28620800375938416
SAME
--------------------
1024,50358,768,32,16,32,1,2,8,1.7894079685211182
1024,50358,768,32,128,32,2,4,8,0.8362879753112793
1024,50358,768,32,32,64,5,8,8,0.7225599884986877
1024,50358,768,64,32,32,5,8,8,1.2436480522155762
1024,50358,768,64,128,32,5,4,8,0.7106559872627258
1024,50358,768,64,16,64,2,4,8,1.8412480354309082
1024,50358,768,64,32,64,2,4,8,1.1054719686508179
1024,50358,768,64,64,64,3,8,8,0.7206400036811829
1024,50358,768,64,128,64,5,4,8,0.5151680111885071
1024,50358,768,64,32,128,3,4,8,0.5900480151176453
1024,50358,768,64,32,128,4,8,8,0.44016000628471375
1024,50358,768,64,64,128,3,4,8,0.361407995223999
1024,50358,768,64,128,128,4,4,8,0.33507201075553894
1024,50358,768,128,32,64,3,4,8,0.6318719983100891
1024,50358,768,128,32,64,4,8,8,0.5220159888267517
1024,50358,768,128,32,128,2,8,8,1.266495943069458
1024,50358,768,128,32,128,3,4,8,0.66975998878479
1024,50358,768,128,64,128,3,4,8,0.6754559874534607
1024,50358,768,128,64,128,5,8,8,0.6017919778823853
SAME
--------------------
256,32768,128,32,16,32,1,2,8,0.9935680031776428
256,32768,128,32,128,32,2,4,8,0.2317119985818863
256,32768,128,32,32,64,5,8,8,0.19152000546455383
256,32768,128,64,32,32,5,8,8,0.1998399943113327
256,32768,128,64,128,32,5,4,8,0.08787199854850769
256,32768,128,64,16,64,2,4,8,1.1888320446014404
256,32768,128,64,32,64,2,4,8,0.661952018737793
256,32768,128,64,64,64,3,8,8,0.1976960003376007
256,32768,128,64,128,64,5,4,8,0.08822400122880936
256,32768,128,64,32,128,3,4,8,0.35148799419403076
256,32768,128,64,32,128,4,8,8,0.2476159930229187
256,32768,128,64,64,128,3,4,8,0.19724799692630768
256,32768,128,64,128,128,4,4,8,0.10851199924945831
256,32768,128,128,32,64,3,4,8,0.37244799733161926
256,32768,128,128,32,64,4,8,8,0.2559039890766144
256,32768,128,128,32,128,2,8,8,0.7618560194969177
256,32768,128,128,32,128,3,4,8,0.38921600580215454
256,32768,128,128,64,128,3,4,8,0.21481600403785706
256,32768,128,128,64,128,5,8,8,0.1613440066576004
SAME
--------------------
128,8192,2048,32,16,32,1,2,8,0.2979840040206909
128,8192,2048,32,128,32,2,4,8,0.08876799792051315
128,8192,2048,32,32,64,5,8,8,0.07497599720954895
128,8192,2048,64,32,32,5,8,8,0.07529599964618683
128,8192,2048,64,128,32,5,4,8,0.05167999863624573
128,8192,2048,64,16,64,2,4,8,0.31571200489997864
128,8192,2048,64,32,64,2,4,8,0.1825920045375824
128,8192,2048,64,64,64,3,8,8,0.07929600030183792
128,8192,2048,64,128,64,5,4,8,0.04940799996256828
128,8192,2048,64,32,128,3,4,8,0.11478400230407715
128,8192,2048,64,32,128,4,8,8,0.09113600105047226
128,8192,2048,64,64,128,3,4,8,0.08064000308513641
128,8192,2048,64,128,128,4,4,8,0.054336000233888626
128,8192,2048,128,32,64,3,4,8,0.11507199704647064
128,8192,2048,128,32,64,4,8,8,0.09372799843549728
128,8192,2048,128,32,128,2,8,8,0.19971199333667755
128,8192,2048,128,32,128,3,4,8,0.1143679991364479
128,8192,2048,128,64,128,3,4,8,0.08457600325345993
128,8192,2048,128,64,128,5,8,8,0.0628800019621849
SAME
--------------------
6144,512,1536,32,16,32,1,2,8,0.12883199751377106
6144,512,1536,32,128,32,2,4,8,0.0878399983048439
6144,512,1536,32,32,64,5,8,8,0.10335999727249146
6144,512,1536,64,32,32,5,8,8,0.09382399916648865
6144,512,1536,64,128,32,5,4,8,0.09446399658918381
6144,512,1536,64,16,64,2,4,8,0.06835199892520905
6144,512,1536,64,32,64,2,4,8,0.05260799825191498
6144,512,1536,64,64,64,3,8,8,0.047775998711586
6144,512,1536,64,128,64,5,4,8,0.062431998550891876
6144,512,1536,64,32,128,3,4,8,0.03814399987459183
6144,512,1536,64,32,128,4,8,8,0.0416640006005764
6144,512,1536,64,64,128,3,4,8,0.03888000175356865
6144,512,1536,64,128,128,4,4,8,0.05020799860358238
6144,512,1536,128,32,64,3,4,8,0.040672000497579575
6144,512,1536,128,32,64,4,8,8,0.043487999588251114
6144,512,1536,128,32,128,2,8,8,0.053247999399900436
6144,512,1536,128,32,128,3,4,8,0.0414079986512661
6144,512,1536,128,64,128,3,4,8,0.04355200007557869
6144,512,1536,128,64,128,5,8,8,0.040991999208927155
SAME
--------------------
8192,512,512,32,16,32,1,2,8,0.07433599978685379
8192,512,512,32,128,32,2,4,8,0.04931199923157692
8192,512,512,32,32,64,5,8,8,0.057312000542879105
8192,512,512,64,32,32,5,8,8,0.05344000086188316
8192,512,512,64,128,32,5,4,8,0.05251200124621391
8192,512,512,64,16,64,2,4,8,0.03923200070858002
8192,512,512,64,32,64,2,4,8,0.031199999153614044
8192,512,512,64,64,64,3,8,8,0.031968001276254654
8192,512,512,64,128,64,5,4,8,0.038015998899936676
8192,512,512,64,32,128,3,4,8,0.028255999088287354
8192,512,512,64,32,128,4,8,8,0.030047999694943428
8192,512,512,64,64,128,3,4,8,0.031808000057935715
8192,512,512,64,128,128,4,4,8,0.03292800113558769
8192,512,512,128,32,64,3,4,8,0.028736000880599022
8192,512,512,128,32,64,4,8,8,0.03081599995493889
8192,512,512,128,32,128,2,8,8,0.03251200169324875
8192,512,512,128,32,128,3,4,8,0.029120000079274178
8192,512,512,128,64,128,3,4,8,0.027327999472618103
8192,512,512,128,64,128,5,8,8,0.030079999938607216
SAME
--------------------
32768,256,1024,32,16,32,1,2,8,0.22870400547981262
32768,256,1024,32,128,32,2,4,8,0.1422719955444336
32768,256,1024,32,32,64,5,8,8,0.17843200266361237
32768,256,1024,64,32,32,5,8,8,0.16451199352741241
32768,256,1024,64,128,32,5,4,8,0.21216000616550446
32768,256,1024,64,16,64,2,4,8,0.10559999942779541
32768,256,1024,64,32,64,2,4,8,0.08707199990749359
32768,256,1024,64,64,64,3,8,8,0.08579199761152267
32768,256,1024,64,128,64,5,4,8,0.1297920048236847
32768,256,1024,64,32,128,3,4,8,0.07075200229883194
32768,256,1024,64,32,128,4,8,8,0.07443200051784515
32768,256,1024,64,64,128,3,4,8,0.07187200337648392
32768,256,1024,64,128,128,4,4,8,0.0990080013871193
32768,256,1024,128,32,64,3,4,8,0.0751039981842041
32768,256,1024,128,32,64,4,8,8,0.07286400347948074
32768,256,1024,128,32,128,2,8,8,0.08444800227880478
32768,256,1024,128,32,128,3,4,8,0.0711359977722168
32768,256,1024,128,64,128,3,4,8,0.06857600063085556
32768,256,1024,128,64,128,5,8,8,0.07516799867153168
SAME
--------------------
512,384,768,32,16,32,1,2,8,0.030559999868273735
512,384,768,32,128,32,2,4,8,0.024191999807953835
512,384,768,32,32,64,5,8,8,0.024447999894618988
512,384,768,64,32,32,5,8,8,0.02489599958062172
512,384,768,64,128,32,5,4,8,0.024288000538945198
512,384,768,64,16,64,2,4,8,0.030527999624609947
512,384,768,64,32,64,2,4,8,0.026016000658273697
512,384,768,64,64,64,3,8,8,0.02470399998128414
512,384,768,64,128,64,5,4,8,0.024607999250292778
512,384,768,64,32,128,3,4,8,0.024992000311613083
512,384,768,64,32,128,4,8,8,0.024960000067949295
512,384,768,64,64,128,3,4,8,0.02473600022494793
512,384,768,64,128,128,4,4,8,0.025439999997615814
512,384,768,128,32,64,3,4,8,0.025151999667286873
512,384,768,128,32,64,4,8,8,0.024447999894618988
512,384,768,128,32,128,2,8,8,0.026528000831604004
512,384,768,128,32,128,3,4,8,0.02537599951028824
512,384,768,128,64,128,3,4,8,0.024671999737620354
512,384,768,128,64,128,5,8,8,0.024800000712275505
SAME
--------------------
2048,768,2304,32,16,32,1,2,8,0.10886400192975998
2048,768,2304,32,128,32,2,4,8,0.0692799985408783
2048,768,2304,32,32,64,5,8,8,0.08182399719953537
2048,768,2304,64,32,32,5,8,8,0.07411199808120728
2048,768,2304,64,128,32,5,4,8,0.06787200272083282
2048,768,2304,64,16,64,2,4,8,0.06281600147485733
2048,768,2304,64,32,64,2,4,8,0.0453759990632534
2048,768,2304,64,64,64,3,8,8,0.03929600119590759
2048,768,2304,64,128,64,5,4,8,0.04809600114822388
2048,768,2304,64,32,128,3,4,8,0.03190400078892708
2048,768,2304,64,32,128,4,8,8,0.034304000437259674
2048,768,2304,64,64,128,3,4,8,0.03420799970626831
2048,768,2304,64,128,128,4,4,8,0.04153599962592125
2048,768,2304,128,32,64,3,4,8,0.03308799862861633
2048,768,2304,128,32,64,4,8,8,0.035711999982595444
2048,768,2304,128,32,128,2,8,8,0.048576001077890396
2048,768,2304,128,32,128,3,4,8,0.033055998384952545
2048,768,2304,128,64,128,3,4,8,0.03929600119590759
2048,768,2304,128,64,128,5,8,8,0.035711999982595444
SAME
--------------------
768,1024,3072,32,16,32,1,2,8,0.07939200103282928
768,1024,3072,32,128,32,2,4,8,0.05452800169587135
768,1024,3072,32,32,64,5,8,8,0.059967998415231705
768,1024,3072,64,32,32,5,8,8,0.05471999943256378
768,1024,3072,64,128,32,5,4,8,0.050144001841545105
768,1024,3072,64,16,64,2,4,8,0.05817599967122078
768,1024,3072,64,32,64,2,4,8,0.04201599955558777
768,1024,3072,64,64,64,3,8,8,0.03219199925661087
768,1024,3072,64,128,64,5,4,8,0.03836800158023834
768,1024,3072,64,32,128,3,4,8,0.03190400078892708
768,1024,3072,64,32,128,4,8,8,0.03001599945127964
768,1024,3072,64,64,128,3,4,8,0.028863999992609024
768,1024,3072,64,128,128,4,4,8,0.03526400029659271
768,1024,3072,128,32,64,3,4,8,0.033535998314619064
768,1024,3072,128,32,64,4,8,8,0.029791999608278275
768,1024,3072,128,32,128,2,8,8,0.04230400174856186
768,1024,3072,128,32,128,3,4,8,0.03510399907827377
768,1024,3072,128,64,128,3,4,8,0.03302399814128876
768,1024,3072,128,64,128,5,8,8,0.031936001032590866
SAME
--------------------
2048,128,128,32,16,32,1,2,8,0.023840000852942467
2048,128,128,32,128,32,2,4,8,0.023903999477624893
2048,128,128,32,32,64,5,8,8,0.0244159996509552
2048,128,128,64,32,32,5,8,8,0.025151999667286873
2048,128,128,64,128,32,5,4,8,0.024383999407291412
2048,128,128,64,16,64,2,4,8,0.025248000398278236
2048,128,128,64,32,64,2,4,8,0.024288000538945198
2048,128,128,64,64,64,3,8,8,0.02454400062561035
2048,128,128,64,128,64,5,4,8,0.024960000067949295
2048,128,128,64,32,128,3,4,8,0.024671999737620354
2048,128,128,64,32,128,4,8,8,0.025151999667286873
2048,128,128,64,64,128,3,4,8,0.025439999997615814
2048,128,128,64,128,128,4,4,8,0.02582399919629097
2048,128,128,128,32,64,3,4,8,0.025728000327944756
2048,128,128,128,32,64,4,8,8,0.02521600015461445
2048,128,128,128,32,128,2,8,8,0.02393599972128868
2048,128,128,128,32,128,3,4,8,0.02505600079894066
2048,128,128,128,64,128,3,4,8,0.024480000138282776
2048,128,128,128,64,128,5,8,8,0.025439999997615814
SAME
--------------------
1024,50265,768,32,16,32,1,2,8,3.002687931060791
1024,50265,768,32,128,32,2,4,8,0.9455680251121521
1024,50265,768,32,32,64,5,8,8,1.0688320398330688
1024,50265,768,64,32,32,5,8,8,1.7194559574127197
1024,50265,768,64,128,32,5,4,8,1.57750403881073
1024,50265,768,64,16,64,2,4,8,2.0087358951568604
1024,50265,768,64,32,64,2,4,8,1.1647039651870728
1024,50265,768,64,64,64,3,8,8,0.9418879747390747
1024,50265,768,64,128,64,5,4,8,0.937824010848999
1024,50265,768,64,32,128,3,4,8,1.2286080121994019
1024,50265,768,64,32,128,4,8,8,1.2233920097351074
1024,50265,768,64,64,128,3,4,8,0.83024001121521
1024,50265,768,64,128,128,4,4,8,0.9762560129165649
1024,50265,768,128,32,64,3,4,8,1.406048059463501
1024,50265,768,128,32,64,4,8,8,1.3553600311279297
1024,50265,768,128,32,128,2,8,8,1.4534399509429932
1024,50265,768,128,32,128,3,4,8,1.7905919551849365
1024,50265,768,128,64,128,3,4,8,6.56063985824585
1024,50265,768,128,64,128,5,8,8,1.2294399738311768
SAME
--------------------
512,50272,768,32,16,32,1,2,8,1.6440320014953613
512,50272,768,32,128,32,2,4,8,0.37702399492263794
512,50272,768,32,32,64,5,8,8,0.42688000202178955
512,50272,768,64,32,32,5,8,8,0.36931198835372925
512,50272,768,64,128,32,5,4,8,0.24985599517822266
512,50272,768,64,16,64,2,4,8,1.7963839769363403
512,50272,768,64,32,64,2,4,8,0.9892479777336121
512,50272,768,64,64,64,3,8,8,0.33395200967788696
512,50272,768,64,128,64,5,4,8,0.1586879938840866
512,50272,768,64,32,128,3,4,8,0.5391039848327637
512,50272,768,64,32,128,4,8,8,0.37939199805259705
512,50272,768,64,64,128,3,4,8,0.32630398869514465
512,50272,768,64,128,128,4,4,8,0.18051199615001678
512,50272,768,128,32,64,3,4,8,0.5726720094680786
512,50272,768,128,32,64,4,8,8,0.4009599983692169
512,50272,768,128,32,128,2,8,8,1.1376639604568481
512,50272,768,128,32,128,3,4,8,0.59552001953125
512,50272,768,128,64,128,3,4,8,0.35785600543022156
512,50272,768,128,64,128,5,8,8,0.2763200104236603
SAME
--------------------
256,128112,1024,32,16,32,1,2,8,4.191359996795654
256,128112,1024,32,128,32,2,4,8,0.9291520118713379
256,128112,1024,32,32,64,5,8,8,0.7422400116920471
256,128112,1024,64,32,32,5,8,8,0.7668799757957458
256,128112,1024,64,128,32,5,4,8,0.3405439853668213
256,128112,1024,64,16,64,2,4,8,4.584288120269775
256,128112,1024,64,32,64,2,4,8,2.5803520679473877
256,128112,1024,64,64,64,3,8,8,0.8202239871025085
256,128112,1024,64,128,64,5,4,8,0.3889920115470886
256,128112,1024,64,32,128,3,4,8,1.3787519931793213
256,128112,1024,64,32,128,4,8,8,1.014240026473999
256,128112,1024,64,64,128,3,4,8,0.7997440099716187
256,128112,1024,64,128,128,4,4,8,0.4379200041294098
256,128112,1024,128,32,64,3,4,8,1.429311990737915
256,128112,1024,128,32,64,4,8,8,1.0413119792938232
256,128112,1024,128,32,128,2,8,8,3.0100159645080566
256,128112,1024,128,32,128,3,4,8,1.517024040222168
256,128112,1024,128,64,128,3,4,8,0.8877440094947815
256,128112,1024,128,64,128,5,8,8,0.7168639898300171
SAME
--------------------
512,1024,50265,32,16,32,1,2,8,0.7555519938468933
512,1024,50265,32,128,32,2,4,8,1.3381439447402954
512,1024,50265,32,32,64,5,8,8,0.7344639897346497
512,1024,50265,64,32,32,5,8,8,0.6113280057907104
512,1024,50265,64,128,32,5,4,8,0.8295040130615234
512,1024,50265,64,16,64,2,4,8,0.45577600598335266
512,1024,50265,64,32,64,2,4,8,0.4737919867038727
512,1024,50265,64,64,64,3,8,8,0.46294400095939636
512,1024,50265,64,128,64,5,4,8,1.8681600093841553
512,1024,50265,64,32,128,3,4,8,0.4166400134563446
512,1024,50265,64,32,128,4,8,8,0.5111680030822754
512,1024,50265,64,64,128,3,4,8,0.35814398527145386
512,1024,50265,64,128,128,4,4,8,0.3285120129585266
512,1024,50265,128,32,64,3,4,8,0.24751999974250793
512,1024,50265,128,32,64,4,8,8,0.31651198863983154
512,1024,50265,128,32,128,2,8,8,0.3426879942417145
512,1024,50265,128,32,128,3,4,8,0.2552320063114166
512,1024,50265,128,64,128,3,4,8,0.2215999960899353
512,1024,50265,128,64,128,5,8,8,0.32387199997901917
SAME
--------------------
3072,1024,768,32,16,32,1,2,8,0.07974400371313095
3072,1024,768,32,128,32,2,4,8,0.05363199859857559
3072,1024,768,32,32,64,5,8,8,0.059776000678539276
3072,1024,768,64,32,32,5,8,8,0.05407999828457832
3072,1024,768,64,128,32,5,4,8,0.04793599992990494
3072,1024,768,64,16,64,2,4,8,0.05411199852824211
3072,1024,768,64,32,64,2,4,8,0.04009599983692169
3072,1024,768,64,64,64,3,8,8,0.031488001346588135
3072,1024,768,64,128,64,5,4,8,0.036607999354600906
3072,1024,768,64,32,128,3,4,8,0.03142400085926056
3072,1024,768,64,32,128,4,8,8,0.029632000252604485
3072,1024,768,64,64,128,3,4,8,0.027488000690937042
3072,1024,768,64,128,128,4,4,8,0.03468799963593483
3072,1024,768,128,32,64,3,4,8,0.034912001341581345
3072,1024,768,128,32,64,4,8,8,0.02953599952161312
3072,1024,768,128,32,128,2,8,8,0.04310400038957596
3072,1024,768,128,32,128,3,4,8,0.035999998450279236
3072,1024,768,128,64,128,3,4,8,0.03171199932694435
3072,1024,768,128,64,128,5,8,8,0.03215999901294708
SAME
--------------------
1024,50265,1024,32,16,32,1,2,8,3.061216115951538
1024,50265,1024,32,128,32,2,4,8,1.3141440153121948
1024,50265,1024,32,32,64,5,8,8,1.1229439973831177
1024,50265,1024,64,32,32,5,8,8,2.277343988418579
1024,50265,1024,64,128,32,5,4,8,1.6031359434127808
1024,50265,1024,64,16,64,2,4,8,2.0135040283203125
1024,50265,1024,64,32,64,2,4,8,1.1753599643707275
1024,50265,1024,64,64,64,3,8,8,0.946399986743927
1024,50265,1024,64,128,64,5,4,8,0.9411839842796326
1024,50265,1024,64,32,128,3,4,8,1.2345919609069824
1024,50265,1024,64,32,128,4,8,8,1.2466239929199219
1024,50265,1024,64,64,128,3,4,8,0.841920018196106
1024,50265,1024,64,128,128,4,4,8,0.9923200011253357
1024,50265,1024,128,32,64,3,4,8,1.4124799966812134
1024,50265,1024,128,32,64,4,8,8,1.3651520013809204
1024,50265,1024,128,32,128,2,8,8,1.4559040069580078
1024,50265,1024,128,32,128,3,4,8,1.7965439558029175
1024,50265,1024,128,64,128,3,4,8,6.850527763366699
1024,50265,1024,128,64,128,5,8,8,1.223520040512085
SAME
--------------------
512,4096,128,32,16,32,1,2,8,0.12495999783277512
512,4096,128,32,128,32,2,4,8,0.04668800160288811
512,4096,128,32,32,64,5,8,8,0.04227200150489807
512,4096,128,64,32,32,5,8,8,0.04259200021624565
512,4096,128,64,128,32,5,4,8,0.026944000273942947
512,4096,128,64,16,64,2,4,8,0.146464005112648
512,4096,128,64,32,64,2,4,8,0.09868799895048141
512,4096,128,64,64,64,3,8,8,0.04262400045990944
512,4096,128,64,128,64,5,4,8,0.026367999613285065
512,4096,128,64,32,128,3,4,8,0.06207999959588051
512,4096,128,64,32,128,4,8,8,0.04927999898791313
512,4096,128,64,64,128,3,4,8,0.041728001087903976
512,4096,128,64,128,128,4,4,8,0.030559999868273735
512,4096,128,128,32,64,3,4,8,0.06431999802589417
512,4096,128,128,32,64,4,8,8,0.05056000128388405
512,4096,128,128,32,128,2,8,8,0.10739199817180634
512,4096,128,128,32,128,3,4,8,0.0663679987192154
512,4096,128,128,64,128,3,4,8,0.04499199986457825
512,4096,128,128,64,128,5,8,8,0.03766399994492531
SAME
--------------------
256,1024,256008,32,16,32,1,2,8,1.7125760316848755
256,1024,256008,32,128,32,2,4,8,1.1518399715423584
256,1024,256008,32,32,64,5,8,8,1.1858880519866943
256,1024,256008,64,32,32,5,8,8,1.0271680355072021
256,1024,256008,64,128,32,5,4,8,0.9243519902229309
256,1024,256008,64,16,64,2,4,8,0.8293120265007019
256,1024,256008,64,32,64,2,4,8,0.5888959765434265
256,1024,256008,64,64,64,3,8,8,0.5560640096664429
256,1024,256008,64,128,64,5,4,8,0.6307520270347595
256,1024,256008,64,32,128,3,4,8,0.48607999086380005
256,1024,256008,64,32,128,4,8,8,0.5032640099525452
256,1024,256008,64,64,128,3,4,8,0.4607999920845032
256,1024,256008,64,128,128,4,4,8,0.532800018787384
256,1024,256008,128,32,64,3,4,8,0.4665279984474182
256,1024,256008,128,32,64,4,8,8,0.46726399660110474
256,1024,256008,128,32,128,2,8,8,0.5649920105934143
256,1024,256008,128,32,128,3,4,8,0.41679999232292175
256,1024,256008,128,64,128,3,4,8,0.39958399534225464
256,1024,256008,128,64,128,5,8,8,0.39401599764823914
SAME
--------------------
2048,128,512,32,16,32,1,2,8,0.025248000398278236
2048,128,512,32,128,32,2,4,8,0.024064000695943832
2048,128,512,32,32,64,5,8,8,0.02457600086927414
2048,128,512,64,32,32,5,8,8,0.024383999407291412
2048,128,512,64,128,32,5,4,8,0.0244159996509552
2048,128,512,64,16,64,2,4,8,0.023679999634623528
2048,128,512,64,32,64,2,4,8,0.024800000712275505
2048,128,512,64,64,64,3,8,8,0.02457600086927414
2048,128,512,64,128,64,5,4,8,0.024064000695943832
2048,128,512,64,32,128,3,4,8,0.02425600029528141
2048,128,512,64,32,128,4,8,8,0.024320000782608986
2048,128,512,64,64,128,3,4,8,0.02489599958062172
2048,128,512,64,128,128,4,4,8,0.02377600036561489
2048,128,512,128,32,64,3,4,8,0.02412799932062626
2048,128,512,128,32,64,4,8,8,0.023871999233961105
2048,128,512,128,32,128,2,8,8,0.02364799939095974
2048,128,512,128,32,128,3,4,8,0.023871999233961105
2048,128,512,128,64,128,3,4,8,0.024032000452280045
2048,128,512,128,64,128,5,8,8,0.023903999477624893
SAME
--------------------
32000,512,768,32,16,32,1,2,8,0.32390400767326355
32000,512,768,32,128,32,2,4,8,0.19183999300003052
32000,512,768,32,32,64,5,8,8,0.23014399409294128
32000,512,768,64,32,32,5,8,8,0.2030400037765503
32000,512,768,64,128,32,5,4,8,0.1984959989786148
32000,512,768,64,16,64,2,4,8,0.12544000148773193
32000,512,768,64,32,64,2,4,8,0.10636799782514572
32000,512,768,64,64,64,3,8,8,0.10124800354242325
32000,512,768,64,128,64,5,4,8,0.11699199676513672
32000,512,768,64,32,128,3,4,8,0.07887999713420868
32000,512,768,64,32,128,4,8,8,0.08419200032949448
32000,512,768,64,64,128,3,4,8,0.08028800040483475
32000,512,768,64,128,128,4,4,8,0.10291200131177902
32000,512,768,128,32,64,3,4,8,0.08588799834251404
32000,512,768,128,32,64,4,8,8,0.08671999722719193
32000,512,768,128,32,128,2,8,8,0.10809600353240967
32000,512,768,128,32,128,3,4,8,0.07769600301980972
32000,512,768,128,64,128,3,4,8,0.08044800162315369
32000,512,768,128,64,128,5,8,8,0.08073599636554718
SAME
--------------------
128,4096,128,32,16,32,1,2,8,0.1271360069513321
128,4096,128,32,128,32,2,4,8,0.04556800052523613
128,4096,128,32,32,64,5,8,8,0.03907199949026108
128,4096,128,64,32,32,5,8,8,0.040352001786231995
128,4096,128,64,128,32,5,4,8,0.025567999109625816
128,4096,128,64,16,64,2,4,8,0.14905600249767303
128,4096,128,64,32,64,2,4,8,0.09833600372076035
128,4096,128,64,64,64,3,8,8,0.04044799879193306
128,4096,128,64,128,64,5,4,8,0.026688000187277794
128,4096,128,64,32,128,3,4,8,0.06070400029420853
128,4096,128,64,32,128,4,8,8,0.04848000034689903
128,4096,128,64,64,128,3,4,8,0.040832001715898514
128,4096,128,64,128,128,4,4,8,0.029983999207615852
128,4096,128,128,32,64,3,4,8,0.06345599889755249
128,4096,128,128,32,64,4,8,8,0.048767998814582825
128,4096,128,128,32,128,2,8,8,0.10623999685049057
128,4096,128,128,32,128,3,4,8,0.06425599753856659
128,4096,128,128,64,128,3,4,8,0.043487999588251114
128,4096,128,128,64,128,5,8,8,0.03763199970126152
SAME
--------------------
50257,128,2048,32,16,32,1,2,8,0.37225601077079773
50257,128,2048,32,128,32,2,4,8,0.3226880133152008
50257,128,2048,32,32,64,5,8,8,0.3301439881324768
50257,128,2048,64,32,32,5,8,8,0.32307198643684387
50257,128,2048,64,128,32,5,4,8,0.2210880070924759
50257,128,2048,64,16,64,2,4,8,0.15724800527095795
50257,128,2048,64,32,64,2,4,8,0.13887999951839447
50257,128,2048,64,64,64,3,8,8,0.15852800011634827
50257,128,2048,64,128,64,5,4,8,0.1462399959564209
50257,128,2048,64,32,128,3,4,8,0.12624000012874603
50257,128,2048,64,32,128,4,8,8,0.12620800733566284
50257,128,2048,64,64,128,3,4,8,0.11763200163841248
50257,128,2048,64,128,128,4,4,8,0.12278400361537933
50257,128,2048,128,32,64,3,4,8,0.12995199859142303
50257,128,2048,128,32,64,4,8,8,0.12758399546146393
50257,128,2048,128,32,128,2,8,8,0.1337279975414276
50257,128,2048,128,32,128,3,4,8,0.1173119992017746
50257,128,2048,128,64,128,3,4,8,0.11001600325107574
50257,128,2048,128,64,128,5,8,8,0.1549759954214096
SAME
--------------------
4096,1024,50272,32,16,32,1,2,8,5.140607833862305
4096,1024,50272,32,128,32,2,4,8,2.9988479614257812
4096,1024,50272,32,32,64,5,8,8,3.5245440006256104
4096,1024,50272,64,32,32,5,8,8,3.040895938873291
4096,1024,50272,64,128,32,5,4,8,2.569888114929199
4096,1024,50272,64,16,64,2,4,8,2.152064085006714
4096,1024,50272,64,32,64,2,4,8,1.3751039505004883
4096,1024,50272,64,64,64,3,8,8,1.333184003829956
4096,1024,50272,64,128,64,5,4,8,1.5200639963150024
4096,1024,50272,64,32,128,3,4,8,1.0520000457763672
4096,1024,50272,64,32,128,4,8,8,1.0886720418930054
4096,1024,50272,64,64,128,3,4,8,0.9841920137405396
4096,1024,50272,64,128,128,4,4,8,1.2299200296401978
4096,1024,50272,128,32,64,3,4,8,1.0862079858779907
4096,1024,50272,128,32,64,4,8,8,1.091488003730774
4096,1024,50272,128,32,128,2,8,8,1.334496021270752
4096,1024,50272,128,32,128,3,4,8,0.8705919981002808
4096,1024,50272,128,64,128,3,4,8,0.8842560052871704
4096,1024,50272,128,64,128,5,8,8,0.8739839792251587
SAME
--------------------
2048,8192,256,32,16,32,1,2,8,0.2650879919528961
2048,8192,256,32,128,32,2,4,8,0.08988799899816513
2048,8192,256,32,32,64,5,8,8,0.09331200271844864
2048,8192,256,64,32,32,5,8,8,0.088128000497818
2048,8192,256,64,128,32,5,4,8,0.06617599725723267
2048,8192,256,64,16,64,2,4,8,0.2979840040206909
2048,8192,256,64,32,64,2,4,8,0.1842239946126938
2048,8192,256,64,64,64,3,8,8,0.08361600339412689
2048,8192,256,64,128,64,5,4,8,0.05446400120854378
2048,8192,256,64,32,128,3,4,8,0.11257600039243698
2048,8192,256,64,32,128,4,8,8,0.1016639992594719
2048,8192,256,64,64,128,3,4,8,0.08342400193214417
2048,8192,256,64,128,128,4,4,8,0.05804799869656563
2048,8192,256,128,32,64,3,4,8,0.11503999680280685
2048,8192,256,128,32,64,4,8,8,0.10387200117111206
2048,8192,256,128,32,128,2,8,8,0.2110079973936081
2048,8192,256,128,32,128,3,4,8,0.12236800044775009
2048,8192,256,128,64,128,3,4,8,0.088128000497818
2048,8192,256,128,64,128,5,8,8,0.06915199756622314
SAME
--------------------
768,8192,3072,32,16,32,1,2,8,0.663968026638031
768,8192,3072,32,128,32,2,4,8,0.2687680125236511
768,8192,3072,32,32,64,5,8,8,0.3203519880771637
768,8192,3072,64,32,32,5,8,8,0.2728320062160492
768,8192,3072,64,128,32,5,4,8,0.18384000658988953
768,8192,3072,64,16,64,2,4,8,0.325439989566803
768,8192,3072,64,32,64,2,4,8,0.18671999871730804
768,8192,3072,64,64,64,3,8,8,0.13840000331401825
768,8192,3072,64,128,64,5,4,8,0.11923199892044067
768,8192,3072,64,32,128,3,4,8,0.10937599837779999
768,8192,3072,64,32,128,4,8,8,0.11286400258541107
768,8192,3072,64,64,128,3,4,8,0.0942080020904541
768,8192,3072,64,128,128,4,4,8,0.11462400108575821
768,8192,3072,128,32,64,3,4,8,0.11590400338172913
768,8192,3072,128,32,64,4,8,8,0.11203200370073318
768,8192,3072,128,32,128,2,8,8,0.20457600057125092
768,8192,3072,128,32,128,3,4,8,0.11657600104808807
768,8192,3072,128,64,128,3,4,8,0.10480000078678131
768,8192,3072,128,64,128,5,8,8,0.11369600147008896
SAME
--------------------
512,4096,384,32,16,32,1,2,8,0.1353919953107834
512,4096,384,32,128,32,2,4,8,0.04787199944257736
512,4096,384,32,32,64,5,8,8,0.0416640006005764
512,4096,384,64,32,32,5,8,8,0.04243199899792671
512,4096,384,64,128,32,5,4,8,0.02735999971628189
512,4096,384,64,16,64,2,4,8,0.1504960060119629
512,4096,384,64,32,64,2,4,8,0.09779199957847595
512,4096,384,64,64,64,3,8,8,0.043007999658584595
512,4096,384,64,128,64,5,4,8,0.027712000533938408
512,4096,384,64,32,128,3,4,8,0.06080000102519989
512,4096,384,64,32,128,4,8,8,0.04918399825692177
512,4096,384,64,64,128,3,4,8,0.04275200143456459
512,4096,384,64,128,128,4,4,8,0.03155200183391571
512,4096,384,128,32,64,3,4,8,0.06393600255250931
512,4096,384,128,32,64,4,8,8,0.050335999578237534
512,4096,384,128,32,128,2,8,8,0.1074879989027977
512,4096,384,128,32,128,3,4,8,0.06569600105285645
512,4096,384,128,64,128,3,4,8,0.04505600035190582
512,4096,384,128,64,128,5,8,8,0.03884800150990486
SAME
--------------------
2048,768,3072,32,16,32,1,2,8,0.1342719942331314
2048,768,3072,32,128,32,2,4,8,0.08591999858617783
2048,768,3072,32,32,64,5,8,8,0.10355199873447418
2048,768,3072,64,32,32,5,8,8,0.09334400296211243
2048,768,3072,64,128,32,5,4,8,0.08367999643087387
2048,768,3072,64,16,64,2,4,8,0.0684799998998642
2048,768,3072,64,32,64,2,4,8,0.052960000932216644
2048,768,3072,64,64,64,3,8,8,0.04403200000524521
2048,768,3072,64,128,64,5,4,8,0.05615999922156334
2048,768,3072,64,32,128,3,4,8,0.03827200084924698
2048,768,3072,64,32,128,4,8,8,0.039264000952243805
2048,768,3072,64,64,128,3,4,8,0.035679999738931656
2048,768,3072,64,128,128,4,4,8,0.04598399996757507
2048,768,3072,128,32,64,3,4,8,0.04195199906826019
2048,768,3072,128,32,64,4,8,8,0.03951999917626381
2048,768,3072,128,32,128,2,8,8,0.04950400069355965
2048,768,3072,128,32,128,3,4,8,0.03356799855828285
2048,768,3072,128,64,128,3,4,8,0.0390079990029335
2048,768,3072,128,64,128,5,8,8,0.036928001791238785
SAME
--------------------
2048,8192,512,32,16,32,1,2,8,0.28995200991630554
2048,8192,512,32,128,32,2,4,8,0.14902399480342865
2048,8192,512,32,32,64,5,8,8,0.14608000218868256
2048,8192,512,64,32,32,5,8,8,0.12537600100040436
2048,8192,512,64,128,32,5,4,8,0.10102400183677673
2048,8192,512,64,16,64,2,4,8,0.3010239899158478
2048,8192,512,64,32,64,2,4,8,0.1817920058965683
2048,8192,512,64,64,64,3,8,8,0.08524800091981888
2048,8192,512,64,128,64,5,4,8,0.0711359977722168
2048,8192,512,64,32,128,3,4,8,0.11622399836778641
2048,8192,512,64,32,128,4,8,8,0.09958399832248688
2048,8192,512,64,64,128,3,4,8,0.0835840031504631
2048,8192,512,64,128,128,4,4,8,0.06099199876189232
2048,8192,512,128,32,64,3,4,8,0.11398400366306305
2048,8192,512,128,32,64,4,8,8,0.10316800326108932
2048,8192,512,128,32,128,2,8,8,0.20108799636363983
2048,8192,512,128,32,128,3,4,8,0.11552000045776367
2048,8192,512,128,64,128,3,4,8,0.08710400015115738
2048,8192,512,128,64,128,5,8,8,0.06976000219583511
SAME
--------------------
2048,50008,768,32,16,32,1,2,8,2.9469759464263916
2048,50008,768,32,128,32,2,4,8,1.441375970840454
2048,50008,768,32,32,64,5,8,8,1.3154560327529907
2048,50008,768,64,32,32,5,8,8,1.4022719860076904
2048,50008,768,64,128,32,5,4,8,1.0073920488357544
2048,50008,768,64,16,64,2,4,8,1.8253120183944702
2048,50008,768,64,32,64,2,4,8,1.0592319965362549
2048,50008,768,64,64,64,3,8,8,0.6271039843559265
2048,50008,768,64,128,64,5,4,8,0.5951679944992065
2048,50008,768,64,32,128,3,4,8,0.6000959873199463
2048,50008,768,64,32,128,4,8,8,0.5406720042228699
2048,50008,768,64,64,128,3,4,8,0.4622719883918762
2048,50008,768,64,128,128,4,4,8,0.46303999423980713
2048,50008,768,128,32,64,3,4,8,0.6886720061302185
2048,50008,768,128,32,64,4,8,8,0.6564800143241882
2048,50008,768,128,32,128,2,8,8,1.2479360103607178
2048,50008,768,128,32,128,3,4,8,0.6413120031356812
2048,50008,768,128,64,128,3,4,8,0.4094400107860565
2048,50008,768,128,64,128,5,8,8,0.3943359851837158
SAME
--------------------
50358,1024,768,32,16,32,1,2,8,0.9804159998893738
50358,1024,768,32,128,32,2,4,8,0.5641279816627502
50358,1024,768,32,32,64,5,8,8,0.6690880060195923
50358,1024,768,64,32,32,5,8,8,0.5751360058784485
50358,1024,768,64,128,32,5,4,8,0.44047999382019043
50358,1024,768,64,16,64,2,4,8,0.34067198634147644
50358,1024,768,64,32,64,2,4,8,0.2457599937915802
50358,1024,768,64,64,64,3,8,8,0.24323199689388275
50358,1024,768,64,128,64,5,4,8,0.2747519910335541
50358,1024,768,64,32,128,3,4,8,0.18192000687122345
50358,1024,768,64,32,128,4,8,8,0.19753600656986237
50358,1024,768,64,64,128,3,4,8,0.17430399358272552
50358,1024,768,64,128,128,4,4,8,0.22547200322151184
50358,1024,768,128,32,64,3,4,8,0.20428800582885742
50358,1024,768,128,32,64,4,8,8,0.2048639953136444
50358,1024,768,128,32,128,2,8,8,0.2511039972305298
50358,1024,768,128,32,128,3,4,8,0.16371199488639832
50358,1024,768,128,64,128,3,4,8,0.1674879938364029
50358,1024,768,128,64,128,5,8,8,0.16422399878501892
SAME
--------------------
1024,30000,128,32,16,32,1,2,8,0.9616320133209229
1024,30000,128,32,128,32,2,4,8,0.21699200570583344
1024,30000,128,32,32,64,5,8,8,0.1934400051832199
1024,30000,128,64,32,32,5,8,8,0.194240003824234
1024,30000,128,64,128,32,5,4,8,0.10127999633550644
1024,30000,128,64,16,64,2,4,8,1.1372480392456055
1024,30000,128,64,32,64,2,4,8,0.635487973690033
1024,30000,128,64,64,64,3,8,8,0.2062080055475235
1024,30000,128,64,128,64,5,4,8,0.11081600189208984
1024,30000,128,64,32,128,3,4,8,0.34969601035118103
1024,30000,128,64,32,128,4,8,8,0.26159998774528503
1024,30000,128,64,64,128,3,4,8,0.2040960043668747
1024,30000,128,64,128,128,4,4,8,0.11900799721479416
1024,30000,128,128,32,64,3,4,8,0.36873599886894226
1024,30000,128,128,32,64,4,8,8,0.27375999093055725
1024,30000,128,128,32,128,2,8,8,0.7462720274925232
1024,30000,128,128,32,128,3,4,8,0.3880000114440918
1024,30000,128,128,64,128,3,4,8,0.23132799565792084
1024,30000,128,128,64,128,5,8,8,0.1738560050725937
SAME
--------------------
4096,50272,1024,32,16,32,1,2,8,4.907264232635498
4096,50272,1024,32,128,32,2,4,8,2.954591989517212
4096,50272,1024,32,32,64,5,8,8,3.38700795173645
4096,50272,1024,64,32,32,5,8,8,3.15116810798645
4096,50272,1024,64,128,32,5,4,8,2.149247884750366
4096,50272,1024,64,16,64,2,4,8,1.861024022102356
4096,50272,1024,64,32,64,2,4,8,1.2709120512008667
4096,50272,1024,64,64,64,3,8,8,1.538432002067566
4096,50272,1024,64,128,64,5,4,8,1.4499200582504272
4096,50272,1024,64,32,128,3,4,8,0.951744019985199
4096,50272,1024,64,32,128,4,8,8,1.1159679889678955
4096,50272,1024,64,64,128,3,4,8,0.9968960285186768
4096,50272,1024,64,128,128,4,4,8,0.9318079948425293
4096,50272,1024,128,32,64,3,4,8,1.0566719770431519
4096,50272,1024,128,32,64,4,8,8,1.2507840394973755
4096,50272,1024,128,32,128,2,8,8,1.1681280136108398
4096,50272,1024,128,32,128,3,4,8,0.7782400250434875
4096,50272,1024,128,64,128,3,4,8,0.7125440239906311
4096,50272,1024,128,64,128,5,8,8,0.7992640137672424
SAME
--------------------
3072,8192,768,32,16,32,1,2,8,0.6650879979133606
3072,8192,768,32,128,32,2,4,8,0.2757759988307953
3072,8192,768,32,32,64,5,8,8,0.32099199295043945
3072,8192,768,64,32,32,5,8,8,0.2741760015487671
3072,8192,768,64,128,32,5,4,8,0.18272000551223755
3072,8192,768,64,16,64,2,4,8,0.31327998638153076
3072,8192,768,64,32,64,2,4,8,0.18758399784564972
3072,8192,768,64,64,64,3,8,8,0.13699199259281158
3072,8192,768,64,128,64,5,4,8,0.118367999792099
3072,8192,768,64,32,128,3,4,8,0.1189119964838028
3072,8192,768,64,32,128,4,8,8,0.11299200356006622
3072,8192,768,64,64,128,3,4,8,0.10009600222110748
3072,8192,768,64,128,128,4,4,8,0.11619199812412262
3072,8192,768,128,32,64,3,4,8,0.12412799894809723
3072,8192,768,128,32,64,4,8,8,0.11235199868679047
3072,8192,768,128,32,128,2,8,8,0.20505599677562714
3072,8192,768,128,32,128,3,4,8,0.12598399817943573
3072,8192,768,128,64,128,3,4,8,0.10691200196743011
3072,8192,768,128,64,128,5,8,8,0.1149120032787323
SAME
--------------------
1024,512,256,32,16,32,1,2,8,0.032575998455286026
1024,512,256,32,128,32,2,4,8,0.024064000695943832
1024,512,256,32,32,64,5,8,8,0.024447999894618988
1024,512,256,64,32,32,5,8,8,0.02396799996495247
1024,512,256,64,128,32,5,4,8,0.024992000311613083
1024,512,256,64,16,64,2,4,8,0.033055998384952545
1024,512,256,64,32,64,2,4,8,0.026688000187277794
1024,512,256,64,64,64,3,8,8,0.02486399933695793
1024,512,256,64,128,64,5,4,8,0.024159999564290047
1024,512,256,64,32,128,3,4,8,0.02486399933695793
1024,512,256,64,32,128,4,8,8,0.024800000712275505
1024,512,256,64,64,128,3,4,8,0.024831999093294144
1024,512,256,64,128,128,4,4,8,0.02486399933695793
1024,512,256,128,32,64,3,4,8,0.024927999824285507
1024,512,256,128,32,64,4,8,8,0.024320000782608986
1024,512,256,128,32,128,2,8,8,0.029152000322937965
1024,512,256,128,32,128,3,4,8,0.026367999613285065
1024,512,256,128,64,128,3,4,8,0.025567999109625816
1024,512,256,128,64,128,5,8,8,0.02457600086927414
SAME
--------------------
128,4096,512,32,16,32,1,2,8,0.13887999951839447
128,4096,512,32,128,32,2,4,8,0.0480320006608963
128,4096,512,32,32,64,5,8,8,0.04095999896526337
128,4096,512,64,32,32,5,8,8,0.04163200035691261
128,4096,512,64,128,32,5,4,8,0.026688000187277794
128,4096,512,64,16,64,2,4,8,0.15254400670528412
128,4096,512,64,32,64,2,4,8,0.09824000298976898
128,4096,512,64,64,64,3,8,8,0.042208001017570496
128,4096,512,64,128,64,5,4,8,0.026944000273942947
128,4096,512,64,32,128,3,4,8,0.06032000109553337
128,4096,512,64,32,128,4,8,8,0.04825599864125252
128,4096,512,64,64,128,3,4,8,0.042527999728918076
128,4096,512,64,128,128,4,4,8,0.030880000442266464
128,4096,512,128,32,64,3,4,8,0.06278400123119354
128,4096,512,128,32,64,4,8,8,0.049215998500585556
128,4096,512,128,32,128,2,8,8,0.1090880036354065
128,4096,512,128,32,128,3,4,8,0.06505600363016129
128,4096,512,128,64,128,3,4,8,0.04438399896025658
128,4096,512,128,64,128,5,8,8,0.03824000060558319
SAME
--------------------
8192,512,2048,32,16,32,1,2,8,0.2221439927816391
8192,512,2048,32,128,32,2,4,8,0.13238400220870972
8192,512,2048,32,32,64,5,8,8,0.15964800119400024
8192,512,2048,64,32,32,5,8,8,0.14368000626564026
8192,512,2048,64,128,32,5,4,8,0.1366720050573349
8192,512,2048,64,16,64,2,4,8,0.0960640013217926
8192,512,2048,64,32,64,2,4,8,0.07372800260782242
8192,512,2048,64,64,64,3,8,8,0.07142399996519089
8192,512,2048,64,128,64,5,4,8,0.09440000355243683
8192,512,2048,64,32,128,3,4,8,0.06095999851822853
8192,512,2048,64,32,128,4,8,8,0.06063999980688095
8192,512,2048,64,64,128,3,4,8,0.05769599974155426
8192,512,2048,64,128,128,4,4,8,0.07344000041484833
8192,512,2048,128,32,64,3,4,8,0.0613120011985302
8192,512,2048,128,32,64,4,8,8,0.060416001826524734
8192,512,2048,128,32,128,2,8,8,0.06723199784755707
8192,512,2048,128,32,128,3,4,8,0.05584000051021576
8192,512,2048,128,64,128,3,4,8,0.055424001067876816
8192,512,2048,128,64,128,5,8,8,0.05686400085687637
SAME
--------------------
128,1024,4096,32,16,32,1,2,8,0.055135998874902725
128,1024,4096,32,128,32,2,4,8,0.028384000062942505
128,1024,4096,32,32,64,5,8,8,0.02672000043094158
128,1024,4096,64,32,32,5,8,8,0.026367999613285065
128,1024,4096,64,128,32,5,4,8,0.025919999927282333
128,1024,4096,64,16,64,2,4,8,0.0562559999525547
128,1024,4096,64,32,64,2,4,8,0.039103999733924866
128,1024,4096,64,64,64,3,8,8,0.025696000084280968
128,1024,4096,64,128,64,5,4,8,0.024064000695943832
128,1024,4096,64,32,128,3,4,8,0.02969600073993206
128,1024,4096,64,32,128,4,8,8,0.026976000517606735
128,1024,4096,64,64,128,3,4,8,0.02643200010061264
128,1024,4096,64,128,128,4,4,8,0.025087999179959297
128,1024,4096,128,32,64,3,4,8,0.03283200040459633
128,1024,4096,128,32,64,4,8,8,0.027168000116944313
128,1024,4096,128,32,128,2,8,8,0.0414079986512661
128,1024,4096,128,32,128,3,4,8,0.03440000116825104
128,1024,4096,128,64,128,3,4,8,0.029632000252604485
128,1024,4096,128,64,128,5,8,8,0.02579200081527233
SAME
--------------------
512,4096,1024,32,16,32,1,2,8,0.14713600277900696
512,4096,1024,32,128,32,2,4,8,0.05484800040721893
512,4096,1024,32,32,64,5,8,8,0.05407999828457832
512,4096,1024,64,32,32,5,8,8,0.0488319993019104
512,4096,1024,64,128,32,5,4,8,0.038784001022577286
512,4096,1024,64,16,64,2,4,8,0.1544959992170334
512,4096,1024,64,32,64,2,4,8,0.10156799852848053
512,4096,1024,64,64,64,3,8,8,0.04608000069856644
512,4096,1024,64,128,64,5,4,8,0.029983999207615852
512,4096,1024,64,32,128,3,4,8,0.06464000046253204
512,4096,1024,64,32,128,4,8,8,0.05142400041222572
512,4096,1024,64,64,128,3,4,8,0.04569600149989128
512,4096,1024,64,128,128,4,4,8,0.03219199925661087
512,4096,1024,128,32,64,3,4,8,0.0663679987192154
512,4096,1024,128,32,64,4,8,8,0.05251200124621391
512,4096,1024,128,32,128,2,8,8,0.1082879975438118
512,4096,1024,128,32,128,3,4,8,0.06966400146484375
512,4096,1024,128,64,128,3,4,8,0.04912000149488449
512,4096,1024,128,64,128,5,8,8,0.03903999924659729
SAME
--------------------
8192,768,768,32,16,32,1,2,8,0.1324480026960373
8192,768,768,32,128,32,2,4,8,0.08575999736785889
8192,768,768,32,32,64,5,8,8,0.10316800326108932
8192,768,768,64,32,32,5,8,8,0.09455999732017517
8192,768,768,64,128,32,5,4,8,0.08220800012350082
8192,768,768,64,16,64,2,4,8,0.0729919970035553
8192,768,768,64,32,64,2,4,8,0.05660799890756607
8192,768,768,64,64,64,3,8,8,0.04614400118589401
8192,768,768,64,128,64,5,4,8,0.05673599988222122
8192,768,768,64,32,128,3,4,8,0.04364800080657005
8192,768,768,64,32,128,4,8,8,0.04131200164556503
8192,768,768,64,64,128,3,4,8,0.037728000432252884
8192,768,768,64,128,128,4,4,8,0.04726399853825569
8192,768,768,128,32,64,3,4,8,0.04800000041723251
8192,768,768,128,32,64,4,8,8,0.04224000126123428
8192,768,768,128,32,128,2,8,8,0.05862399935722351
8192,768,768,128,32,128,3,4,8,0.037376001477241516
8192,768,768,128,64,128,3,4,8,0.041728001087903976
8192,768,768,128,64,128,5,8,8,0.03916800022125244
SAME
--------------------
2048,768,768,32,16,32,1,2,8,0.047839999198913574
2048,768,768,32,128,32,2,4,8,0.036448001861572266
2048,768,768,32,32,64,5,8,8,0.03852799907326698
2048,768,768,64,32,32,5,8,8,0.03718400001525879
2048,768,768,64,128,32,5,4,8,0.03519999980926514
2048,768,768,64,16,64,2,4,8,0.04396799951791763
2048,768,768,64,32,64,2,4,8,0.033344000577926636
2048,768,768,64,64,64,3,8,8,0.02505600079894066
2048,768,768,64,128,64,5,4,8,0.027295999228954315
2048,768,768,64,32,128,3,4,8,0.027168000116944313
2048,768,768,64,32,128,4,8,8,0.025087999179959297
2048,768,768,64,64,128,3,4,8,0.02534399926662445
2048,768,768,64,128,128,4,4,8,0.027456000447273254
2048,768,768,128,32,64,3,4,8,0.02940800040960312
2048,768,768,128,32,64,4,8,8,0.025248000398278236
2048,768,768,128,32,128,2,8,8,0.035679999738931656
2048,768,768,128,32,128,3,4,8,0.031072000041604042
2048,768,768,128,64,128,3,4,8,0.027744000777602196
2048,768,768,128,64,128,5,8,8,0.024607999250292778
SAME
--------------------
512,2048,128,32,16,32,1,2,8,0.07619199901819229
512,2048,128,32,128,32,2,4,8,0.03206399828195572
512,2048,128,32,32,64,5,8,8,0.028095999732613564
512,2048,128,64,32,32,5,8,8,0.02812799997627735
512,2048,128,64,128,32,5,4,8,0.02505600079894066
512,2048,128,64,16,64,2,4,8,0.0843840017914772
512,2048,128,64,32,64,2,4,8,0.056703999638557434
512,2048,128,64,64,64,3,8,8,0.028704000636935234
512,2048,128,64,128,64,5,4,8,0.024480000138282776
512,2048,128,64,32,128,3,4,8,0.038784001022577286
512,2048,128,64,32,128,4,8,8,0.03209599852561951
512,2048,128,64,64,128,3,4,8,0.02940800040960312
512,2048,128,64,128,128,4,4,8,0.024512000381946564
512,2048,128,128,32,64,3,4,8,0.039903998374938965
512,2048,128,128,32,64,4,8,8,0.03248000144958496
512,2048,128,128,32,128,2,8,8,0.0634239986538887
512,2048,128,128,32,128,3,4,8,0.04188799858093262
512,2048,128,128,64,128,3,4,8,0.031199999153614044
512,2048,128,128,64,128,5,8,8,0.026976000517606735
SAME
--------------------
4096,4096,1024,32,16,32,1,2,8,0.4368000030517578
4096,4096,1024,32,128,32,2,4,8,0.22550399601459503
4096,4096,1024,32,32,64,5,8,8,0.2839680016040802
4096,4096,1024,64,32,32,5,8,8,0.2468159943819046
4096,4096,1024,64,128,32,5,4,8,0.1653120070695877
4096,4096,1024,64,16,64,2,4,8,0.17158399522304535
4096,4096,1024,64,32,64,2,4,8,0.11404799669981003
4096,4096,1024,64,64,64,3,8,8,0.11456000059843063
4096,4096,1024,64,128,64,5,4,8,0.11151999980211258
4096,4096,1024,64,32,128,3,4,8,0.09116800129413605
4096,4096,1024,64,32,128,4,8,8,0.09504000097513199
4096,4096,1024,64,64,128,3,4,8,0.09520000219345093
4096,4096,1024,64,128,128,4,4,8,0.08848000317811966
4096,4096,1024,128,32,64,3,4,8,0.09641599655151367
4096,4096,1024,128,32,64,4,8,8,0.09881599992513657
4096,4096,1024,128,32,128,2,8,8,0.1151999980211258
4096,4096,1024,128,32,128,3,4,8,0.09267199784517288
4096,4096,1024,128,64,128,3,4,8,0.07276800274848938
4096,4096,1024,128,64,128,5,8,8,0.0769599974155426
SAME
--------------------
128112,256,1024,32,16,32,1,2,8,0.8776959776878357
128112,256,1024,32,128,32,2,4,8,0.5655999779701233
128112,256,1024,32,32,64,5,8,8,0.6856319904327393
128112,256,1024,64,32,32,5,8,8,0.6290559768676758
128112,256,1024,64,128,32,5,4,8,0.8171200156211853
128112,256,1024,64,16,64,2,4,8,0.3375360071659088
128112,256,1024,64,32,64,2,4,8,0.27456000447273254
128112,256,1024,64,64,64,3,8,8,0.2914240062236786
128112,256,1024,64,128,64,5,4,8,0.48982399702072144
128112,256,1024,64,32,128,3,4,8,0.2189439982175827
128112,256,1024,64,32,128,4,8,8,0.2364799976348877
128112,256,1024,64,64,128,3,4,8,0.22675199806690216
128112,256,1024,64,128,128,4,4,8,0.31753599643707275
128112,256,1024,128,32,64,3,4,8,0.23375999927520752
128112,256,1024,128,32,64,4,8,8,0.2425280064344406
128112,256,1024,128,32,128,2,8,8,0.26281601190567017
128112,256,1024,128,32,128,3,4,8,0.21289600431919098
128112,256,1024,128,64,128,3,4,8,0.20095999538898468
128112,256,1024,128,64,128,5,8,8,0.22604799270629883
SAME
--------------------
8192,30522,768,32,16,32,1,2,8,5.470592021942139
8192,30522,768,32,128,32,2,4,8,3.45686411857605
8192,30522,768,32,32,64,5,8,8,3.3262081146240234
8192,30522,768,64,32,32,5,8,8,5.9725117683410645
8192,30522,768,64,128,32,5,4,8,3.5393919944763184
8192,30522,768,64,16,64,2,4,8,2.5005760192871094
8192,30522,768,64,32,64,2,4,8,1.833407998085022
8192,30522,768,64,64,64,3,8,8,2.5554559230804443
8192,30522,768,64,128,64,5,4,8,1.9540480375289917
8192,30522,768,64,32,128,3,4,8,1.3307199478149414
8192,30522,768,64,32,128,4,8,8,1.4346879720687866
8192,30522,768,64,64,128,3,4,8,1.1350079774856567
8192,30522,768,64,128,128,4,4,8,1.3196159601211548
8192,30522,768,128,32,64,3,4,8,1.6664639711380005
8192,30522,768,128,32,64,4,8,8,1.767359972000122
8192,30522,768,128,32,128,2,8,8,1.636672019958496
8192,30522,768,128,32,128,3,4,8,1.2741440534591675
8192,30522,768,128,64,128,3,4,8,1.2065600156784058
8192,30522,768,128,64,128,5,8,8,1.1730879545211792
SAME
--------------------
2,16,768,16,16,32,1,2,8,0.024960000067949295
2,16,768,16,16,32,2,2,8,0.024480000138282776
2,16,768,16,16,64,5,4,8,0.024000000208616257
2,16,768,16,16,32,5,2,8,0.024000000208616257
2,16,768,16,16,64,2,4,8,0.02304000034928322
2,16,768,16,16,64,3,4,8,0.023423999547958374
2,16,768,16,16,128,3,4,8,0.024831999093294144
2,16,768,16,16,128,4,8,8,0.023455999791622162
2,16,768,16,16,128,4,4,8,0.023296000435948372
2,16,768,16,16,64,4,4,8,0.02473600022494793
2,16,768,16,16,128,2,8,8,0.02457600086927414
2,16,768,16,16,128,5,8,8,0.024159999564290047
SAME
--------------------
1024,512,1024,32,16,32,1,2,8,0.035360001027584076
1024,512,1024,32,128,32,2,4,8,0.026847999542951584
1024,512,1024,32,32,64,5,8,8,0.02707199938595295
1024,512,1024,64,32,32,5,8,8,0.025855999439954758
1024,512,1024,64,128,32,5,4,8,0.0272000003606081
1024,512,1024,64,16,64,2,4,8,0.03494400158524513
1024,512,1024,64,32,64,2,4,8,0.02800000086426735
1024,512,1024,64,64,64,3,8,8,0.024512000381946564
1024,512,1024,64,128,64,5,4,8,0.025248000398278236
1024,512,1024,64,32,128,3,4,8,0.02396799996495247
1024,512,1024,64,32,128,4,8,8,0.024480000138282776
1024,512,1024,64,64,128,3,4,8,0.024447999894618988
1024,512,1024,64,128,128,4,4,8,0.02470399998128414
1024,512,1024,128,32,64,3,4,8,0.026335999369621277
1024,512,1024,128,32,64,4,8,8,0.025855999439954758
1024,512,1024,128,32,128,2,8,8,0.02828799933195114
1024,512,1024,128,32,128,3,4,8,0.02643200010061264
1024,512,1024,128,64,128,3,4,8,0.024607999250292778
1024,512,1024,128,64,128,5,8,8,0.0244159996509552
SAME
--------------------
512,2048,384,32,16,32,1,2,8,0.0833280012011528
512,2048,384,32,128,32,2,4,8,0.03174399957060814
512,2048,384,32,32,64,5,8,8,0.02953599952161312
512,2048,384,64,32,32,5,8,8,0.029120000079274178
512,2048,384,64,128,32,5,4,8,0.026528000831604004
512,2048,384,64,16,64,2,4,8,0.09030400216579437
512,2048,384,64,32,64,2,4,8,0.05724800005555153
512,2048,384,64,64,64,3,8,8,0.029055999591946602
512,2048,384,64,128,64,5,4,8,0.025119999423623085
512,2048,384,64,32,128,3,4,8,0.03948799893260002
512,2048,384,64,32,128,4,8,8,0.0326399989426136
512,2048,384,64,64,128,3,4,8,0.03049599938094616
512,2048,384,64,128,128,4,4,8,0.025407999753952026
512,2048,384,128,32,64,3,4,8,0.04095999896526337
512,2048,384,128,32,64,4,8,8,0.0331839993596077
512,2048,384,128,32,128,2,8,8,0.06403200328350067
512,2048,384,128,32,128,3,4,8,0.041728001087903976
512,2048,384,128,64,128,3,4,8,0.03219199925661087
512,2048,384,128,64,128,5,8,8,0.02755199931561947
SAME
--------------------
2048,3072,768,32,16,32,1,2,8,0.12591999769210815
2048,3072,768,32,128,32,2,4,8,0.09270399808883667
2048,3072,768,32,32,64,5,8,8,0.10092800110578537
2048,3072,768,64,32,32,5,8,8,0.08947200328111649
2048,3072,768,64,128,32,5,4,8,0.0652799978852272
2048,3072,768,64,16,64,2,4,8,0.11628799885511398
2048,3072,768,64,32,64,2,4,8,0.08607999980449677
2048,3072,768,64,64,64,3,8,8,0.0435199998319149
2048,3072,768,64,128,64,5,4,8,0.045823998749256134
2048,3072,768,64,32,128,3,4,8,0.05795200169086456
2048,3072,768,64,32,128,4,8,8,0.050016000866889954
2048,3072,768,64,64,128,3,4,8,0.04428799822926521
2048,3072,768,64,128,128,4,4,8,0.045471999794244766
2048,3072,768,128,32,64,3,4,8,0.060127999633550644
2048,3072,768,128,32,64,4,8,8,0.05040000006556511
2048,3072,768,128,32,128,2,8,8,0.091839998960495
2048,3072,768,128,32,128,3,4,8,0.06080000102519989
2048,3072,768,128,64,128,3,4,8,0.04495999962091446
2048,3072,768,128,64,128,5,8,8,0.0382080003619194
SAME
--------------------
2048,2304,768,32,16,32,1,2,8,0.10911999642848969
2048,2304,768,32,128,32,2,4,8,0.07225599884986877
2048,2304,768,32,32,64,5,8,8,0.07846400141716003
2048,2304,768,64,32,32,5,8,8,0.07036799937486649
2048,2304,768,64,128,32,5,4,8,0.05446400120854378
2048,2304,768,64,16,64,2,4,8,0.1019200012087822
2048,2304,768,64,32,64,2,4,8,0.0681919977068901
2048,2304,768,64,64,64,3,8,8,0.03654399886727333
2048,2304,768,64,128,64,5,4,8,0.04047999903559685
2048,2304,768,64,32,128,3,4,8,0.047680001705884933
2048,2304,768,64,32,128,4,8,8,0.0416640006005764
2048,2304,768,64,64,128,3,4,8,0.03683200106024742
2048,2304,768,64,128,128,4,4,8,0.03916800022125244
2048,2304,768,128,32,64,3,4,8,0.049247998744249344
2048,2304,768,128,32,64,4,8,8,0.0424639992415905
2048,2304,768,128,32,128,2,8,8,0.07305599749088287
2048,2304,768,128,32,128,3,4,8,0.050335999578237534
2048,2304,768,128,64,128,3,4,8,0.038015998899936676
2048,2304,768,128,64,128,5,8,8,0.03363199904561043
SAME
--------------------
2,1024,1024,16,16,32,1,2,8,0.05283199995756149
2,1024,1024,16,128,32,2,2,8,0.024992000311613083
2,1024,1024,16,32,64,5,4,8,0.02489599958062172
2,1024,1024,16,32,32,5,2,8,0.024671999737620354
2,1024,1024,16,128,32,5,2,8,0.024447999894618988
2,1024,1024,16,16,64,2,4,8,0.05164799839258194
2,1024,1024,16,32,64,2,4,8,0.036639999598264694
2,1024,1024,16,64,64,3,4,8,0.02505600079894066
2,1024,1024,16,128,64,5,4,8,0.024927999824285507
2,1024,1024,16,32,128,3,4,8,0.028575999662280083
2,1024,1024,16,32,128,4,8,8,0.026496000587940216
2,1024,1024,16,64,128,3,4,8,0.027008000761270523
2,1024,1024,16,128,128,4,4,8,0.025599999353289604
2,1024,1024,16,32,64,3,4,8,0.027424000203609467
2,1024,1024,16,32,64,4,4,8,0.025119999423623085
2,1024,1024,16,32,128,2,8,8,0.03888000175356865
2,1024,1024,16,64,128,5,8,8,0.02486399933695793
SAME
--------------------
1024,512,4096,32,16,32,1,2,8,0.0729919970035553
1024,512,4096,32,128,32,2,4,8,0.050592001527547836
1024,512,4096,32,32,64,5,8,8,0.05628800019621849
1024,512,4096,64,32,32,5,8,8,0.05241600051522255
1024,512,4096,64,128,32,5,4,8,0.05318399891257286
1024,512,4096,64,16,64,2,4,8,0.03836800158023834
1024,512,4096,64,32,64,2,4,8,0.030271999537944794
1024,512,4096,64,64,64,3,8,8,0.030527999624609947
1024,512,4096,64,128,64,5,4,8,0.039455998688936234
1024,512,4096,64,32,128,3,4,8,0.02598400041460991
1024,512,4096,64,32,128,4,8,8,0.026655999943614006
1024,512,4096,64,64,128,3,4,8,0.028672000393271446
1024,512,4096,64,128,128,4,4,8,0.033344000577926636
1024,512,4096,128,32,64,3,4,8,0.027424000203609467
1024,512,4096,128,32,64,4,8,8,0.027712000533938408
1024,512,4096,128,32,128,2,8,8,0.031007999554276466
1024,512,4096,128,32,128,3,4,8,0.02735999971628189
1024,512,4096,128,64,128,3,4,8,0.026048000901937485
1024,512,4096,128,64,128,5,8,8,0.027712000533938408
SAME
--------------------
512,2048,512,32,16,32,1,2,8,0.08595199882984161
512,2048,512,32,128,32,2,4,8,0.033984001725912094
512,2048,512,32,32,64,5,8,8,0.029632000252604485
512,2048,512,64,32,32,5,8,8,0.02937600016593933
512,2048,512,64,128,32,5,4,8,0.02687999978661537
512,2048,512,64,16,64,2,4,8,0.09148799628019333
512,2048,512,64,32,64,2,4,8,0.057472001761198044
512,2048,512,64,64,64,3,8,8,0.030368000268936157
512,2048,512,64,128,64,5,4,8,0.026208000257611275
512,2048,512,64,32,128,3,4,8,0.03936000168323517
512,2048,512,64,32,128,4,8,8,0.03299200162291527
512,2048,512,64,64,128,3,4,8,0.030751999467611313
512,2048,512,64,128,128,4,4,8,0.02582399919629097
512,2048,512,128,32,64,3,4,8,0.041120000183582306
512,2048,512,128,32,64,4,8,8,0.033952001482248306
512,2048,512,128,32,128,2,8,8,0.06348799914121628
512,2048,512,128,32,128,3,4,8,0.042367998510599136
512,2048,512,128,64,128,3,4,8,0.03311999887228012
512,2048,512,128,64,128,5,8,8,0.02864000014960766
SAME
--------------------
256,8192,2048,32,16,32,1,2,8,0.2983039915561676
256,8192,2048,32,128,32,2,4,8,0.0923520028591156
256,8192,2048,32,32,64,5,8,8,0.09087999910116196
256,8192,2048,64,32,32,5,8,8,0.08204799890518188
256,8192,2048,64,128,32,5,4,8,0.0642239972949028
256,8192,2048,64,16,64,2,4,8,0.31724798679351807
256,8192,2048,64,32,64,2,4,8,0.18400000035762787
256,8192,2048,64,64,64,3,8,8,0.07919999957084656
256,8192,2048,64,128,64,5,4,8,0.05142400041222572
256,8192,2048,64,32,128,3,4,8,0.11417599767446518
256,8192,2048,64,32,128,4,8,8,0.0915519967675209
256,8192,2048,64,64,128,3,4,8,0.08140800148248672
256,8192,2048,64,128,128,4,4,8,0.05558399856090546
256,8192,2048,128,32,64,3,4,8,0.11791999638080597
256,8192,2048,128,32,64,4,8,8,0.09414400160312653
256,8192,2048,128,32,128,2,8,8,0.20025600492954254
256,8192,2048,128,32,128,3,4,8,0.13340799510478973
256,8192,2048,128,64,128,3,4,8,0.08550400286912918
256,8192,2048,128,64,128,5,8,8,0.06377600133419037
SAME
--------------------
2,4096,768,16,16,32,1,2,8,0.14083200693130493
2,4096,768,16,128,32,2,2,8,0.04710400104522705
2,4096,768,16,32,64,5,4,8,0.04022400081157684
2,4096,768,16,32,32,5,2,8,0.03964800015091896
2,4096,768,16,128,32,5,2,8,0.0272000003606081
2,4096,768,16,16,64,2,4,8,0.14505599439144135
2,4096,768,16,32,64,2,4,8,0.09523200243711472
2,4096,768,16,64,64,3,4,8,0.04335999861359596
2,4096,768,16,128,64,5,4,8,0.02828799933195114
2,4096,768,16,32,128,3,4,8,0.06492800265550613
2,4096,768,16,32,128,4,8,8,0.04816000163555145
2,4096,768,16,64,128,3,4,8,0.04879999905824661
2,4096,768,16,128,128,4,4,8,0.03296000137925148
2,4096,768,16,32,64,3,4,8,0.05862399935722351
2,4096,768,16,32,64,4,4,8,0.04639999940991402
2,4096,768,16,32,128,2,8,8,0.10188800096511841
2,4096,768,16,64,128,5,8,8,0.03558399900794029
SAME
--------------------
2,1024,4096,16,16,32,1,2,8,0.05632000043988228
2,1024,4096,16,128,32,2,2,8,0.02755199931561947
2,1024,4096,16,32,64,5,4,8,0.025439999997615814
2,1024,4096,16,32,32,5,2,8,0.026367999613285065
2,1024,4096,16,128,32,5,2,8,0.0261439997702837
2,1024,4096,16,16,64,2,4,8,0.05724800005555153
2,1024,4096,16,32,64,2,4,8,0.0398080013692379
2,1024,4096,16,64,64,3,4,8,0.026623999699950218
2,1024,4096,16,128,64,5,4,8,0.02579200081527233
2,1024,4096,16,32,128,3,4,8,0.03097599931061268
2,1024,4096,16,32,128,4,8,8,0.027807999402284622
2,1024,4096,16,64,128,3,4,8,0.02703999914228916
2,1024,4096,16,128,128,4,4,8,0.02595200017094612
2,1024,4096,16,32,64,3,4,8,0.029920000582933426
2,1024,4096,16,32,64,4,4,8,0.026559999212622643
2,1024,4096,16,32,128,2,8,8,0.041120000183582306
2,1024,4096,16,64,128,5,8,8,0.025760000571608543
SAME
--------------------
2048,128,2048,32,16,32,1,2,8,0.033215999603271484
2048,128,2048,32,128,32,2,4,8,0.03049599938094616
2048,128,2048,32,32,64,5,8,8,0.030112000182271004
2048,128,2048,64,32,32,5,8,8,0.03030399978160858
2048,128,2048,64,128,32,5,4,8,0.027135999873280525
2048,128,2048,64,16,64,2,4,8,0.02505600079894066
2048,128,2048,64,32,64,2,4,8,0.024512000381946564
2048,128,2048,64,64,64,3,8,8,0.025248000398278236
2048,128,2048,64,128,64,5,4,8,0.024512000381946564
2048,128,2048,64,32,128,3,4,8,0.024447999894618988
2048,128,2048,64,32,128,4,8,8,0.024512000381946564
2048,128,2048,64,64,128,3,4,8,0.024927999824285507
2048,128,2048,64,128,128,4,4,8,0.024224000051617622
2048,128,2048,128,32,64,3,4,8,0.024992000311613083
2048,128,2048,128,32,64,4,8,8,0.02454400062561035
2048,128,2048,128,32,128,2,8,8,0.025407999753952026
2048,128,2048,128,32,128,3,4,8,0.024000000208616257
2048,128,2048,128,64,128,3,4,8,0.02457600086927414
2048,128,2048,128,64,128,5,8,8,0.024224000051617622
SAME
--------------------
2048,768,50008,32,16,32,1,2,8,1.9704960584640503
2048,768,50008,32,128,32,2,4,8,1.1633919477462769
2048,768,50008,32,32,64,5,8,8,1.3456319570541382
2048,768,50008,64,32,32,5,8,8,1.1840640306472778
2048,768,50008,64,128,32,5,4,8,1.0827840566635132
2048,768,50008,64,16,64,2,4,8,0.8267840147018433
2048,768,50008,64,32,64,2,4,8,0.5429760217666626
2048,768,50008,64,64,64,3,8,8,0.5456640124320984
2048,768,50008,64,128,64,5,4,8,0.6398079991340637
2048,768,50008,64,32,128,3,4,8,0.40985599160194397
2048,768,50008,64,32,128,4,8,8,0.42895999550819397
2048,768,50008,64,64,128,3,4,8,0.39715200662612915
2048,768,50008,64,128,128,4,4,8,0.5066559910774231
2048,768,50008,128,32,64,3,4,8,0.42847999930381775
2048,768,50008,128,32,64,4,8,8,0.43055999279022217
2048,768,50008,128,32,128,2,8,8,0.5339199900627136
2048,768,50008,128,32,128,3,4,8,0.34064000844955444
2048,768,50008,128,64,128,3,4,8,0.35708799958229065
2048,768,50008,128,64,128,5,8,8,0.35660800337791443
SAME
--------------------
8192,2048,256,32,16,32,1,2,8,0.11503999680280685
8192,2048,256,32,128,32,2,4,8,0.0875839963555336
8192,2048,256,32,32,64,5,8,8,0.09273599833250046
8192,2048,256,64,32,32,5,8,8,0.0830719992518425
8192,2048,256,64,128,32,5,4,8,0.06521599739789963
8192,2048,256,64,16,64,2,4,8,0.10556799918413162
8192,2048,256,64,32,64,2,4,8,0.08191999793052673
8192,2048,256,64,64,64,3,8,8,0.05241600051522255
8192,2048,256,64,128,64,5,4,8,0.05648000165820122
8192,2048,256,64,32,128,3,4,8,0.062111999839544296
8192,2048,256,64,32,128,4,8,8,0.05673599988222122
8192,2048,256,64,64,128,3,4,8,0.05004800111055374
8192,2048,256,64,128,128,4,4,8,0.051072001457214355
8192,2048,256,128,32,64,3,4,8,0.06464000046253204
8192,2048,256,128,32,64,4,8,8,0.05862399935722351
8192,2048,256,128,32,128,2,8,8,0.08607999980449677
8192,2048,256,128,32,128,3,4,8,0.0652799978852272
8192,2048,256,128,64,128,3,4,8,0.05040000006556511
8192,2048,256,128,64,128,5,8,8,0.043616000562906265
SAME
--------------------
512,2,1536,32,16,32,1,2,8,0.02518399991095066
512,2,1536,32,16,32,2,4,8,0.026016000658273697
512,2,1536,32,16,64,5,8,8,0.02473600022494793
512,2,1536,64,16,32,5,8,8,0.024351999163627625
512,2,1536,64,16,32,5,4,8,0.02470399998128414
512,2,1536,64,16,64,2,4,8,0.024927999824285507
512,2,1536,64,16,64,3,8,8,0.02550400048494339
512,2,1536,64,16,64,5,4,8,0.02505600079894066
512,2,1536,64,16,128,3,4,8,0.024064000695943832
512,2,1536,64,16,128,4,8,8,0.02537599951028824
512,2,1536,64,16,128,4,4,8,0.024191999807953835
512,2,1536,128,16,64,3,4,8,0.02393599972128868
512,2,1536,128,16,64,4,8,8,0.025439999997615814
512,2,1536,128,16,128,2,8,8,0.02396799996495247
512,2,1536,128,16,128,3,4,8,0.024480000138282776
512,2,1536,128,16,128,5,8,8,0.023903999477624893
SAME
--------------------
4096,512,1024,32,16,32,1,2,8,0.07680000364780426
4096,512,1024,32,128,32,2,4,8,0.049695998430252075
4096,512,1024,32,32,64,5,8,8,0.05648000165820122
4096,512,1024,64,32,32,5,8,8,0.053599998354911804
4096,512,1024,64,128,32,5,4,8,0.0560000017285347
4096,512,1024,64,16,64,2,4,8,0.037567999213933945
4096,512,1024,64,32,64,2,4,8,0.03046399913728237
4096,512,1024,64,64,64,3,8,8,0.030271999537944794
4096,512,1024,64,128,64,5,4,8,0.03843199834227562
4096,512,1024,64,32,128,3,4,8,0.025760000571608543
4096,512,1024,64,32,128,4,8,8,0.02751999907195568
4096,512,1024,64,64,128,3,4,8,0.02921600081026554
4096,512,1024,64,128,128,4,4,8,0.032416000962257385
4096,512,1024,128,32,64,3,4,8,0.028063999488949776
4096,512,1024,128,32,64,4,8,8,0.028511999174952507
4096,512,1024,128,32,128,2,8,8,0.030688000842928886
4096,512,1024,128,32,128,3,4,8,0.02848000079393387
4096,512,1024,128,64,128,3,4,8,0.02659199945628643
4096,512,1024,128,64,128,5,8,8,0.027327999472618103
SAME
--------------------
512,50257,768,32,16,32,1,2,8,2.9414079189300537
512,50257,768,32,128,32,2,4,8,0.4765760004520416
512,50257,768,32,32,64,5,8,8,1.040768027305603
512,50257,768,64,32,32,5,8,8,1.6119359731674194
512,50257,768,64,128,32,5,4,8,0.7824640274047852
512,50257,768,64,16,64,2,4,8,2.008512020111084
512,50257,768,64,32,64,2,4,8,1.1641919612884521
512,50257,768,64,64,64,3,8,8,0.8452159762382507
512,50257,768,64,128,64,5,4,8,0.9183359742164612
512,50257,768,64,32,128,3,4,8,1.2331199645996094
512,50257,768,64,32,128,4,8,8,1.2282240390777588
512,50257,768,64,64,128,3,4,8,0.8505280017852783
512,50257,768,64,128,128,4,4,8,0.9754559993743896
512,50257,768,128,32,64,3,4,8,1.431615948677063
512,50257,768,128,32,64,4,8,8,1.3787519931793213
512,50257,768,128,32,128,2,8,8,1.4793280363082886
512,50257,768,128,32,128,3,4,8,1.816864013671875
512,50257,768,128,64,128,3,4,8,6.59984016418457
512,50257,768,128,64,128,5,8,8,1.2406079769134521
SAME
--------------------
2048,128,8192,32,16,32,1,2,8,0.07791999727487564
2048,128,8192,32,128,32,2,4,8,0.07011199742555618
2048,128,8192,32,32,64,5,8,8,0.0692799985408783
2048,128,8192,64,32,32,5,8,8,0.06880000233650208
2048,128,8192,64,128,32,5,4,8,0.052032001316547394
2048,128,8192,64,16,64,2,4,8,0.04243199899792671
2048,128,8192,64,32,64,2,4,8,0.036031998693943024
2048,128,8192,64,64,64,3,8,8,0.04185599833726883
2048,128,8192,64,128,64,5,4,8,0.039135999977588654
2048,128,8192,64,32,128,3,4,8,0.0344959981739521
2048,128,8192,64,32,128,4,8,8,0.035679999738931656
2048,128,8192,64,64,128,3,4,8,0.0363520011305809
2048,128,8192,64,128,128,4,4,8,0.037376001477241516
2048,128,8192,128,32,64,3,4,8,0.03923200070858002
2048,128,8192,128,32,64,4,8,8,0.04105599969625473
2048,128,8192,128,32,128,2,8,8,0.04134399816393852
2048,128,8192,128,32,128,3,4,8,0.03702399879693985
2048,128,8192,128,64,128,3,4,8,0.03705599904060364
2048,128,8192,128,64,128,5,8,8,0.043136000633239746
SAME
--------------------
1024,1024,50272,32,16,32,1,2,8,1.2933440208435059
1024,1024,50272,32,128,32,2,4,8,0.7472000122070312
1024,1024,50272,32,32,64,5,8,8,0.8858240246772766
1024,1024,50272,64,32,32,5,8,8,0.7604479789733887
1024,1024,50272,64,128,32,5,4,8,0.642624020576477
1024,1024,50272,64,16,64,2,4,8,0.5475519895553589
1024,1024,50272,64,32,64,2,4,8,0.34540799260139465
1024,1024,50272,64,64,64,3,8,8,0.3344320058822632
1024,1024,50272,64,128,64,5,4,8,0.38201600313186646
1024,1024,50272,64,32,128,3,4,8,0.2571200132369995
1024,1024,50272,64,32,128,4,8,8,0.26927998661994934
1024,1024,50272,64,64,128,3,4,8,0.24396799504756927
1024,1024,50272,64,128,128,4,4,8,0.3110719919204712
1024,1024,50272,128,32,64,3,4,8,0.2605760097503662
1024,1024,50272,128,32,64,4,8,8,0.2643199861049652
1024,1024,50272,128,32,128,2,8,8,0.338591992855072
1024,1024,50272,128,32,128,3,4,8,0.2096640020608902
1024,1024,50272,128,64,128,3,4,8,0.2189439982175827
1024,1024,50272,128,64,128,5,8,8,0.2160000056028366
SAME
--------------------
16384,1024,4096,32,16,32,1,2,8,1.6934720277786255
16384,1024,4096,32,128,32,2,4,8,0.9479680061340332
16384,1024,4096,32,32,64,5,8,8,1.1577279567718506
16384,1024,4096,64,32,32,5,8,8,1.0143040418624878
16384,1024,4096,64,128,32,5,4,8,0.7260159850120544
16384,1024,4096,64,16,64,2,4,8,0.5400320291519165
16384,1024,4096,64,32,64,2,4,8,0.4158720076084137
16384,1024,4096,64,64,64,3,8,8,0.4222080111503601
16384,1024,4096,64,128,64,5,4,8,0.4630720019340515
16384,1024,4096,64,32,128,3,4,8,0.31724798679351807
16384,1024,4096,64,32,128,4,8,8,0.33689600229263306
16384,1024,4096,64,64,128,3,4,8,0.30134400725364685
16384,1024,4096,64,128,128,4,4,8,0.3627839982509613
16384,1024,4096,128,32,64,3,4,8,0.33638399839401245
16384,1024,4096,128,32,64,4,8,8,0.34163200855255127
16384,1024,4096,128,32,128,2,8,8,0.2932159900665283
16384,1024,4096,128,32,128,3,4,8,0.26495999097824097
16384,1024,4096,128,64,128,3,4,8,0.273824006319046
16384,1024,4096,128,64,128,5,8,8,0.26604801416397095
